job_title,salary,company,location,is_remote,job_rating,job_summary,post_date,extract_date,job_url
FCC Data Scientist,,BankUnited,"Miami Lakes, FL",,3.7,"At least 3 years working with data modeling, software implementation, enhanced reporting analytics or related experience preferably with a financial institution…",30+ days ago,2021-01-15,https://www.indeed.com/pagead/clk?mo=r&ad=-6NYlbfkN0CUY_ubqJNwV1HvMpVGbSErv9znY6OaFChsNPHPFkuWJXdQKNey0Vjx99U4YFCV8jKUcDlyb38lvOOVx_yrIkqm36kdp2OLNa4JqxGGMNzIDB_6UMKVaIvodPIVmm7bcnMwUGfctZnuF-HtK4L3fFD9XZ9gMMUQLPOT4anCnzNkyLitUGw7QP6w7GXH86s12jGlDVytEuYU61u5u9x5Rpe_grbcDGbOnA0Wiu6tstvZvmPYJer2_vyCzeJwVr4-feoFeODZpUCK5L0z9bML3r6sKpTthRM-9k1xC5BBDYvHoGf5idTV6TGZGLIO2NyHadSQwg1q85YoLOZ7MkZMkOtsQOlUGhuCJYTKwMo7HPpPpPUGPHHQJhL-OoN5AYae2RuQVe9vwSTgpIL5eyioOgDxmwyXy8NYnV4CAHjXXLfmZ8f8DcqLtQ9qUaBENpz8XIkFOkdtCc-58Sv-mke0Kbgi69jLWDART9Ntf4wLRsym6T7mdrERJjqMvqGtw6_rL-ti4EdXOWJ6TQaxeb2sVTIY0Zvb72P_fvV3v-P9_Xh1yw==&p=0&fvj=0&vjs=3
Associate Data Scientist,,NextEra Energy,"Miami, FL",,3.9,"Employees in this role use knowledge of machine learning, optimization, statistics, and applied mathematics along with abilities in software engineering with a…",8 days ago,2021-01-15,https://www.indeed.com/rc/clk?jk=673e1f3a7ae84972&fccid=ee1723cae957f03e&vjs=3
Data Science Position [various levels],,Royal Caribbean Cruises Ltd.,"Miami, FL",,4.2,"Apply several forms of statistical (hypothesis testing, sampling, modeling, probability, time-series) and machine learning (neural networks / deep networks,…",3 days ago,2021-01-15,https://www.indeed.com/rc/clk?jk=c1e25c2a62ad064f&fccid=fa65a3fcc2b211c1&vjs=3
Data Scientist,,Excel Impact,"North Miami, FL",,,"Minimum of 3 year of data analytics experience.
Minimum of 6 years of data science / machine learning experience is required.",22 days ago,2021-01-15,https://www.indeed.com/rc/clk?jk=c9a5ca3f64fdfc0a&fccid=33729ea3607d755a&vjs=3
Data Scientist,,Sourceability,United States,Remote,5.0,"We are seeking a hands-on Senior Data Scientist to skillfully apply mathematics, statistical analysis, machine learning, prediction, and other data science…",30+ days ago,2021-01-15,https://www.indeed.com/pagead/clk?mo=r&ad=-6NYlbfkN0ADvRi4Fhzo6Lhixq24Efpt7RwpjKDyUQihLKB9436vvhUCqFEm-nkW0la8YnoGNEFh8i3JW6ZTXhE4DkVrso5T3Vz8yXJdq2dJLsgTANS_yKbR-JYOMuO2e5aBVxks2k6rMMP9qB20LAKyRlZvk7-84WO46AyQ2moZGjxCJmldcEsitmXLLHDrd1i2j855swC3fy0zouQGtQV5uB1XkUcLSJ94fqJirEC4cbfzD4goAvTdqpYIU8kgW5zL9lKBSvKOOjUzORuGKEba3u3-iASf6HM98--4HW0NyaCUKL7uPW62XezfUooJaoX9QNHzdC1SrQ05hsBYJnoXOcDRr_mpYc9gj0xIRsD34WMQrGfY1Yh1A3jK31PbOqGsY6NQ7k3USxDGA0sH7BSP36pL3gsn8xJ0fUMeO1WYdv7AkhldSrifa3oFHSdjA-TmprbosWfCqqLCy3GxPopmkkp8pR5v&p=4&fvj=1&vjs=3
Cloud Data Services Associate,,PRICE WATERHOUSE COOPERS,"Miami, FL",,4.0,"Hardware: sensors, robotics ,Raspberry Pis, GPU enabled machine learning, FPGAs, etc;
Creating end-to-end technology prototypes and/or machine learning models…",1 day ago,2021-01-15,https://www.indeed.com/rc/clk?jk=4d5fdec2759b4bb9&fccid=5e964c4afc56b180&vjs=3
Data Scientist,,777 Partners,"Miami, FL",,3.7,"The Data Scientist will focus on applying data mining techniques, doing statistical analysis, and building high quality prediction systems integrated with our…",30+ days ago,2021-01-15,https://www.indeed.com/rc/clk?jk=600e619fe702934c&fccid=507c7a08b38f4720&vjs=3
Senior Data Scientist,,CreditNinja,"Miami, FL",,,The hire will focus on building machine learning models and running exploratory data analysis to make a direct impact in a data-driven company.,30+ days ago,2021-01-15,https://www.indeed.com/rc/clk?jk=17eb979a3e01ca81&fccid=1dab4c8ea57f7279&vjs=3
Head of Data Science,,REEF,"Miami, FL",,3.3,"Build and hire a team of data product manager, data scientists and ML engineers that will build lasting solutions.",11 days ago,2021-01-15,https://www.indeed.com/rc/clk?jk=54ab8710025fd39d&fccid=7aceedc6cd872b57&vjs=3
Senior Data Scientist - Visa Predictive Models,,Visa,"Miami, FL",,3.9,Responsibilities include projects on time and within scope with an in-depth knowledge of big data and cutting edge data mining techniques as well as the use of…,30+ days ago,2021-01-15,https://www.indeed.com/rc/clk?jk=95d7666484e6205a&fccid=a3f737e511d9fc8c&vjs=3
AI specialist,,Fresko,"Miami, FL",Remote,,"Strong background in deep learning and serious understanding of state-of-the-art DL / DRL techniques.
Experience with deep learning-based product development.",5 days ago,2021-01-15,https://www.indeed.com/company/Fresko/jobs/Ai-Specialist-0008f6504ce3f1b5?fccid=95201c0c4a4a67e2&vjs=3
"Lead, Data Scientist",,Royal Caribbean Cruises Ltd.,"Miami, FL",,4.2,The position demands an inquisitive individual who can direct a team of other data scientists and machine learning professionals to deliver.,30+ days ago,2021-01-15,https://www.indeed.com/rc/clk?jk=8e0f88fae4e0f0b4&fccid=fa65a3fcc2b211c1&vjs=3
Data Scientist,,Sabal Tech,"Fort Lauderdale, FL",,,"Ability to structure data for business use case visualizations.
5+ years hands-on experience with relevant technology.
AWS, GCP, Azure ecosystems or similar.",30+ days ago,2021-01-15,https://www.indeed.com/rc/clk?jk=40ecefa8f8e01972&fccid=c33fdc15cbce939d&vjs=3
REMOTE: Sr. Data Mastery Engineer / Data Analyst,,"Accolite, Inc.","Plantation, FL",Remote,,"The Client is looking for a consultant to be part of the EDF project.
Mainly looking for DATA Analyst with AWS and Glue catalog, Data mastery, data analysis,…",8 days ago,2021-01-15,https://www.indeed.com/rc/clk?jk=79c8c1acb9244530&fccid=e1951f74f473b3be&vjs=3
Data Science QA,,CapB InfoteK,"Miami, FL",,,"During design, development and testing, recognizes issues and takes responsibility for major issues to ensure that an effective solution is reached;",30+ days ago,2021-01-15,https://www.indeed.com/rc/clk?jk=abd5dca2e8a10965&fccid=5033463af3c58699&vjs=3
Artificial Intelligence Data Scientist,,Booz Allen Hamilton,"Homestead ARB, FL",,3.9,"You’ll develop algorithms, write scripts, build predictive analytics, use automation, apply machine learning, and use the right combination of tools and…",30+ days ago,2021-01-15,https://www.indeed.com/rc/clk?jk=fa52c454c33a379b&fccid=4e041af1d0af1bc8&vjs=3
"Senior Data Analyst, Operations",,Clear Spring Health,"Miramar, FL",,,"Minimum 3 years of Health data analytics experience required; 5 years preferred.
Reporting directly to the Vice President of Pharmacy Operations, as a Senior…",7 days ago,2021-01-15,https://www.indeed.com/rc/clk?jk=727ede7e9fe5b34c&fccid=fd1c491400b58ebb&vjs=3
"Lead Data Scientist, Marketing Modeling",,Bankers Healthcare Group,"Fort Lauderdale, FL",,4.1,"Expertise with coding in R for data modeling, machine learning, regression and statistical analysis.
The candidate will be responsible of providing support to…",10 days ago,2021-01-15,https://www.indeed.com/rc/clk?jk=b17b89fc8710d980&fccid=5a91fd675c45515f&vjs=3
Data Scientist,,Sourceability,United States,Remote,5.0,"We are seeking a hands-on Senior Data Scientist to skillfully apply mathematics, statistical analysis, machine learning, prediction, and other data science…",30+ days ago,2021-01-15,https://www.indeed.com/pagead/clk?mo=r&ad=-6NYlbfkN0ADvRi4Fhzo6Lhixq24Efpt7RwpjKDyUQihLKB9436vvhUCqFEm-nkW0la8YnoGNEFh8i3JW6ZTXhE4DkVrso5T3Vz8yXJdq2dJLsgTANS_yKbR-JYOMuO2e5aBVxks2k6rMMP9qB20LAKyRlZvk7-84WO46AyQ2moZGjxCJmldcEsitmXLLHDrd1xNH50CnWTldI4gaCUvHnZWWEJHDISr9lRP_QtBDG1PgE8OZnhEGx0-N7Sbav0UH946F1CQX8aXQ3lq_YSVKwf_M8WO55ye3HS1bgmI0Bosw8siabrGND2AkBanzRlNiwoCttc5lpwl16VC0vBzX8CzG0NYASJjkqLZXiwz_o3yyjC2Y-UX3HKj7fXu6idhMeEbCTnyZk_VEU7naC31ceKJh8F6hAXbwjBVP0EN6Tzem9SYhoMNMTLACnwrQ5fg_MI7t5wTdddcFBpDbj7XRWzGZc-5terq&p=3&fvj=1&vjs=3
AI Research Engineer,,Exscientia,"Miami, FL",,,Familiarity with major machine learning frameworks such as scikit-learn or PyTorch for building machine learning models and deep neural network architectures.,15 days ago,2021-01-15,https://www.indeed.com/rc/clk?jk=230a8e753ff3e9ce&fccid=5e6ed086be5ae8fc&vjs=3
Data Scientist II-Care Transformation (UTower),,University of Miami,"Miami, FL",,4.1,"Responsible for utilizing data driven techniques to push clinical care variation reduction, clinical/business process improvement, quality management,…",30+ days ago,2021-01-15,https://www.indeed.com/rc/clk?jk=a11cdf6e2b3e8538&fccid=ec40e650131b4ee3&vjs=3
"Technical Development Program (TLP), Machine Learning Internship 2021 (Miami)",,Restaurant Brands International Campus Opportuniti...,"Miami, FL",,3.2,"Open source project contribution experience.
The Key Projects will reflect problems or issues related to RBI's Marketing Intelligence opportunities and…",30+ days ago,2021-01-15,https://www.indeed.com/rc/clk?jk=d4a280523c047833&fccid=1bf77f1dd2c2631f&vjs=3
"Artificial Intelligence, Consultant - Applied Artificial Intelligence",,Deloitte,"Miami, FL",,4.0,"Perform data studies and data discovery routines for video, voice, weblog, sensor, machine and social media data sources or mash ups of new and existing data…",30+ days ago,2021-01-15,https://www.indeed.com/rc/clk?jk=715fb14b7419bc88&fccid=9e215d88a6b33622&vjs=3
Senior Merchandising Data Analyst,,Chewy,"Dania Beach, FL",,2.7,"Partner with internal analytics, data engineering, and BI teams to develop and QA new data tables and data sources across multiple platforms.",2 days ago,2021-01-15,https://www.indeed.com/rc/clk?jk=4008705ffb95d5e9&fccid=b6add0e6a71f1008&vjs=3
Associate Manager Statistical Programming,,MMS Holdings Inc.,"Miami, FL",,,"Basic understanding of CROs and scientific & clinical data/terminology, & the drug development process.
Bachelor’s or Master’s degree in computer science,…",30+ days ago,2021-01-15,https://www.indeed.com/rc/clk?jk=d8352cea60877767&fccid=d652aee539183dab&vjs=3
Principal Data Scientist - Visa Predictive Models,,Visa,"Miami, FL",,3.9,Responsibilities include projects on time and within scope with an in-depth knowledge of big data and cutting edge data mining techniques as well as the use of…,30+ days ago,2021-01-15,https://www.indeed.com/rc/clk?jk=7ebfbee4c0703c40&fccid=a3f737e511d9fc8c&vjs=3
Senior Data Analyst,,American Bancshares Mortgage Llc,"Miami Lakes, FL",,,The Sr. Data Analyst will use data mining and statistical techniques to drive automated insights and operational directions based on structured and unstructured…,30+ days ago,2021-01-15,https://www.indeed.com/rc/clk?jk=320b5264a8ff6fb2&fccid=97b7274e3fa0a943&vjs=3
Machine Learning Developer,,Viramar Worldwide,"Fort Lauderdale, FL",,,"4 or more years of hands-on experience developing big data, machine learning, and/or AI applications.
The Machine Learning Developer will work with a team of…",30+ days ago,2021-01-15,https://www.indeed.com/rc/clk?jk=e0f2b7fae2d3a86c&fccid=5b7359346506364a&vjs=3
Senior Statistical Programmer,,MMS Holdings Inc.,"Miami, FL",,,"Demonstrates strong understanding of ICH guidelines, as applicable to clinical programming.
Develops programs, verifies, validates, and maintains clinical trial…",30+ days ago,2021-01-15,https://www.indeed.com/rc/clk?jk=3ae9341226ab3099&fccid=d652aee539183dab&vjs=3
"Director, Data Science",,Chewy,"Fort Lauderdale, FL",,2.7,"Hire, develop and lead a team of data scientists, statisticians and analysts.
You will surface deep insight hidden in our data lakes and provide tactical and…",30+ days ago,2021-01-15,https://www.indeed.com/rc/clk?jk=ad473cbb14c9635d&fccid=b6add0e6a71f1008&vjs=3
"GCP Cloud Enablement - Analytics & Cognitive, Consultant",,Deloitte,"Miami, FL",,4.0,"Drive operational efficiency by maintaining their data ecosystems, sourcing analytics expertise and providing As-a-Service offerings for continuous insights and…",30+ days ago,2021-01-15,https://www.indeed.com/rc/clk?jk=04a8683379f32922&fccid=9e215d88a6b33622&vjs=3
"Computer Vision Architect, Manager - Applied Artificial Intelligence",,Deloitte,"Miami, FL",,4.0,"Strong knowledge of machine learning, deep learning, image processing, computer vision.
Drive operational efficiency by maintaining their data ecosystems,…",30+ days ago,2021-01-15,https://www.indeed.com/rc/clk?jk=13d719f76f00b092&fccid=9e215d88a6b33622&vjs=3
"Conversational Artificial Intelligence Architect, Manager - Applied Artificial Intelligence",,Deloitte,"Miami, FL",,4.0,"Strong knowledge of machine learning, deep learning, natural language processing, neural networks, dialog systems, dialog management, and natural language…",30+ days ago,2021-01-15,https://www.indeed.com/rc/clk?jk=ffe9bfafcb173337&fccid=9e215d88a6b33622&vjs=3
"AWS Cloud Enablement - Analytics & Cognitive, Consultant",,Deloitte,"Miami, FL",,4.0,"Drive operational efficiency by maintaining their data ecosystems, sourcing analytics expertise and providing As-a-Service offerings for continuous insights and…",30+ days ago,2021-01-15,https://www.indeed.com/rc/clk?jk=b9c03941f99ff2e6&fccid=9e215d88a6b33622&vjs=3
"GCP Cloud Enablement - Analytics & Cognitive, Senior Consultant",,Deloitte,"Miami, FL",,4.0,"Drive operational efficiency by maintaining their data ecosystems, sourcing analytics expertise and providing As-a-Service offerings for continuous insights and…",30+ days ago,2021-01-15,https://www.indeed.com/rc/clk?jk=d30aabaca52cc89e&fccid=9e215d88a6b33622&vjs=3
"Azure Cloud Enablement - Analytics & Cognitive, Senior Consultant",,Deloitte,"Miami, FL",,4.0,"Drive operational efficiency by maintaining their data ecosystems, sourcing analytics expertise and providing As-a-Service offerings for continuous insights and…",30+ days ago,2021-01-15,https://www.indeed.com/rc/clk?jk=4987f05be4dfe054&fccid=9e215d88a6b33622&vjs=3
"Artificial Intelligence, Manager - Applied Artificial Intelligence (Full Stack Developer)",,Deloitte,"Miami, FL",,4.0,"The Analytics& Cognitive team leverages the power of data, analytics, robotics, science and cognitive technologies to uncover hidden relationships from vast…",30+ days ago,2021-01-15,https://www.indeed.com/rc/clk?jk=167f769d799af6dc&fccid=9e215d88a6b33622&vjs=3
Data Scientist,,Sourceability,United States,Remote,5.0,"We are seeking a hands-on Senior Data Scientist to skillfully apply mathematics, statistical analysis, machine learning, prediction, and other data science…",30+ days ago,2021-01-15,https://www.indeed.com/pagead/clk?mo=r&ad=-6NYlbfkN0ADvRi4Fhzo6Lhixq24Efpt7RwpjKDyUQihLKB9436vvhUCqFEm-nkW0la8YnoGNEFh8i3JW6ZTXhE4DkVrso5T3Vz8yXJdq2dJLsgTANS_yKbR-JYOMuO2e5aBVxks2k6rMMP9qB20LAKyRlZvk7-84WO46AyQ2moZGjxCJmldcEsitmXLLHDrIOTHAWCzNlklVdd5CauhqbKqpCAot0QyqHrmlatXXOj3f-8BVbZZDS2zimynR7RNz9I9iV_qNTA42009KWEz1kumExDtoX_hdRKZaFVUtMpWbmbZjEv8FaW4mMhZjZikPm3Uy1S3nSkg7X6JLGFeAAvjeQ0gJQFhgFaCMXtTT9dEMQe8nc_t2QHJpjiwbJPvb0bnBEn9JqYx5tNJfKaWneJJ6-4fVwYKHnaWxwy9NGBJNNAnTQrbBby0q8Gyh8IRmdKooj9vKlg4oLcoGQOb7P3YGGm0mQnn&p=7&fvj=1&vjs=3
"Tenure-track, open rank, Machine Learning, Deep Learning in Mechanical Engineering",,Florida International University,"Miami, FL",,4.3,We seek a candidate within the specific area of machine learning and deep learning applied to multiple focused areas of mechanical and materials engineering…,30+ days ago,2021-01-15,https://www.indeed.com/rc/clk?jk=6043c65f06ec3979&fccid=9d7d68aaaf164604&vjs=3
"Azure Cloud Enablement - Analytics & Cognitive, Consultant",,Deloitte,"Miami, FL",,4.0,"Drive operational efficiency by maintaining their data ecosystems, sourcing analytics expertise and providing As-a-Service offerings for continuous insights and…",30+ days ago,2021-01-15,https://www.indeed.com/rc/clk?jk=83481914b808beed&fccid=9e215d88a6b33622&vjs=3
"Software Engineer, Machine Learning",,Postmates,"Miami, FL",,3.0,"Good understanding of common families of machine learning models, feature engineering, feature selection and other practical machine learning issues, such as…",30+ days ago,2021-01-15,https://www.indeed.com/rc/clk?jk=f393c14ae93e3963&fccid=724434d31cc1a378&vjs=3
"Artificial Intelligence, Consultant - Applied Artificial Intelligence (Full Stack Developer)",,Deloitte,"Miami, FL",,4.0,"The Analytics & Cognitive team leverages the power of data, analytics, robotics, science and cognitive technologies to uncover hidden relationships from vast…",30+ days ago,2021-01-15,https://www.indeed.com/rc/clk?jk=95e33988384c569b&fccid=9e215d88a6b33622&vjs=3
"AWS Cloud Enablement - Analytics & Cognitive, Senior Consultant",,Deloitte,"Miami, FL",,4.0,"Drive operational efficiency by maintaining their data ecosystems, sourcing analytics expertise and providing As-a-Service offerings for continuous insights and…",30+ days ago,2021-01-15,https://www.indeed.com/rc/clk?jk=4afb16721d7b6df4&fccid=9e215d88a6b33622&vjs=3
"Artificial Intelligence (Full Stack Developer), Senior Consultant - Applied Artificial Intelligence",,Deloitte,"Miami, FL",,4.0,"The Analytics & Cognitive team leverages the power of data, analytics, robotics, science and cognitive technologies to uncover hidden relationships from vast…",30+ days ago,2021-01-15,https://www.indeed.com/rc/clk?jk=a2ebe7bc9135291e&fccid=9e215d88a6b33622&vjs=3
