job_title,salary,company,location,is_remote,job_rating,job_summary,post_date,extract_date,job_url
Customer Engineer - Active Directory Engineer,"$68,739 - $89,000 a year",JDA Technical Services Group,United States,Temporarily remote,4.3,"Understand risks associated with Domain Controllers has virtual machines.
CE’s are some of the most distinguished & highly accredited engineers in the world.",29 days ago,2021-01-15,https://www.indeed.com/pagead/clk?mo=r&ad=-6NYlbfkN0BHUG_3ayLhII14Y5cvDVfdL_mMdinyvrblje7frGdMn6-Ntgf7wBbIyKL6hF8p2lB8nZy0NtPEz3RGhmOGvtcjMozvXrWtqHr416SbSwGldl0dg60Jz8T9uX7I2TM6jBIBDUnC4capB0uBkV9FEQuH6gHx9zq2OBsV-wgdyoKwQpit5RVvt7Y5Yfpq9_crO0EFPLPrgn7cqtOu-I5hxlUpXybtDV7IKGRNAOM6TQQsUmemCnFSYmMcCTmwh-54u_izTYCPmvVZinRvOFllj8sKLISjb7fN5VVf3PCPepGvDPgcXcEp36uB31-OMOtDxi9ju9r8xz-ei6ixcD30R2u1SXACjnsd11de_g2Zp8vWZR4RK8KuvXmA8-aDiqIu8K7hxuMDtUZjh54_-F_EImNcwy89WTJug8zDpoqgmrLXBSiETfQtZJX4MXPDfJKq8gmddlEBunScLlNk7xCMh5HeDREzeP9zz1PpAna8F4gFvra7T1-bX1KY&p=0&fvj=1&vjs=3
Principal Software Engineer PSJH,,Providence Health & Services,"Anchorage, AK",,3.9,"You are adept at designing and documenting systems, writing code spanning vast expanses of the software engineering ecosystem: from a full-stack engineer, to…",2 days ago,2021-01-15,https://www.indeed.com/rc/clk?jk=e5e6e28c5c921fc3&fccid=84c8ed4c8205d753&vjs=3
Health Program Manager II (2433M),"$4,914 a month",State of Alaska,"Anchorage, AK",,3.9,"Must be comfortable being transported on small planes, boats, snow machines and four wheelers.
Under the general direction of the Health Program Manager II…",30+ days ago,2021-01-15,https://www.indeed.com/rc/clk?jk=944d4a22156647fe&fccid=d8e73bc8caeb8a6c&vjs=3
