job_title,salary,company,location,is_remote,job_rating,job_summary,post_date,extract_date,job_url
Data Scientist,,Sourceability,United States,Remote,5.0,"We are seeking a hands-on Senior Data Scientist to skillfully apply mathematics, statistical analysis, machine learning, prediction, and other data science…",30+ days ago,2021-01-15,https://www.indeed.com/pagead/clk?mo=r&ad=-6NYlbfkN0ADvRi4Fhzo6Lhixq24Efpt7RwpjKDyUQihLKB9436vvhUCqFEm-nkW0la8YnoGNEFh8i3JW6ZTXhE4DkVrso5T3Vz8yXJdq2dJLsgTANS_yKbR-JYOMuO2e5aBVxks2k6rMMP9qB20LAKyRlZvk7-84WO46AyQ2moZGjxCJmldcEsitmXLLHDrOtBdBIyBerZFadqfyKNWcJ_fZbOR5ctty9zfeiGoBY8NG3DVXBZRctBxhPSZowrJ8IMWl2KP-6jtPa9LOCyUiazxt32wfLR6KNhzbHr7R7kMeE6vM0Gym4EEKZap4nSZB_IcW8hmBzZt7YVnT-fzJBaF0Kz8xQzlRPjJHGr-yxaGweiJamCC8nHI8SIa7F5s2C-xPhxJ633G_k3ER61FjP3zQtmFymsxxq8zSBHkpfhwWxEdkL4A9XfmhKmFWgzl0A-BQNJa21BllhyKnp2H8A==&p=0&fvj=1&vjs=3
Data Analyst II / Sr Data Analyst,,Raytheon Missiles & Defense,"Tucson, AZ",,3.9,"Creating repeatable processes and scalable data products in collaboration with the advanced analytics team.
Collaborating with data owners and technology teams…",30+ days ago,2021-01-15,https://www.indeed.com/rc/clk?jk=2e5b2c5b60c6962a&fccid=aa53b551f9df0210&vjs=3
Senior Data Analyst,"$52,024 - $75,145 a year",University of Arizona,"Tucson, AZ",,4.3,"Outstanding UA benefits include health, dental, and vision insurance plans; life insurance and disability programs; paid vacation, sick leave, and holidays; UA…",30+ days ago,2021-01-15,https://www.indeed.com/rc/clk?jk=44da28aff3a8f61e&fccid=5a681cdfb59f0cce&vjs=3
Sr. Data Analyst,,Chamberlain Group Inc,"Tucson, AZ",,3.7,Act as the distribution technology and operational liaison to IT and external solution supplier for analytics and reporting projects.,30+ days ago,2021-01-15,https://www.indeed.com/rc/clk?jk=16c5330dbb7ab596&fccid=969ac0c32a4ed39d&vjs=3
Senior Distribution Data Analyst,,"V-Soft Consulting Group, Inc.","Tucson, AZ",,3.4,Act as the distribution technology and operational liaison to IT and external solution supplier for analytics and reporting projects.,2 days ago,2021-01-15,https://www.indeed.com/pagead/clk?mo=r&ad=-6NYlbfkN0D9RE-Si7ybiUgDiZLiiQYmpNk9Vbzm2gLbPAQW_p1zE3jUynzuC9mQeE4jvLF4MlR3XNf5hOYk5vpLxT1mXmwC-qUpZR55WKHP1a8CLPVV8OPPv_k0ta7pvktWQYq2e3k9RyZlSXr1-sjYKLor8z_06d390loBas0N1CR_RKJc9NBcpxoAvLkca6COugoG_8nRpJlP-DCGHB0OgmlwRF2qjMp9xlm_H-XTbBd6M1Ey4hd1oT8xj_TwWu6D9-Vk7yOlS58Df9vcEoqUd43ZJ5OWpt6StiGjYu8_t7TkgU3Ar8WTmsM57JFM-l_RbDm9zqWXeY2V6FLkXpYxZnCq9fg1sMp0vDUvU0kG4E9Z3wzX9bn1xW0EHqrGkB1ysI37i2TixxQ2OYH2Crn6rJsXETnRbbxedgQtaTKNzTSTgyRxzSLuVkoJlG1uBSiTBd_dfT-WWyVpnJO3DA==&p=4&fvj=0&vjs=3
"Executive Director, Data Science, Assessment & Evaluation",,University of Arizona,"Tucson, AZ",,4.3,"Outstanding UA benefits include health, dental, and vision insurance plans; life insurance and disability programs; paid vacation, sick leave, and holidays; UA…",30+ days ago,2021-01-15,https://www.indeed.com/rc/clk?jk=3281f07863b03e39&fccid=5a681cdfb59f0cce&vjs=3
"Quantitative Medicine Scientist, RWD/NLP",,Critical Path Institute (C-Path),"Tucson, AZ",Temporarily remote,,This individual develops solutions within their area of responsibility by identifying the most appropriate quantitative methods guided by scientific and…,30+ days ago,2021-01-15,https://www.indeed.com/rc/clk?jk=8f67d5570972b199&fccid=376f7f96e8ff00d9&vjs=3
