job_title,salary,company,location,is_remote,job_rating,job_summary,post_date,extract_date,job_url
"Acoustic Signal Processing Engineer - Data Scientist, Machine Learning",,Signal Systems Corporation,"Columbia, MD",Temporarily remote,,"Can design and build state-of-the-art machine learning and deep learning algorithms.
\* You will collaborate with engineers from other organizations to support…",4 days ago,2021-01-15,https://www.indeed.com/pagead/clk?mo=r&ad=-6NYlbfkN0A2NX-yk-5saWumjHCeW1U7wjRG-yaZl6appTnwIWK0f0j4yN2ZzSx2dhxoGkkKUc4oHx9AVk35NZ-yAvwgpz-2CSTAURRcWk54sSv_p7tDiDiB-ZK4umuf4xTngB195bh54zLkr09Ed6JkfEUNYkqedvQCx64lLlbyWrro6Xkke1YVpBuMl2Kx_WXzFTR6rgf355_nYE4kTQhxcC8H78K08Ka7bYUMurj-fircDHcAVyOJA3uVSE8WFYXW1Sg_3ZQ_j7r65WVR1x58wq8L_iIZTbiJhZ2GS81DawwG9OiWDhToxw0TRSn3DlKTn4I-J-NDN6Y48EUM3T94JiQc5_PD5vQxFufS2lBti0gTLcsJUNDdBXx9mXRh0D8iNW7Gm96yLe1a2xe8XiRuE4i9cmZebjurWEAedXRxgVox1C7pXiGMtpZTDX7xg_vQ7xqzQg7GBuIFcMG-a7EkE7h7js131gwXh2A1mYa_hkTXFe6btTO4INyrywb9JR4OcgKM-YfvN3TMFoAUrXXKin_E99Zi&p=0&fvj=1&vjs=3
Research Data Analyst/Software Engineer,$31 - $40 an hour,Neurogazer USA,"Baltimore, MD",Remote,,"Candidates should feel comfortable learning new tools and technologies quickly and independently, and those familiar with Python and Bash as well as basic…",10 days ago,2021-01-15,https://www.indeed.com/pagead/clk?mo=r&ad=-6NYlbfkN0BJJBdCULplSEaeHpey-r39yKRVIFGrHTfg0M0DIHj38P7aW7lYUe3HjiD0ZNXK-qtgaj2PpbHvQgKjbjV6FazgrrHpmNTP2rxSRX8YO_ORrqoSPAdEAPfrIJjQ1jJjB7mtqZ8pURMxdAjKpQ0ZhdUO0evAgRlv-lMSaJRYvjPYerDnfXg1myfSJvGpqasBmRLhA3mlENU9OgDJ5ZbHSzepUieNWbeZoGqkYg3jUPnZq3axK7KXw-GwutOUvYf6vAQ1mFoeOZjHj5IVQPKoWjYV8a9pthgLOdQFOFsooz4VMzhnU_xOxyd2TfSpvRxOLRRx6NOR3AYRFbLklzyosce1jDgtNm9zkR6u4IaEy_KuEwcJV5qRefsvV0L0rcbNaJSTU4dhYtSvmBM3cqp2tt4ld2K0BkZWKs5gTCNl4IPbGoGWEz8FoarJNo7WwsUhbptI1CEu6g6yajx_F4tdVm8mhJ7lDW8lgfxrn7LzZZ3f4V34zOX7VXwI&p=1&fvj=1&vjs=3
Medical Imaging Scientist,"$90,000 - $100,000 a year",The Focus Foundation,"Crofton, MD",,,The main areas of our imaging research include fNIRs in children and adults with genetic and metabolic conditions as well as development of DL and machine…,29 days ago,2021-01-15,https://www.indeed.com/pagead/clk?mo=r&ad=-6NYlbfkN0BGcwyYL3SMOUlcMXIePvYyYaMOlQe31gDNcZpv7BaIW3Wi3Cp5Ffx6Jl1kM_pdOlYxV_GHAcd4HOq2k7kVA4oIPl9o9iQHml_LzzdGwfvF1hVU_Z1hk1wMHoc9x59bz_GQLd77qHQFtMRjlPWNBfwFh83LnSQRu2wkRMiD2zzngR64Mj1kmtTrYtN4xYaS74eyf2N_fdiM2lEV-52tABXC0ABWb0JRAYp3unAh7nQLlerD_p511dppm-6YO5h8DqhOAFU_i-wcOMSHxII0_pMPrHMkxIXlJsT13_4VzxkdYSkYlJN3OL5NQQ8xli0UAroRiYRe2IeSRN7c_Hbsi5XPHgm8OoLKvYwAc-F0IDXyrvLYxj_K7np1qGNOMN1zgatcD5QWX1QSp6pWvmlmZ8r7HjSL70fWh_GuAFZcXPDT6Y9dwJ7ewxJMGMMQFM263wr-bGwRtEV2SjD4u2_BiUlHOC1rbzHYHcWipFMsciSBSg==&p=2&fvj=1&vjs=3
Prototype Metrologist,,Stanley Black & Decker,"Towson, MD",,3.6,"Ability to read and comprehend engineering, machine, and process drawings.
Communicate effectively with machinist and engineers on the status of parts during…",30+ days ago,2021-01-15,https://www.indeed.com/pagead/clk?mo=r&ad=-6NYlbfkN0CAKa9X1rhwc3pNs7zo7W4tV5xThjHL7xzK8hVrbodY_0qvNqxM5WkQAa2peUD7nh47qx7Vv4iuu0Z6Qe-4aufnVDu54rkJXoZQSFtUHmpGxp1Ue-6s1dKmx1RE-c_K8VIOWDKZs8BPTVWEFbZ3cEMwDNCKRbNyapYb3TzEoEquMBV4A_KGJnNfDnJWUo_cZtuy4RRvmwtaw4tcC_18NmCO8nOwU6oKNyC7LzNcWfL-0-KbLan2BxWcasDuh10Ij_wZSIq7kasQlZjtdepoSS0XxRbYyKHB8am-D8CyJzoJVTxrIknpnFKXJTV7Vzl1Hk6lb0Nb9YETZ_kRAZGn3HiFXvYdiw4PKrnb4eV9M0wHx2FyH-MIcc0oSeFTT-OcSsJTxYmSt-6UkVUQxKpPmXIFckrl3NHnMHWHUGQzIdMfP8Xb2L1KicvrPPBmVTSYeaLFGKv2YGqabVWEvLt-r9wCnv1d4JJM6P0a0OFsRnRzhTawGBUuhCeM9ksfMriRpY9o5CBEt_DOfLdPBH8wtQBSNrTjhoAUw1A0xVuHw311Z8amxvehKGJA&p=3&fvj=0&vjs=3
Autonomous Vehicle Systems Engineer,,Textron Systems,"Hunt Valley, MD",,3.7,We want engineers who can apply new technologies such as machine vision and machine learning to multi-domain automation tasks and communicate their approaches…,30+ days ago,2021-01-15,https://www.indeed.com/pagead/clk?mo=r&ad=-6NYlbfkN0CMBS5B041_Y8ZzbX96acfEwfe9nE43utDAET7SJzUSwZUaIW1cGVDkJ94Qyb-AfztFjoq4Yym9fqLoKDb6GQDGO5mo7HlycqPl52mSKUyxAnX2Z-lz1MqXFtgSOAUGbw6rEPTThKMRzru3hQdAhNwHds6CBp9k2RnhwmyLrcROq0n144DGYjPnkvwEPrM6es90pPTzzGvc5trylMhpdIg_FM7rWqDLTuO1eBOjVpyq-3_1HS_TzCPe7r5ApvQ4YDQp8eiBzhfb42TiWf-vRy-SJXbXItcNZdctJLSLesPGhFyeMC7Rjz6r3tluQ4i_UA5v4qpllvQSc1AT0mtMhJIn04pG7IS93WFx8mwngY9VAN-LzWPm08P6Q6BY-abAy7_W3J_JP5dEPRmVsR_QfapnIeJHEXJ4WKVE11kh_l0h74k233rxXpzuifydbBQRel8AhjshkltdFQRnFi6RdQ8zqzcL-MSk32Qj7uTQyCTFW4pEblqy0biT5AJOmcKZ7H7iUl2raPTzHdfywZT-zqE9FaKnAbwRE1DmYkj4L03CjA==&p=4&fvj=0&vjs=3
Computer Scientist - Software Engineer/Cyber Developer,"$84,529 - $113,362 a year",National Security Agency,"Fort Meade, MD",,4.2,"Information retrieval, machine learning, artificial intelligence, statistics and analytics.
Salary offers are based on candidates' education level and years of…",Today,2021-01-15,https://www.indeed.com/pagead/clk?mo=r&ad=-6NYlbfkN0AC5S5KfpcrE62cRuYLg6qW_HWiPjKHP06qk-AGfbwYtGlr3wcSMURH9oqKq1q2FCfIzx_id58ldyeFnFrZ7UVskFwS-ixrNJ0ZvBeR5dzRRV6ssg8-iB2xyQJa7KbKA4ECtfJce33zoJe7WQKL873ccQwYBG4o0WTyoHCEzQI687P0q1hx4IPjoHW3POsAb2PBKroNRvgTbWFQP3fAPFJplWMFVlIp5D71mEKMTmKW_zNbrGQFeLq3uVDPOYnDtqtQ5JT5npGxVDixS1GlSXM65Xpil5jbMgMFw0Nfg9c4ESGU3ksdIfy9neNl-DR3EsG4hy8fZ6Q78exChXDRs9TmQtlI43PKD3HHyyXuEl7K089X-TkBTvjj35rKW57RwuVv1ABEv00TnK672yca4791RcBdqv82lqDOOom6v74hwwTTA_XSe5LduAqp-2svYjV1grrv5URwmA==&p=5&fvj=0&vjs=3
Data Science Engineer,,Fearless,"Baltimore, MD",Remote,4.5,Build and maintain predictive models and machine learning algorithms from the ground up to solve real-world business challenges.,Today,2021-01-15,https://www.indeed.com/rc/clk?jk=b95ae27a6f5ce220&fccid=b8aaf191c532bb48&vjs=3
"Machine Learning Engineer - Hanover, MD",,Eccalon,"Hanover, MD",,,"Understanding of machine learning and deep learning fundamentals.
Engineer artificial intelligence models and infrastructure for deployment in healthcare.",30+ days ago,2021-01-15,https://www.indeed.com/rc/clk?jk=bcb6fb4530f0fd01&fccid=3e748eea0e6d02b7&vjs=3
Autonomous Vehicle Engineer,,Textron Systems,"Hunt Valley, MD",,3.7,We want engineers who can apply new technologies such as machine vision and machine learning to multi-domain automation tasks and communicate their approaches…,30+ days ago,2021-01-15,https://www.indeed.com/rc/clk?jk=34ef97b4c7c18428&fccid=b61726afa7a8d26a&vjs=3
Customer Engineer - Active Directory Engineer,"$68,739 - $89,000 a year",JDA Technical Services Group,United States,Temporarily remote,4.3,"Understand risks associated with Domain Controllers has virtual machines.
CE’s are some of the most distinguished & highly accredited engineers in the world.",29 days ago,2021-01-15,https://www.indeed.com/pagead/clk?mo=r&ad=-6NYlbfkN0BHUG_3ayLhII14Y5cvDVfdL_mMdinyvrblje7frGdMn6-Ntgf7wBbIyKL6hF8p2lB8nZy0NtPEz3RGhmOGvtcjMozvXrWtqHr416SbSwGldl0dg60Jz8T9uX7I2TM6jBIBDUnC4capB0uBkV9FEQuH6gHx9zq2OBsV-wgdyoKwQuTKjbD11kDGGElSpPrEC9Y1MCgJ6tog-wywzhObEFTaA3tAeIVSVitym6MxWpzNQAjlZkhiDmOneY_yhDRNJvf8H5N0luYUAMOZLobPkxGKeYWKnGxV2cpVeurH0jb8qzymLQWlEniZi_eYZJ2yIkuzKVoIDaFMcqA-jZqmuGmGzr0T_LeWbANbAW5TztQ2_fCAftufnyIBlb5MioD2tZn_n4vPJiogGqmgDZmKQfQyRVrle5BfvqlELIE3dJRNW9cq3OVZlG6kI0w9HLrocLJXa7X5kIYU3lgdUFiWqcQOWdFpWEzU1Ji7WsEnI2XZPVA3XCs21IzE&p=9&fvj=1&vjs=3
"DIGITAL SIGNAL PROCESSING ENGINEER (APG, MARYLAND)","$100,000 - $140,000 a year",Darkblade Systems Corporation,"White Marsh, MD",,,"Seeking a Radio Frequency (RF), Communications, and Digital Signal Processing (DSP) Software Engineer to support Software Defined Radio (SDR) application…",7 days ago,2021-01-15,https://www.indeed.com/company/Darkblade-Systems-Corporation/jobs/Digital-Signal-Processing-Engineer-20fe4334ec84ac30?fccid=5dfd604c14fce23d&vjs=3
Data Engineer,"$115,000 - $125,000 a year","Trobus Technologies,LLC","Cockeysville, MD",,,"\* Experience with Object-Oriented Programming Languages such as Python, JavaScript, Java, C#, etc.
\* Experience using data reporting and visualization tools …",2 days ago,2021-01-15,"https://www.indeed.com/company/Trobus-Technologies,LLC/jobs/Data-Engineer-a4eb4a34dbd3479c?fccid=a16f15618775fd03&vjs=3"
Junior Software Programmer/Engineer,,Carr Astronautics Corporation,"Greenbelt, MD",,,"Experience with advanced numerical methods including artificial intelligence, machine learning and neural networks including applicable programming tools such…",9 days ago,2021-01-15,https://www.indeed.com/rc/clk?jk=ce7d1884d1c266ff&fccid=33fc839bc2754fbd&vjs=3
Junior Systems Engineer,,Novetta,"Columbia, MD",,3.5,"Novetta has an exciting opportunity for a Systems Engineer – Junior Level who shall participate in systems engineering analyses, designs, integration and…",30+ days ago,2021-01-15,https://www.indeed.com/rc/clk?jk=81007244020fb5b0&fccid=1d69e9a5b2cfbeca&vjs=3
Junior Software Engineer,,Novetta,"Columbia, MD",,3.5,"Novetta is seeking a Junior Software Engineer who shall participate in all phases of the software lifecycle from requirements definition through design,…",30+ days ago,2021-01-15,https://www.indeed.com/rc/clk?jk=62599c4cc997973d&fccid=1d69e9a5b2cfbeca&vjs=3
Research Data Analyst/Software Engineer,$31 - $40 an hour,Neurogazer USA,"Baltimore, MD",Remote,,"Candidates should feel comfortable learning new tools and technologies quickly and independently, and those familiar with Python and Bash as well as basic…",10 days ago,2021-01-15,https://www.indeed.com/pagead/clk?mo=r&ad=-6NYlbfkN0BJJBdCULplSEaeHpey-r39yKRVIFGrHTfg0M0DIHj38P7aW7lYUe3HjiD0ZNXK-qtgaj2PpbHvQgKjbjV6FazgrrHpmNTP2rxSRX8YO_ORrqoSPAdEAPfrIJjQ1jJjB7mtqZ8pURMxdAjKpQ0ZhdUO0evAgRlv-lMSaJRYvjPYerDnfXg1myfSL7ggOWSNrvQk-ED34HZbnHsyzAPKY6NRB3MeLsiPU-iaHReL3_GU2nehM8xOl-Pkl7PlN72UxK5MgINV8xV5cXFRUy8DIj2UghSIyMY5xtzhABzxaHHbH4H_1Hf67qrJmQwziojEl2c852e8hwve4D7a0uLt0NDNqmOLmx_gjj_wwFy5kCkxcXUGDOBFzekD1qaKkCmAXVaJNrILLTuxJqZNYIa1822CjImhIjW0VZr_BRjE7R3uI97zJv29qrX7D41NNzP1ureLl-44EGloNdIDBH8dmxQvf_DLVCEubyRkEMdxi2xRJYdvPXLw4MDN&p=0&fvj=1&vjs=3
Autonomous Vehicle Systems Engineer,,Textron Systems,"Hunt Valley, MD",,3.7,We want engineers who can apply new technologies such as machine vision and machine learning to multi-domain automation tasks and communicate their approaches…,30+ days ago,2021-01-15,https://www.indeed.com/pagead/clk?mo=r&ad=-6NYlbfkN0CMBS5B041_Y8ZzbX96acfEwfe9nE43utDAET7SJzUSwZUaIW1cGVDkJ94Qyb-AfztFjoq4Yym9fqLoKDb6GQDGO5mo7HlycqPl52mSKUyxAnX2Z-lz1MqXFtgSOAUGbw6rEPTThKMRzru3hQdAhNwHds6CBp9k2Rnw7Xg0G6W6AiWxAU5LnKBvYsVqXXqhkIpMdU2Ndkub_FKV9TpqfrX4n55G6ISxFb62FM8u6Q77lGMFlOtFx8re3V81zK9hzujKrp9mX06te36baqAvmxcpYVUNVxPMhuhJN4yVdaMxAGn_ISkM-GqkXxipR84lx7im5ymOzhWSdHLwpidioCcHEbwAjso8K6g18rxDQ62XKqEPQ-9D3Lnbgb0ayMNeox2-fw_i8DLFc72CZLSw7w5KcBGQW14CRcGXWiikfzLXLSglB2a4bG5FZKfKdi1zu2wGwb3NOpR_xftFLQXz__eoACmol0lZ6elfCko2vRwLFBs2HuYlZ0msuFchffXhMJ636wqyZVSOzzRJOas3mWOGOK37qgz4zRr_8pDQIEZYCw==&p=1&fvj=0&vjs=3
Junior Software Engineer,,Novetta,"Columbia, MD",,3.5,"Novetta is seeking a Junior Software Engineer who shall participate in all phases of the software lifecycle from requirements definition through design,…",30+ days ago,2021-01-15,https://www.indeed.com/rc/clk?jk=62599c4cc997973d&fccid=1d69e9a5b2cfbeca&vjs=3
AI Programmer,,Oxide Games,"Timonium, MD",,,"Work closely with design and gameplay engineers.
Collaborate with artists and animators.
Written or worked on AI in the gaming industry.",30+ days ago,2021-01-15,https://www.indeed.com/rc/clk?jk=772a5440db4a7f07&fccid=a1ad5a4407f91d85&vjs=3
Software Engineer (Level 0-3),,Tiber Technologies,"Ellicott City, MD",,,"A bachelor’s degree in computer science or related technical field is highly desirable.
High proficiency programming in Java and/or C/C++ as well as familiarity…",30+ days ago,2021-01-15,https://www.indeed.com/rc/clk?jk=f61af0c62b590509&fccid=9a8e100482b77bc0&vjs=3
Software Engineer,,Booz Allen Hamilton,"Belcamp, MD",,3.9,"Experience with RF and machine learning.
Apply your experience-based knowledge in developing complex algorithms and image processes while broadening your…",4 days ago,2021-01-15,https://www.indeed.com/rc/clk?jk=f88ab7cdc6b68f09&fccid=4e041af1d0af1bc8&vjs=3
Bioinformatics Software Engineer II,,"Personal Genome Diagnostics, Inc.","Baltimore, MD",,4.0,"You will improve bioinformatics methods, strategize with leadership, solve tough scientific problems with teammates, test software to improve patient safety and…",2 days ago,2021-01-15,https://www.indeed.com/rc/clk?jk=9d9a12b52a7e08fb&fccid=888a567cb5b8eec9&vjs=3
Software Engineer (Machine Learning) - Entry/Mid Level,,Asymmetrik,"Annapolis Junction, MD",,,"You’ve got a technical degree or at least 4 years of solid experience in development and machine learning frameworks and applications (e.g., TensorFlow).",18 days ago,2021-01-15,https://www.indeed.com/rc/clk?jk=8aeca9ecc1751ed2&fccid=60f75ef50bbea06c&vjs=3
Software Integration Engineer,,BAE Systems,"Annapolis Junction, MD",,3.8,"This role is responsible for enhancing complex and diverse software systems.
Design, develop, and sustain a set of tools that support the on-boarding of new…",2 days ago,2021-01-15,https://www.indeed.com/rc/clk?jk=0256b47037c8285b&fccid=200a825acadb9338&vjs=3
Computer Scientist - Software Engineer/Cyber Developer,"$84,529 - $113,362 a year",National Security Agency,"Fort Meade, MD",,4.2,"Information retrieval, machine learning, artificial intelligence, statistics and analytics.
Salary offers are based on candidates' education level and years of…",Today,2021-01-15,https://www.indeed.com/rc/clk?jk=874076503e7c1645&fccid=e8f18ca6180ec8da&vjs=3
Network Engineer,,Novetta,"Columbia, MD",,3.5,"Novetta has an exciting opportunity for a self-motivated and accomplished Network Engineer who shall support, monitor, test, and troubleshoot hardware and…",30+ days ago,2021-01-15,https://www.indeed.com/rc/clk?jk=90203946303c1947&fccid=1d69e9a5b2cfbeca&vjs=3
Data Analyst,,2K Games,"Baltimore, MD",,3.6,Experience with predictive modeling techniques and accomplished in use of R or Python machine learning and related modules.,30+ days ago,2021-01-15,https://www.indeed.com/rc/clk?jk=02a9fd2245022ee6&fccid=824f64d0ff3c8c8f&vjs=3
Medical Imaging Scientist,"$90,000 - $100,000 a year",The Focus Foundation,"Crofton, MD",,,The main areas of our imaging research include fNIRs in children and adults with genetic and metabolic conditions as well as development of DL and machine…,29 days ago,2021-01-15,https://www.indeed.com/pagead/clk?mo=r&ad=-6NYlbfkN0BGcwyYL3SMOUlcMXIePvYyYaMOlQe31gDNcZpv7BaIW3Wi3Cp5Ffx6Jl1kM_pdOlYxV_GHAcd4HOq2k7kVA4oIPl9o9iQHml_LzzdGwfvF1hVU_Z1hk1wMHoc9x59bz_GQLd77qHQFtMRjlPWNBfwFh83LnSQRu2wkRMiD2zznged-VnaYpNbhREkKl7V5CbhUvKuzWr7RxeKTh0a8v82N14cvgSf_EaKCk2KIVUxwOvq3_uto0DrtQbBrz18H7BD_8UkAR5KoXqZbqKt47zoSKLdK67ngb3YHoDO-VK-c49H3X3WIiJ5q_Fe6S3dGcMzQFRDmxr_H6p6Y3rE4EDaeenSrkt2KRW6bGNwGuimJG38VVE8ENuxToHLwzmGC6Sf3WaM21zdpR0B1Fn0pNk2CYoiS-TWhL9HnObvPf8dFViFF-y6GG2Xgl_8G06N8KEY8Dw6LSbmCO1rIg9uQPJSbvVm5eZeFnoElb0AK0eObrQ==&p=12&fvj=1&vjs=3
Prototype Metrologist,,Stanley Black & Decker,"Towson, MD",,3.6,"Ability to read and comprehend engineering, machine, and process drawings.
Communicate effectively with machinist and engineers on the status of parts during…",30+ days ago,2021-01-15,https://www.indeed.com/pagead/clk?mo=r&ad=-6NYlbfkN0CAKa9X1rhwc3pNs7zo7W4tV5xThjHL7xzK8hVrbodY_0qvNqxM5WkQAa2peUD7nh47qx7Vv4iuu0Z6Qe-4aufnVDu54rkJXoZQSFtUHmpGxp1Ue-6s1dKmx1RE-c_K8VIOWDKZs8BPTVWEFbZ3cEMwDNCKRbNyapbeH5P0EC98t4GUiswJxflb9hAPjcigt54C5-GC_8VKpFkuGM1n3X4LPMmeMb6uuMFyTV9grr0YAOesltPthCNhkU7TIZ1Ik0RAEh42UrHTzCw5nMiJEfsIDTSlNlp6n-48IVfOel9cvS1LF59B8PMvrqv2CKhqFIXdljZVb1JLGwCIaC81lXvrahdb7a--QYpmoCrjcmsVR32SXZrCmxJixwdIbRM6XXBEabgMkBSG_52WYfK3RhnHiTu_j0xLzWAbv_QJjIKKO48XjA6pumHG71YSmK2AxtkYKXF3LvzswrV_0sVobsoAGsqRPgFLfC125dTLAUvTFgT598unM6pVA3m-vSZLhjy5smL65aUh2iKlccnsS2OA_MKZKByttodwxq_Vc5eYFLruStsFtVMk&p=13&fvj=0&vjs=3
"Acoustic Signal Processing Engineer - Data Scientist, Machine Learning",,Signal Systems Corporation,"Columbia, MD",Temporarily remote,,"Can design and build state-of-the-art machine learning and deep learning algorithms.
\* You will collaborate with engineers from other organizations to support…",4 days ago,2021-01-15,https://www.indeed.com/pagead/clk?mo=r&ad=-6NYlbfkN0A2NX-yk-5saWumjHCeW1U7wjRG-yaZl6appTnwIWK0f0j4yN2ZzSx2dhxoGkkKUc4oHx9AVk35NZ-yAvwgpz-2CSTAURRcWk54sSv_p7tDiDiB-ZK4umuf4xTngB195bh54zLkr09Ed6JkfEUNYkqedvQCx64lLlbyWrro6Xkke1YVpBuMl2KxA2WEDAGJsLF6sjLiqLRqUTPMfbMQkMZqnmUggP-ssdUb69qCDEDtisEyjk49UV8XnEJdDXr-aDm_DwAaxPptzIOH1Mg1U0NaAa8osBInkBeid1eZaIBIM6daM5xdZEGZUY1YU05HmJWCczJ60c52d0_EdEwrKjempTHn44IEfY8vpI3AzgYIh68cXbbIAZ5Wk1MocpJ4r22PouFNmoPeT82lZuKsIttMlPsONh8VTQjvfmpDf_om3_2fApF4Lo1KWZRZrLjKWP-0R7JNX4cd_1ND3y5h4_x-LhKqXNs2dus_-CuGYjjnNgq6tikLQVZbvnuZLe7YtWitPnLJDZGuB1F6pF3qmhtxjfL747ADvtE=&p=14&fvj=1&vjs=3
AWS Data Engineer,,Ntelicor,"Baltimore, MD",,4.4,"Demonstrated experience in designing and building AWS data processing cloud-based infrastructures is required.
Mentor Jr staff where appropriate.",10 days ago,2021-01-15,https://www.indeed.com/rc/clk?jk=eb1e9ceea565d074&fccid=612f466be50483fe&vjs=3
Quality Engineer & Validation Specialist,,Catalent Pharma Solutions,"Harmans, MD",,3.2,"Examples of equipment includes bioreactors, chromatography systems, controlled temperature units, filling/stoppering machines, autoclaves and critical utilities…",2 days ago,2021-01-15,https://www.indeed.com/rc/clk?jk=20f79d2d22d512a8&fccid=fe0933928b3bb3ad&vjs=3
Senior Power Systems Automation Engineer,,Eaton,"Hanover, MD",,3.8,This team of engineers and technicians brings extensive skills and experiences with a variety of leading HMI software packages enabling us to design graphically…,2 days ago,2021-01-15,https://www.indeed.com/rc/clk?jk=a2f9adc53a328b91&fccid=87f38351bd29de24&vjs=3
Materials Characterization Engineer,,Johns Hopkins Applied Physics Laboratory (APL),"Laurel, MD",,4.0,"Have knowledge of advanced multi-dimensional statistical data analysis and/or machine learning methods.
Your primary responsibility will be experimentation in…",30+ days ago,2021-01-15,https://www.indeed.com/rc/clk?jk=d50827d97491bcc8&fccid=b8acc26118799f48&vjs=3
Radar Analysis Engineer,"$80,072 - $155,506 a year","QuantiTech, Inc.","Columbia, MD",Temporarily remote,4.2,"Characterize sensor performance against threat ballistic and cruise missiles through modeling, simulation and analysis using digital simulations.",4 days ago,2021-01-15,https://www.indeed.com/company/QUANTITECH/jobs/Radar-Analysis-Engineer-2e483df42d35319d?fccid=25e456e76c5eed36&vjs=3
ElasticSearch Engineer,,COMSO Inc,"Linthicum Heights, MD",,,Required: 2+ years of experience setting up and tuning Elasticsearch clusters to handle processing of large amounts of data; 2+ years of experience with…,30+ days ago,2021-01-15,https://www.indeed.com/rc/clk?jk=4b045b5abc512096&fccid=40598820b6ed3069&vjs=3
"DIRECTOR OF PROFESSIONAL SERVICES (GAITHERSBURG, MARYLAND)","$150,000 - $175,000 a year",Darkblade Systems Corporation,"Ellicott City, MD",,,"You will be the subject matter expert of our product outside of R&D and have responsibility for all post-sales customer activity, as well as recruiting our Post…",7 days ago,2021-01-15,https://www.indeed.com/company/Darkblade-Systems-Corporation/jobs/Director-Professional-Service-8da3e4aef9fa510a?fccid=5dfd604c14fce23d&vjs=3
Test Engineer,,Novetta,"Annapolis Junction, MD",,3.5,"The Test Engineering Analyzes system requirements and concept of operations documents, acquisition plans, and system descriptions to develop evaluation and test…",30+ days ago,2021-01-15,https://www.indeed.com/rc/clk?jk=b092c2dd9b5b99ae&fccid=1d69e9a5b2cfbeca&vjs=3
Staff Engineer - OEM Molding,,BD,"Hunt Valley, MD",,3.8,"Demonstrate leadership, learning agility and action orientation when facing uncertainty.
Hands on familiarity with injection molding machine controllers and/or…",30+ days ago,2021-01-15,https://www.indeed.com/rc/clk?jk=e979a694e958cf5d&fccid=f33adcecbae03a00&vjs=3
Software Engineer - Big Data / Machine Learning (Mid Level),,Clearedge It Solutions Llc,"Jessup, MD",,,"The team incorporates new data sets, performs analytic development, and integrates machine learning technologies.
Strong analysis experience highly desired.",30+ days ago,2021-01-15,https://www.indeed.com/rc/clk?jk=1ca87261d61b60f3&fccid=606a1286648e8041&vjs=3
Hardware Designer,,Merge Consulting LLC,"Severn, MD",,,"We're looking for folks who have 1-3 years of experience, DSP experience or background, with an interest in machine learning.",30+ days ago,2021-01-15,https://www.indeed.com/rc/clk?jk=de20cce3624bba5a&fccid=aa3962eb91285bda&vjs=3
Maintenance Personnel,,Hilton Garden Inn,"Hanover, MD",,3.6,"Replaces worn or damaged parts such as hoses, wiring,and belts,in machines and equipment.
As a maintenance technician you will work varying days and hours…",30+ days ago,2021-01-15,https://www.indeed.com/rc/clk?jk=5a382da7d00e35dd&fccid=2a97eb4c5740c897&vjs=3
Senior Data Scientist,,Amobee,"Baltimore, MD",,4.1,"The successful candidate will utilize advanced mathematical, optimization, machine-learning, software engineering, and programming skills to solve challenging…",30+ days ago,2021-01-15,https://www.indeed.com/rc/clk?jk=eb5d43f1901f727a&fccid=ebaa8a50df7c2d2f&vjs=3
Cloud Framework Design System Engineer,,Sagecor Solutions,"Fort Meade, MD",,,Sagecor Solutions is seeking a Senior System Engineer to provide support for the implementation and execution of definition and integration of a Tradecraft…,30+ days ago,2021-01-15,https://www.indeed.com/rc/clk?jk=a9ef70aa101c4df5&fccid=6f372cc9766cc3f9&vjs=3
Data Scientist,,Varen Technologies,"Annapolis Junction, MD",,4.3,"Develop feature vectors for input into machine learning algorithms.
Develop and train machine learning systems based on statistical analysis of data…",30+ days ago,2021-01-15,https://www.indeed.com/rc/clk?jk=c0a66b524662facd&fccid=898cb537778fecc3&vjs=3
Data Scientist,,SOFTEK,"Woodlawn, MD",,3.9,"Preferred: Experience in SAS (preferred) and/or R for complex data manipulation, statistical analysis, and machine learning.",30+ days ago,2021-01-15,https://www.indeed.com/rc/clk?jk=dfa0d1ba3ee68aa6&fccid=71cd63e377ddf1f8&vjs=3
Systems Engineer,,Xator Corporation,"Fort Meade, MD",,3.6,"Employ sound system engineering and human-machine interaction principles to develop, vet with customers, and refine high-level conceptual designs in response to…",9 days ago,2021-01-15,https://www.indeed.com/rc/clk?jk=8950d7fdeaa48ae1&fccid=2a0751f9d1852555&vjs=3
Machine Learning Analyst,,Johns Hopkins Applied Physics Laboratory (APL),"Laurel, MD",,4.0,"Have 2 years of experience in the machine learning and data science fields.
You will research, implement and analyze prototype algorithms for various machine…",30+ days ago,2021-01-15,https://www.indeed.com/rc/clk?jk=5080a240d1c01f18&fccid=b8acc26118799f48&vjs=3
Software FPGA Application Engineer,,Annapolis Micro Systems,"Annapolis, MD",,,"Conceive, design, develop, and test a wide range of complicated digital signal processing FPGA applications leveraging VHDL or our patented CoreFire Next Design…",30+ days ago,2021-01-15,https://www.indeed.com/rc/clk?jk=b353d54d2040347c&fccid=4161755fe1efcb1d&vjs=3
"Lead, Data Scientist",,"Under Armour, Inc.","Baltimore, MD",,3.8,"In-depth knowledge of statistics, probability, and machine learning methodologies.
3-5 years of industry experience with machine learning and/or advanced…",6 days ago,2021-01-15,https://www.indeed.com/rc/clk?jk=1c1ed6c70693f04b&fccid=f5d526c81b4033de&vjs=3
Senior Chemist,,Johns Hopkins Applied Physics Laboratory (APL),"Laurel, MD",,4.0,"Be involved in emerging technologies such as machine learning applications, continuous flow systems, or microfluidic based platforms.",21 days ago,2021-01-15,https://www.indeed.com/rc/clk?jk=3f8e84519bfad222&fccid=b8acc26118799f48&vjs=3
"Adjunct Professor, Mechatronics Engineering",,Capitol Technology University,"Laurel, MD",,3.6,"Analysis of motion translation/rotation in machinery, energy of machine mechanisms.
Students completing this course will engineer a robotic system through its…",30+ days ago,2021-01-15,https://www.indeed.com/rc/clk?jk=f2ac08014ac931a9&fccid=ef61ebce27bcd978&vjs=3
Associate Software Engineer,,Genex Systems,"Riverdale, MD",,4.6,"As a member of the EED-2 team, software engineers will build innovative tools allowing scientists and students alike to discover, transform, update and improve…",30+ days ago,2021-01-15,https://www.indeed.com/rc/clk?jk=8951ef9f921ebdfa&fccid=fbe42212c4a67969&vjs=3
"Data Scientist, AWS Security- Baltimore",,"Amazon Dev Center U.S., Inc.","Baltimore, MD",,3.6,"Hands-on professional experience with applying machine learning and other data science techniques to identify anomalous behavior patterns (e.g., user or machine…",30+ days ago,2021-01-15,https://www.indeed.com/rc/clk?jk=aa5b3c75be1db9a6&fccid=fe2d21eef233e94a&vjs=3
"Software Engineer, L3",,Digiflight,"Columbia, MD",,3.6,"Strong interest in machine learning, artificial intelligence (AI), data science.
Additionally, the team is charged with designing, implementing and deploying…",6 days ago,2021-01-15,https://www.indeed.com/rc/clk?jk=a3242ae96fd6aaa4&fccid=7e6ec4a9123038a0&vjs=3
Application Engineer,,Annapolis Micro Systems,"Annapolis, MD",,,"Your responsibilities will often span from application conception through application deployment, including working with the sales team to win programs, working…",30+ days ago,2021-01-15,https://www.indeed.com/rc/clk?jk=2377ad539f7bf74f&fccid=4161755fe1efcb1d&vjs=3
DevOps Engineer,,Bowler Pons Solutions Consultants,"Annapolis, MD",,,"Develop, document, test, debug, integrate, and maintain application software, systems, and hardware solutions.
Knowledge of 3D computer vision concepts.",3 days ago,2021-01-15,https://www.indeed.com/rc/clk?jk=5372ad5a0dae288e&fccid=bf94b554a157ce38&vjs=3
