job_title,salary,company,location,is_remote,job_rating,job_summary,post_date,extract_date,job_url
<<<<<<< HEAD
=======
Data Analyst,$53.33 an hour,The Mom Project,"Mountain View, CA",,,"Fluency working with large data sets/ data warehousing.
Expert Excel data modeling and analysis skills.
Proficient in Tableau and other data visualization tools…",Just posted,2021-01-11,https://www.indeed.com/pagead/clk?mo=r&ad=-6NYlbfkN0BDp_epf89aHDQhKpPegNJQ_ldQpEFZQsM9OcONMGxWx6pU56EKHF58QjVdAUvn2gVAsk4amSWfXTefCOi9F3GkwvkOoKDzRAGldrm82KX_Hjp67-WZpnbcj5LP_pmmw538SeLye-1sru4o5wXg7ebG4aQXwPANrMparam_pPh-48Cdn7EZJuFRGVLv_mpZ0H9lZAq-HENLkw803QkctOZc35I6hoYVe2_IEZKw6mXoifFODsutQm9DpcXJaYyJlF6ftfp_wEp7mHN9SE-arPvuIGZ9sqaKQlGAuRGPXjm72KX8vZ55UTzNhFNXULzfpQHJMStSmntxpL1MzJikjq1tmRoO2nf8hvD8HBSAvsnZRev0J8M-hX4OMmJ8N5VzzAtff7pdLWY_2K2MjORAyOAM1JFj3jrlE28NOE5dt9IuIrZxVATjnD7tTpwP7so6qHRQNHCT_78EsIwxMknRmIhl27ExY9sVvKkmhmYAzAoym2st8drbNb9sbdtg36XFYbmyucFj0YoV04Y1D77PNbKG7cz2ZYYm0SxMv2VxXFfF-6z04ZtM845pBRZs1wewbVCWzX4hSs_WuQ==&p=0&fvj=0&vjs=3
Data Analyst,,Study.com,"Mountain View, CA",,3.5,"The Data Analyst must be passionate about digging into data and understanding the stories the data are telling.
Knowledge of advanced statistical concepts.",30+ days ago,2021-01-11,https://www.indeed.com/pagead/clk?mo=r&ad=-6NYlbfkN0DTBdVKmZIyVUz9epjLLrinfsLp4iyHLMBJakMPxL5umFWkBnrul4OZfYAQQsTEzo4tnLRbZnfEmIiikkB8lgr-Hqp6JpqKcGJ8D_TjPVMk7msr0-hc7-K4ZcsaUUx0l36ia6AXOf16fzdlMvpl3Kut169elPf3GJ4pE2E2G_XTzGHyYeHk-kZQDbznHxfAGB52WB__eQt3OH3W8RdfV3c6d7_iOPvGW9bRG6VfIgYYJIHjoxytAcJikep7SZlKjDev7bSUSXY7nQ6qSHvjOMsSKqNIi89dWI1fnWiA4SVfp8WL-LJT5G5bC-5xNvbkumjWUaVEU52MfIJUdc9AlSjAO8DziNDAsG3246spJK9CYLRaKL1-OjN6YYIToNn12_8BxWQws9l2SZQ9lrhu6bO8SBCm-xmGsu-eEZKJYzAvuNiaK1hq1ScsUKKD62oGQZOqSnMB2VJPh-ejqiUiGGVMHCYV4Ut44i31OGW5etPuXNPNtYqyH6TnqtKoiag25StD-SikFrOTiw==&p=1&fvj=0&vjs=3
Data Analyst,,Cornershop,"San Francisco, CA",Temporarily remote,3.7,"2+ years of relevant experience in business intelligence, research, data analytics, data science, or a related field.
Proficiency with Google Sheets and Excel.",5 days ago,2021-01-11,https://www.indeed.com/pagead/clk?mo=r&ad=-6NYlbfkN0CDg2PyOvLM5WFHaY3mOgSqyeWxPLwD-9Oy4oGnHKxnHB82L0JPb81JBwdgkPUDqNWURnntmgrmIV-f6yC3_rLoHzDZqOnOn2RxoEeUL_q7WnsfL1OaC2o8fw_HQTmfPBGFxd5aN4vOAqnNjoEiqMi_CXFp81TKe8s8Skgm_jG5jhrjxGJXrb8KjuJ-ShlO6QV2p25HRgBK7-nXF9uUIyPUZbEiElloZ9yx8X3EQkvKsikNL86ZRzRPZ1ynucf2Uy5f7TD1y9OtcJD5OdvsI2CYa1uSGJK_AkyQAfp3LEvYJjWTohMLE6pi0Z0VKr-8TGSE0WOB_ttJ5TBKUNsPORDWh2vNd_cstm5NZH8FVnsWyCRdnkuB-1GHzRfSqNsSLGzLa-GNTJIUaVhy71EG5DZNfqgFIitMFEjvm2CFKR1HdVc2mvXsRBcAFUqx2I1h9OzB4hTKA3IHktxaxcuDGrak&p=2&fvj=1&vjs=3
Business Data Analyst,,Pinkerton,"Fremont, CA",,3.7,"Conduct data analysis to examine data sets to draw conclusions about the information contained therein.
Lead and support data driven projects including;",29 days ago,2021-01-11,https://www.indeed.com/pagead/clk?mo=r&ad=-6NYlbfkN0DEMI6QzMzxi0DD_pMYXICmFoJq-H5LrGXX8bv2zgXFduc3Z3hrGBGa2RXZy2On1fqfOHx-pGmDAM-y7M5YtKbhJvfUkP7_-QkCfs7EHT4dSOpejPeruNGgVaJjQKMOTWUVm3BtUtDH3kTO5CYMdaPXGzA21EXwrt7D58IdVG7EiRs9If7U0pCW0GDn7EmNzObXMaW4fznXiv51Wi6uqnITatb_odl5SlYCnAantoolZl2lf5mZXD9J8RblFsWV7-15pRBwHC4UXaEc8wtY044I-NDLcfKlYw8UR1yOYusCG_YzzHb9r5oWeag_IGLOkm-3dU6MeNdEH31NV3akrTMad82eLrgSqhYIkOuF8z8QRCv9TI8NvKXoOwO6nr9zPpyJ98B7I_KT8FdcqUVFX9AVaItfS8yeom0Ls-THc2xM7DFQZVOs6saQYw_t7rH9H4zzbdr30lJv5Q==&p=3&fvj=0&vjs=3
Public Health Analyst,$26 - $31 an hour,Wollborg Michelson Recruiting,"Dublin, CA",,3.8,"Review and analyze case data for trends, alert HR and operations of potential risks.
Generate reports from risk management systems, review and analyze data…",Today,2021-01-11,https://www.indeed.com/pagead/clk?mo=r&ad=-6NYlbfkN0CWURYoHbCO4cmh1YL3bdIgPpolxL4J6fmUWVjpKFg0ATLIMpKGBF0gtBwnGeABQcup4ZnosNQe9hCaoOiRlUSAEcVe2aZxNJLFIn4-EGx5OfqoZukHRm76L9sr_bokgSY4t7V95DsJ1uDW_TQrxrVCF68yGWEsgPer9lmqYNswuJYi24GS2-QGwYkmW2lfC50-6zn38jv1xmukgFsabj43siiFOLVf85r7f3xDlw9eqNRKH3EPD4Fx7HEXTOs6GjcIoXLCyiM_WXJ28GfakDeKRgIHmQ_0CH5mA-xqZBXdZFtRvIszVKFXiR12a3f-_5Tn5vCgS5qlRkg3tMSIXai8cCM0VbSUcLmt0kLTHzJpmRkztxZUEfSqploxLWYOXyn8NJ8thpmforMhmmpBBxMnph8Woq3xfXDnHTdAWieiPGokRh7DP0HbEwEBSRa4ei9v1lYTuI2Ob3JdutWUtIf4&p=4&fvj=1&vjs=3
Data Analyst,$40 - $50 an hour,Ryzen Solutions,"Fremont, CA",Remote,4.7,"Data warehousing, validation and visualization is a plus.
I'm urgently looking for Data Analyst with 3-8 years of experience in coding/ writing scripts using…",7 days ago,2021-01-11,https://www.indeed.com/company/RYZEN-SOLUTIONS/jobs/Data-Analyst-501a5760e96603c7?fccid=021e5b9130f2eb79&vjs=3
Data Analyst,,"Raybeam, Inc.","Mountain View, CA",Temporarily remote,,"4+ years of discovery and assessment of a client’s data portfolio, data tools, and data applications.
Ability to manage a data ecosystem including ETL, data…",Today,2021-01-11,"https://www.indeed.com/company/Raybeam,-Inc./jobs/Data-Analyst-e74cff7ad6109d6b?fccid=8641f0a5fda917ff&vjs=3"
Data Analyst,,Mighty Networks,"San Francisco Bay Area, CA",,,"Build scripts that will make our data evaluation process more flexible or scalable across data sets.
Create and maintain rich interactive visualizations through…",Today,2021-01-11,https://www.indeed.com/company/Mighty-Networks/jobs/Data-Analyst-84aa1185c5e40333?fccid=251c57e5708f4cee&vjs=3
Data Analyst,,Tesla,"Fremont, CA",,3.5,"As data analyst lead, document relevant timelines as well as deliverables and present to project steering committees.",30+ days ago,2021-01-11,https://www.indeed.com/rc/clk?jk=cb5d97e49aa27687&fccid=86e9be6ce380173e&vjs=3
Product Data Analyst,,Waymo,"Mountain View, CA",,3.1,"Demonstrated ability to extract actionable insights from data.
Analyze data to create a deeper understanding of the Waymo Driver and its behaviors.",3 days ago,2021-01-11,https://www.indeed.com/rc/clk?jk=a9944e5669d017b8&fccid=73ceef0a2153d2b8&vjs=3
Data Analyst - Entry Level,"$31,775 - $60,684 a year",MT Global,"San Francisco, CA",,,"Providing technical expertise on data storage structures, data mining, and data cleansing.
Provide quality assurance of imported data, working with quality…",6 days ago,2021-01-11,https://www.indeed.com/company/Mt-Global/jobs/Data-Analyst-a4e304edd0876058?fccid=538f9ae95cd3fbad&vjs=3
Data Analyst,,Rocketship Public Schools,"Redwood City, CA",,3.0,"The Analytics team at Rocketship drives strategic decision-making across the organization by building scalable data systems, providing accurate and accessible…",4 days ago,2021-01-11,https://www.indeed.com/rc/clk?jk=067852a334da6722&fccid=3aefb7a816fffc96&vjs=3
Membership Data Warehouse Analyst,,Kaiser Permanente,"Pleasanton, CA",,4.1,"Business analyst supporting a membership data warehouse (MDW).
Data warehousing user support including data validation and testing support.",30+ days ago,2021-01-11,https://www.indeed.com/rc/clk?jk=7ede6a450606fb41&fccid=48ecd526e3aa3225&vjs=3
Data Analyst,,Spin Electric Scooters,"San Francisco, CA",Remote,3.1,"Minimum of 5 (3 with advanced degree) years of relevant experience in data science or analytics role.
Analyze data and develop data models to enable self-serve…",4 days ago,2021-01-11,https://www.indeed.com/rc/clk?jk=d6511ae79828133b&fccid=2166988d55803caf&vjs=3
Data Analyst Intern,,PayPal,"San Francisco, CA",,3.9,Aggregate data from various sources to construct streamlined data pipelines and integrate data from multiple PayPal systems.,30+ days ago,2021-01-11,https://www.indeed.com/rc/clk?jk=92366616300ca5c8&fccid=978d9fd9799d55a8&vjs=3
Data Analyst Intern,,PayPal,"San Francisco, CA",,3.9,Aggregate data from various sources to construct streamlined data pipelines and integrate data from multiple PayPal systems.,30+ days ago,2021-01-11,https://www.indeed.com/rc/clk?jk=92366616300ca5c8&fccid=978d9fd9799d55a8&vjs=3
Data Analyst/ Tableau Developer,"Up to $85,000 a year",Milestone Technologies,"Fremont, CA",,3.3,"Working Tableau experience for developing data visuals.
Write queries, perform ad hoc data analysis, and create data visualizations to keep the nerve center of…",26 days ago,2021-01-11,https://www.indeed.com/company/Milestone-Technologies/jobs/Data-Analyst-17742c1f26530d01?fccid=2a4e80613bf74af0&vjs=3
Data Labs Analyst Role,,TCS,"Redwood City, CA",,3.8,"Client is looking for Data Labs Analyst with Business & Data Analyst experience, will be important to have Business understanding and how the data will be used…",3 days ago,2021-01-11,https://www.indeed.com/rc/clk?jk=44b2f7ac6a97943b&fccid=c78fdfc4443d4537&vjs=3
Data Analyst,"$60,684 - $128,603 a year",MT Global US INC.,"Santa Clara, CA",Remote,,"Provide seamless and timely data access for your users.
Debate data processing philosophies and methodologies with your team.
Build reliable and dependable ETL.",28 days ago,2021-01-11,https://www.indeed.com/company/MT-Global-US-INC./jobs/Data-Analyst-c4dc233a5e4a414b?fccid=dd616958bd9ddc12&vjs=3
Data Analyst,$45 - $50 an hour,Infologitech India pvt Ltd,"San Francisco, CA",Temporarily remote,,"Must have banking experience and must work from San Francisco by June of 2021.
Experience with Fiserve Total Vision or Fidelity IBS system.",19 days ago,2021-01-11,https://www.indeed.com/company/Infologitech-India-pvt-Ltd/jobs/Data-Analyst-5dd45807a2f7e889?fccid=3d343ff32bd95bfa&vjs=3
Research Data Analyst,"$5,875 - $6,505 a month",Sequoia Foundation,"Richmond, CA",Temporarily remote,,"Carry out data cleaning and descriptive analyses; summarize data runs and analyses.
Two or more years of prior work experience with health data analyses or…",4 days ago,2021-01-11,https://www.indeed.com/company/Sequoia-Foundation/jobs/Research-Data-Analyst-506b1e27832b00c8?fccid=905f0ff8819d646e&vjs=3
Data Analyst - Revenue Intelligence,,Twitter,"San Francisco, CA",,4.1,"Advanced experience with SQL and pulling data from relational databases.
Simplify complex problems & huge data sets to extract non-obvious insights.",3 days ago,2021-01-11,https://www.indeed.com/rc/clk?jk=2718373a635ce34a&fccid=7a3824693ee1074b&vjs=3
Data Analyst (mid-level),,QuinStreet,"Foster City, CA",Temporarily remote,2.7,"Reporting – summarizing data and automating reports around campaign performance, which will be utilized frequently in client interactions.",3 days ago,2021-01-11,https://www.indeed.com/rc/clk?jk=5d7fb01e268f8db2&fccid=26a49cbc28830f90&vjs=3
"Data Analyst, Logistics",,Tesla,"Fremont, CA",,3.5,"Exceptional analytical skills in logistics, data visualization, and the ability to derive important information from data.",30+ days ago,2021-01-11,https://www.indeed.com/rc/clk?jk=3ef63b0392d2ff64&fccid=86e9be6ce380173e&vjs=3
Data Analyst - Operations,,Spin,"San Francisco, CA",Remote,3.1,"Minimum of 5 (3 with advanced degree) years of relevant experience in data science or analytics role.
Analyze data and develop data models to enable self-serve…",5 days ago,2021-01-11,https://www.indeed.com/rc/clk?jk=df45a2405270fa43&fccid=2166988d55803caf&vjs=3
Research Data Analyst (6256U) 13997,,University of California Berkeley,"Berkeley, CA",,4.2,The purpose of the position is to assist with analysis of assessment and behavior data from big data sources in education such as massive open online courses (e…,21 days ago,2021-01-11,https://www.indeed.com/rc/clk?jk=5e8d54db76032dd7&fccid=db52f1353185d77b&vjs=3
Biomedical Data Engineer / Researcher / Analyst,,Penumbra US,"Alameda, CA",,,"Integrate structured and unstructured data into existing infrastructure and test data integrity and quality.
Familiarity with data modeling and machine learning…",Just posted,2021-01-11,https://www.indeed.com/rc/clk?jk=545c82db9f24ab8f&fccid=48d4b5e592158b7c&vjs=3
Clinical Data Analyst,,8k Miles,"Pleasanton, CA",,,"Development of clinical data standards (operational, Clinical Data Interchange Standards Consortium (CDISC), Clinical data Acquisition standard Harmonization …",30+ days ago,2021-01-11,https://www.indeed.com/rc/clk?jk=70bb04234efd1df1&fccid=236366e4abafb6b8&vjs=3
Jr. Data Analyst,,Rivian Automotive,"Palo Alto, CA",,3.5,"Hands on data annotation experience is a plus.
Annotate data to provide high quality labels in order to train machine learning model.
1-3 years of experience.",30+ days ago,2021-01-11,https://www.indeed.com/rc/clk?jk=606043b7e405cad0&fccid=ab392afaee93f976&vjs=3
data analyst,,Lead5 Media,"Newark, CA",,,"Perform data modeling, data analysis, and development of key performance indicators.
2-3 years of experience in data mapping and/or integration documentation…",30+ days ago,2021-01-11,https://www.indeed.com/rc/clk?jk=295b10332d7e3f8f&fccid=10c8c64f62ae9220&vjs=3
data analyst,,Lead5 Media,"Newark, CA",,,"Perform data modeling, data analysis, and development of key performance indicators.
2-3 years of experience in data mapping and/or integration documentation…",30+ days ago,2021-01-11,https://www.indeed.com/rc/clk?jk=295b10332d7e3f8f&fccid=10c8c64f62ae9220&vjs=3
Data Analyst,"$60,684 - $128,603 a year",MT Global,"San Jose, CA",,,"\* Develop and implement databases, data collection systems, data analytics and other strategies that optimize statistical efficiency and quality.",20 days ago,2021-01-11,https://www.indeed.com/company/Mt-Global/jobs/Data-Analyst-9e6fc0589d57a586?fccid=538f9ae95cd3fbad&vjs=3
Data Analyst- Product,,Weee! Inc,"Fremont, CA",,2.4,Partner with Data Engineering to craft our data infrastructure investments in support of BI needs and insure the proper tracking and quality of the data.,28 days ago,2021-01-11,https://www.indeed.com/rc/clk?jk=d6241ab32c1efa80&fccid=69e47485cd044190&vjs=3
Data Analyst,,Beekeeper Marketing,"San Francisco, CA",Remote,,"Maintain internal data sources including: creating templates and forms for data collection, assisting with cleansing data, validating data, troubleshooting and…",28 days ago,2021-01-11,https://www.indeed.com/rc/clk?jk=aaa6dc813c3be401&fccid=e1faf0b05de5643c&vjs=3
Data Analyst - : 21-00062,,Akraya Inc.,"San Jose, CA",Temporarily remote,3.7,Management of large amounts of data is a must as well as the ability to summarize it in a clean and impactful presentation format.,3 days ago,2021-01-11,https://www.indeed.com/rc/clk?jk=d8811f9899650e47&fccid=474b9602e1305593&vjs=3
"Analyst/Associate, Business Operations",,Tesla,"Fremont, CA",,3.5,"Lead pricing efforts for all vehicle products (Model S/3/X/Y and options) and new market entry.
Team members are expected to analyze data, provide…",3 days ago,2021-01-11,https://www.indeed.com/rc/clk?jk=abb8f962d8a74469&fccid=86e9be6ce380173e&vjs=3
Biosample Operations Data Analyst,,"GRAIL, Inc.","Menlo Park, CA",,,The BOA will also have opportunities to use data-driven approaches to discover insights in data of high complexity and volume.,Just posted,2021-01-11,https://www.indeed.com/rc/clk?jk=ff0a07e972c6f205&fccid=4f7c76a18f44547a&vjs=3
Survey Data Analyst,,Change Research,"San Francisco, CA",,4.5,"Able to explain data and numbers in simple language.
Consult with clients about how the data answers their questions.",30+ days ago,2021-01-11,https://www.indeed.com/rc/clk?jk=cafc44e9f9a4ce47&fccid=4376208985ead045&vjs=3
Data Analyst (SEO),,NerdWallet,"San Francisco, CA",Remote,3.9,"NerdWallet is seeking a data-driven and analytical professional for our Data Analytics team.
This individual will focus on providing digital data solutions and…",27 days ago,2021-01-11,https://www.indeed.com/rc/clk?jk=6867c1512e2df0b7&fccid=46408d807c2416ce&vjs=3
Data Analyst with SQL,,"Infinity Consulting Solutions, Inc.","Mountain View, CA",Remote,,"Experienced using SQL to query, analyze and present data.
Conduct hands on data mining and analysis to identify issues and improve operational processes.",6 days ago,2021-01-11,https://www.indeed.com/rc/clk?jk=08444952d9fb7097&fccid=95eedc2455f7362c&vjs=3
"Sr. Data Analyst, Energy Analytics",,Tesla,"Fremont, CA",,3.5,"Troubleshoot data integrity or data management issues.
Ensure safe and secure data handling by partnering with key data protection, privacy and information…",20 days ago,2021-01-11,https://www.indeed.com/rc/clk?jk=4a7900e8470c3228&fccid=86e9be6ce380173e&vjs=3
Senior Data Analyst,"$117,000 - $155,000 a year",Fivetran,"Oakland, CA",,,"Senior experience as a data analyst.
Improve Fivetran documentation, blog, and customer support material by voicing the data analyst perspective.",30+ days ago,2021-01-11,https://www.indeed.com/rc/clk?jk=9704a460dc9381f2&fccid=09c9d04ca9a8a97a&vjs=3
Data Analyst,,Atreca,"South San Francisco, CA",,,"Previous experience in data reporting.
Previous experience as an analyst.
Develop reports for data quality cleaning and monitoring.",5 days ago,2021-01-11,https://www.indeed.com/rc/clk?jk=5da81d3870c1763b&fccid=fbd1dd66b3972374&vjs=3
Entry level Business Analyst,,Logos Infotech Inc,"San Francisco, CA",,,As a Business Analyst in IT Gathering Business Requirements from the client/Customer Interact with clients to understand and capture their functional and…,5 days ago,2021-01-11,https://www.indeed.com/rc/clk?jk=88f2a9efd9ca83ef&fccid=dd616958bd9ddc12&vjs=3
PM Intern - Data Analyst (Remote - Summer 2021),,Splunk,"San Francisco, CA",Remote,4.1,We are seeking a product manager / data analyst to provide operational metrics and analysis around product adoption and success.,30+ days ago,2021-01-11,https://www.indeed.com/rc/clk?jk=feab5154394d43db&fccid=aef928e89977f7f0&vjs=3
"Intern Data Analyst - Opportunity for working remotely Palo Alto, CA",,VMware,"Palo Alto, CA",Remote,4.0,"Maintain a high attention to detail in order to ensure the data integrity of architected solutions.
Collect, process, and clean data from different sources…",30+ days ago,2021-01-11,https://www.indeed.com/rc/clk?jk=7323930d7d68c08f&fccid=c762a27145bd166e&vjs=3
Data Analyst / Business Analyst,,Hash Technologies,"San Francisco, CA",,,"Knowledge on writing DED (Data Exchange Documents) and providing details on data sharing.
Experience in writing effective Functional requirement Specification …",3 days ago,2021-01-11,https://www.indeed.com/rc/clk?jk=72f4cc32ad05bdb1&fccid=7c5db915f3edb312&vjs=3
Data Analyst,,Pocket Gems,"San Francisco, CA",,3.1,"You'll influence every decision that we make, from game design to marketing to finance.
Deployed systems to monitor player satisfaction with our games.",30+ days ago,2021-01-11,https://www.indeed.com/rc/clk?jk=6a745d92a7d1832e&fccid=687134d04f99a767&vjs=3
Market Data Research Analyst,,Logitech,"Newark, CA",,4.0,"Financial modeling and an interest in analyzing large amounts of data.
Expertise in tools such as Tableau or other data visualization techniques.",30+ days ago,2021-01-11,https://www.indeed.com/rc/clk?jk=9a98f7b95686b7ca&fccid=30f93a2656b8e223&vjs=3
Data Analyst Intern,,eBay Inc.,"San Jose, CA",,3.9,The Intern will also work with business owners and analyst teams in other parts of the eBay Marketplaces business to help them understand the impact their teams…,30+ days ago,2021-01-11,https://www.indeed.com/rc/clk?jk=2933005420ad8adb&fccid=0da3ed18c20a248d&vjs=3
Data Analyst,,hint,"San Francisco, CA",,4.3,"You will build and maintain new dashboards with existing & new data sources.
As an analyst, you will monitor, analyze and optimize marketing across eCommerce…",30+ days ago,2021-01-11,https://www.indeed.com/rc/clk?jk=067fc234c653589a&fccid=5688154fd8a952ef&vjs=3
Data Analyst,,United One Solutions,"Newark, CA",,,"This position requires the ability to collect and analyze business data, apply financial business rules and receive & process product requests.",30+ days ago,2021-01-11,https://www.indeed.com/rc/clk?jk=ee36643adaf95389&fccid=3b86d9aa300662f9&vjs=3
"Data Analyst, Global Analytics & Insights, Community Operations",,Uber,"San Francisco, CA",,3.7,"We have three broad purposes - (1) Own CommOps' data integrity and quality, metrics definitions, and reporting, (2) Inform CommOps leadership's priorities by…",30+ days ago,2021-01-11,https://www.indeed.com/rc/clk?jk=7c1f8332cf570686&fccid=f766f8bfbc3effb7&vjs=3
Business analyst,$35 an hour,Agama Solutions,"Fremont, CA",Temporarily remote,3.8,"Troubleshoot data issues by validating different data sources.
Create dashboards, spreadsheet analysis and presentations as requested by regional analysts.",30+ days ago,2021-01-11,https://www.indeed.com/rc/clk?jk=95d2af149030bed4&fccid=db130263a2af3230&vjs=3
"Data Analyst, Process & Analytics",,Tesla,"Fremont, CA",,3.5,"Ability to query from large data set in SQL, analyze and present data.
Use data to assess business impact and priorities.",30+ days ago,2021-01-11,https://www.indeed.com/rc/clk?jk=37ca98c365029e18&fccid=86e9be6ce380173e&vjs=3
Business Analyst,,PG&E Corporation,"San Ramon, CA",,3.8,"Determines data needs, collects data, selects from different analytical techniques to achieve desired data outcomes.
Data Analysis: Compiles and analyzes data.",1 day ago,2021-01-11,https://www.indeed.com/rc/clk?jk=1ce7c08d5f9f5392&fccid=0e8f04b45c1591f5&vjs=3
Administrative Assistant / Data Analyst Supporting the DEA,,Forfeiture Support Associates,"San Francisco, CA",,3.7,"Accurately enters required data into one or more databases, documents, or spreadsheets.
Attention to detail and the ability to read and follow directions is…",27 days ago,2021-01-11,https://www.indeed.com/rc/clk?jk=2770dbf0bcb5d6bb&fccid=8ce3cf8e1e3ddd14&vjs=3
Data Analyst,,Mason Tillman Associates,"Oakland, CA",,,""" button above or please send your resume and a cover letter to jobs@mtaltd.com. Include “Data Analyst” in the email heading. Equal Opportunity Employer…",30+ days ago,2021-01-11,https://www.indeed.com/rc/clk?jk=b6195097e50eddce&fccid=db0c67c31c14172d&vjs=3
Senior Data Analyst,,Alameda Health Consortium/Community Health Center...,"San Leandro, CA",,,"Working experience of data manipulation and analysis using healthcare data (claim, EHR, prefer Epic, disease registry etc.).
High degree of attention to detail.",13 days ago,2021-01-11,https://www.indeed.com/rc/clk?jk=7bd5b72a67dd15de&fccid=df13fc2816b2ebd9&vjs=3
Data Analyst,$45 - $50 an hour,SSIT Inc,"San Jose, CA",,,"3-5 years of business experience ·.
Must have worked with Cisco before and have experience with Install base.*.
Business & Data Analysis of Cisco Install Base.",26 days ago,2021-01-11,https://www.indeed.com/company/SSIT-INC/jobs/Data-Analyst-d8e4a55265b8ba2c?fccid=e79bc7bc609e2575&vjs=3
Data Analyst,$45 - $50 an hour,SSIT Inc,"San Jose, CA",,,"3-5 years of business experience ·.
Must have worked with Cisco before and have experience with Install base.*.
Business & Data Analysis of Cisco Install Base.",26 days ago,2021-01-11,https://www.indeed.com/company/SSIT-INC/jobs/Data-Analyst-d8e4a55265b8ba2c?fccid=e79bc7bc609e2575&vjs=3
Data Analyst and Applications Specialist,,G4S,"San Francisco, CA",,3.4,"Must possess a minimum of three (3) years of experience in tools development and/or data analysis.
The GSOC Data Analyst and Applications Specialist designs and…",10 days ago,2021-01-11,https://www.indeed.com/rc/clk?jk=172fe1c075755ff1&fccid=95fcff06e59f4033&vjs=3
Data Analyst,,Beshton Software,"San Francisco Bay Area, CA",,,"Identify trends in financial data and risk factors for businesses, process large amounts of collected data and make use of increased data points to increase…",30+ days ago,2021-01-11,https://www.indeed.com/rc/clk?jk=a2d8df85821fe56d&fccid=9d24d9fb191f8e45&vjs=3
Sales Analyst,"$105,000 - $135,000 a year",Fivetran,"Oakland, CA",,,"Responsible for business analytics work through all phases, including data quality, data analysis, data visualization, and presentation of results and…",24 days ago,2021-01-11,https://www.indeed.com/rc/clk?jk=747ca9577baf60c5&fccid=09c9d04ca9a8a97a&vjs=3
Business Data Analyst,,CBL SOLUTIONS INC,"Santa Clara, CA",,,"Ability to take the disparate data and translate into insights that needs to be ingested into Gainsight CRM.
Job Title : Business / Data Analyst*.",7 days ago,2021-01-11,https://www.indeed.com/company/CBL-Solutions-Inc/jobs/Business-Data-Analyst-c4d69e629ff5b469?fccid=5585efa68eed99b1&vjs=3
GSST Data Analyst II,,Milestone Technologies,"Fremont, CA",,3.3,"Write queries, perform ad hoc data analysis, and create data visualizations to keep the nerve center of our operations engine running at full speed.",30+ days ago,2021-01-11,https://www.indeed.com/rc/clk?jk=bd5ca8ea61a0cfa7&fccid=2a4e80613bf74af0&vjs=3
123 QUALITY ANALYTICS - Senior Business Intelligence Analyst,"$102,770 - $154,150 a year",Alameda Alliance,"Alameda, CA",,2.5,"Create data sets, extract and synthesize data..
This position requires an in-depth understanding of healthcare operations and data (e.g. member, claims,…",3 days ago,2021-01-11,https://www.indeed.com/rc/clk?jk=0020d30e73adebb8&fccid=540d1028cf8a5b40&vjs=3
Data Analyst,,TCS,"San Francisco, CA",,3.8,"Mortgage Lending Data Analyst or Mortgage Insurance data analyst expertise.
Exposure in working SQL Server ETL and data warehousing techniques.",30+ days ago,2021-01-11,https://www.indeed.com/rc/clk?jk=1d9869d8643ee9bb&fccid=c78fdfc4443d4537&vjs=3
Financial Data Analyst,,Earnin,"Palo Alto, CA",,,"You have 3-5 years experience in an analytical role.
Be the subject matter expert to the financial team on data trends and ensure data integrity and quality.",30+ days ago,2021-01-11,https://www.indeed.com/rc/clk?jk=6b6dc9b24a8972a3&fccid=ac5b6e59f4a450b0&vjs=3
Data Analyst,,Jobscan,"Oakland, CA",,,"Design, develop and deliver data solutions including ad hoc analysis and data visualizations.
Experience working with product data.",30+ days ago,2021-01-11,https://www.indeed.com/rc/clk?jk=daa320552735aee3&fccid=d7bf3dbc3a7f112e&vjs=3
