job_title,salary,company,location,is_remote,job_rating,job_summary,post_date,extract_date,job_url
"Associate, Strategy and Operations (Data Analyst IV)","$4,917 - $6,489 a month",TEXAS EDUCATION AGENCY,"Austin, TX",,3.7,"Advanced Excel knowledge with experience in financial modeling and data analysis.
Travel: Yes, 5 % of the Time.
Standard Hours Per Week: 40.00.",30+ days ago,2021-01-11,https://www.indeed.com/rc/clk?jk=4e32daf2fd110f87&fccid=f80b1ab2ecf7173c&vjs=3
Business Intelligence Analyst - Staff,"$70,000 - $90,000 a year",Indeed,"Austin, TX",,4.3,"Knowledge of ETL and data warehouse concepts and processes preferred.
Experience with fast-paced, data-driven business model preferred.",30+ days ago,2021-01-11,https://www.indeed.com/rc/clk?jk=819bbfc9222ee6fe&fccid=d6ef41e202aa2c0b&vjs=3
"Business Intelligence Analyst, P&T",,Procore Technologies,"Austin, TX",Remote,4.1,"Strong SQL knowledge and data visualization experience.
Identify business intelligence, reporting, and data analysis needs.",20 days ago,2021-01-11,https://www.indeed.com/rc/clk?jk=482e193beb091579&fccid=bc675912b67fcb67&vjs=3
ELINT Data Analyst,,CACI,"Austin, TX",,3.8,"Strong foundation in data analysis, inspecting and modeling data to improve current systems or design new systems.
Clearance highly preferred but not required.",6 days ago,2021-01-11,https://www.indeed.com/rc/clk?jk=22908df9f4d04d43&fccid=290a4498a64fc044&vjs=3
Research Analyst,,Texas Mutual Insurance Company,"Austin, TX",,3.9,"Experience with data analysis and data presentation.
Proficiency in Moody’s Analytics data buffet platform or other economic data platform.",30+ days ago,2021-01-11,https://www.indeed.com/rc/clk?jk=49867f804baa6b4c&fccid=482c41cdf2732d25&vjs=3
