job_title,salary,company,location,is_remote,job_rating,job_summary,post_date,extract_date,job_url
Biomedical Engineer – Technician/ 3D Printing Experience Required,,EnvisionTEC,"Dearborn, MI",,,"Ability to perform mechanical or electrical work on a machine based on provided instructions.
The 3D-Bioplotter has the capacity of fabricating scaffolds using…",2 days ago,2021-01-15,https://www.indeed.com/pagead/clk?mo=r&ad=-6NYlbfkN0CpItENr2r_jYUZ10UcyVUyGnarbJjJjVpBqSqH8rSpcGRl0ZTix0vtEeg12RAn8Pq--k0ZQeu_kpI79X8yWyopELY3oCdCo7emLD-98au4KXv0YqvZ6bPTvR3qUP1bhLBeQiml6jxMkk3MhfUom57xqe1r2EoUHZ6a4R2AcS-LfFjDPWCp3lSnwuPBet9rI1n1g6gil3VuOewmPDkfWi7RZubxiN3qsIhHEmY0YxV5aqbhB15cK2pIGRtifgd7fLmOrLpwaMl3nLWitte0sHjPHdqHObczpGNBaU9ajx5n9fLIgyUiUDYiANU_GjyxsjH5Uv6HRLyFikeCXgf4pxMj56A7k-ys8f3KInbvMxyYyBhwFkAbYGkKEpVoTVAurKCbjUAvs07DCIWK0ZiR9UaZK9ICOfJwnylQioD9AaOBnSHHSI-sMErJEuTzHj7nJXIFrfxR0-NxkO4Ez-0Li8oK76hbihAtMZ00e3C8qE8hVhkwpGzy7rxMc0ZHmbOR0E2l9frXwsQoJf-6_rs8v0Jw&p=0&fvj=1&vjs=3
Machine Learning Engineer,$40 - $60 an hour,Shrimpy,United States,,,"5+ years experience as a machine learning engineer.
Expert in LSTM models and other machine learning models.
The ideal candidate will have a deep understanding…",1 day ago,2021-01-15,https://www.indeed.com/pagead/clk?mo=r&ad=-6NYlbfkN0CK1jhFeBtSM4kASxvJHYK0u0ZMmET_vvZ72cy22dzhHt-WrRWH0kQEvkkYeGiNBJtAUXfCSwS5ujg3SuOh_da6L_GBux4VA1D5InwzPtP4HtE64I4567U36BgrBzlK4vqL1dq9ip6LucNF9az0iZ3MtvNg3lSGGcvEgKY4PbqdDUiAnVX3l1nAT2NIT9o7w3mzGF1fKaYzQKWVMaPa0zARhJbk1jIgdYdd_QD1if27gOL2IDBhUCabONhknHlIofDcSBPGp3RJXwufA5MWebH-Accd43t9EauqdGgjSE6GXXe-PTiY7ydFTeMq_9YT5K_AGcGxegKc0jSnc-VQ0HDs6PvYIzl5eSqbN_TA7ShYo-esunsXmu_ppyUhA1hZlW_KNsvc5-fUC-mLFjjeazAjjBzBxvif5C3Tw-A9CWUq-K6Sn0b8BMfvUIC3oxfNSZ_wE6KUPbMATqbIBDXKkXQ33DG6R1VIn7U=&p=1&fvj=1&vjs=3
Co-op Student - Help Desk,$15.00 - $18.50 an hour,Oakland Community Health Network,"Troy, MI",Temporarily remote,,Actively identifying new areas for learning; regularly creating and taking advantage of learning opportunities; using newly gained knowledge and skill on the…,3 days ago,2021-01-15,https://www.indeed.com/pagead/clk?mo=r&ad=-6NYlbfkN0BD2ZBwfGEyH1t1VaWpcdAW983QhoccyD-PKWxuD1jcIDcZrMPK5CeamB9SYFn4y4nXE6xdtghMu_PZvOPVZ9qXBJyd0dlMPOP7aI_S6GUdomP8f8g1YYLFZPDR6Igpki7eEWt5-uvAvtNeb5JvyEb2f7lbOJ7QENLvoe7EXtM53f-4RvuDaILvyU-r7_P2QmW7ghjL-ICc-rcAz0ZWnbGhNkSSjs7-Wg8qYSwTlqAO-uglZVtf_kQaUeabdFU-OWaGuISID9CpDjx4_RrcaG-NRQW1Q00lzUY8vzIFyLDtRA6T1al38imHc1cZS5SLGtRLG__qqrWOnnfQKNcRXryfvi0K9vvpFVT4nn3VACosJ7UlCk2aLDnkBsDNtu3llntaI9UM037FFB5TcQc8ZOby64vFwFUtNmIGhAnTlAX7NEnQ0ItNSc-BVoFw1cuuS53iwz29CmjDklz1vZZAoTVUqyY5K2NUsh4=&p=2&fvj=1&vjs=3
Machine learning engineer,,SafeRide,"Detroit, MI",,4.4,"Applied experience with machine learning and deep learning on very large data sets.
8 years of directly relevant, tech industry work experience, including deep…",30+ days ago,2021-01-15,https://www.indeed.com/rc/clk?jk=ebd0b0b917b09945&fccid=8497cd18aa994446&vjs=3
R&D Machine Learning Engineer / Data Scientist (2021),,Nexteer Automotive Corporation,"Auburn Hills, MI",,3.3,"Work in a team environment with other machine learning and data engineers.
Stay abreast of latest developments in machine learning.",24 days ago,2021-01-15,https://www.indeed.com/rc/clk?jk=99fe687d50d96e2b&fccid=5274b5b41a5b8962&vjs=3
Data Engineer,$45 - $50 an hour,"Key Business Solutions, Inc.","Detroit, MI",,3.8,"Big Data/Hadoop Developer with SQL experience*.
What are the ETL (Extract , transform , Load) tools that you have used – Provide a context on usage ,methodology…",3 days ago,2021-01-15,https://www.indeed.com/pagead/clk?mo=r&ad=-6NYlbfkN0BNBWzMgl7HUVWFbExaRkiqMYLICtqTN56aiBaUt80AZVbMrbVEs6FG7V2BKH7-OTQrSyrAL28pR8hZeJGZK7NvxL-gMgboaNxYWtpIKhEU3qlN0B90X1OFkuzCGmcgZhKa-pE_UeDZeOAyX-zVswujgdJ9HrFHJoEEYPDv7pHQbCu8V_A_MBh7lp8R2pIDLDHxqmpakq2Zt0PRWaPMxtLIdGo6ecTqPSGUoYPNn-nmdsbxHcILYThaSyGCDmKuzBTu-gWRIs-o2Gk4o016Kuc1q6MsZAVnqlaFvD5iImITDcc-QfGhc4s5a6verl8kSZxfQ-V6CvGaQLxTXOf1ZA5-z4cTc0rUa0vJAtDPx0WU0ZVju5s1I1jGmh3V9VjHVAaFHe0cI-sB1W10bNQD6HXOW3mehUHvZvNuyHRUhLmnIxAFgdoib9CFk0sc4GzRVT9nnch93r9WjUdGWS3gv63uoxxvhizxOuA=&p=5&fvj=1&vjs=3
Business Office Analyst,,Jacobs,"Dearborn, MI",,3.9,"Experience working in the automotive field or testing and interfacing with engineers is desired.
Jacobs Technology is seeking individuals who are self-leaders,…",9 days ago,2021-01-15,https://www.indeed.com/rc/clk?jk=383a74723a738dfe&fccid=de56d7554bea5214&vjs=3
Additive Manufacturing Engineer,,Ford Motor Company,"Dearborn, MI",,4.1,"6 months of experience implementing machine learning in the additive manufacturing field.
Take responsibility to implement machine-learning models to aid the…",29 days ago,2021-01-15,https://www.indeed.com/rc/clk?jk=b420a5bf191895b3&fccid=761c44c17d636bfe&vjs=3
2021 - Development Program for Engineers,,Kautex,"Troy, MI",,3.6,"Do you hold a graduate-level degree (Bachelors or Masters) in Mechtronics, Electronics or Computer Sciences/Informatics?
To have 6month PMP target definition.",2 days ago,2021-01-15,https://www.indeed.com/rc/clk?jk=c7d6ada9be215eac&fccid=39305c053d19eea9&vjs=3
Quality Inspector - Machine Shop,,AJM Packaging,"Detroit, MI",,3.1,"This position is eligible for company paid medical insurance (Blue Cross Blue Shield), dental insurance, vision insurance, short and long-term disability, life…",2 days ago,2021-01-15,https://www.indeed.com/rc/clk?jk=1a157723f4edff53&fccid=0eecc0f07b10014e&vjs=3
Machine Controls Engineer - PPO Process Engineering,,General Motors,"Pontiac, MI",,4.1,"Responsible for new pre-production product program execution, production support of machine controls (both PLC and CNC), vision and robotics, and supporting…",9 days ago,2021-01-15,https://www.indeed.com/rc/clk?jk=7334630ffa5e787b&fccid=116680a29a847a70&vjs=3
CDAO - Data Analytics Professionals,,General Motors,"Warren, MI",Remote,4.1,"They are responsible for assessing accuracy of text and sentiment classifiers, using machine learning models to enhance the ontologies, and collaborating with…",29 days ago,2021-01-15,https://www.indeed.com/rc/clk?jk=9c5bbf62264a6883&fccid=116680a29a847a70&vjs=3
SENIOR MACHINE LEARNING ENGINEER,,"Stoneridge, Inc.","Novi, MI",,3.6,"Master’s Degree with 3 years of working experience, or PhD with solid research experience in the machine learning/deep learning area.",30+ days ago,2021-01-15,https://www.indeed.com/rc/clk?jk=f534dc92b0dc95cc&fccid=14ffc924195e31e2&vjs=3
"Vice President, Data Science & AI",,Quicken Loans,"Detroit, MI",,3.8,"Lead and foster the growth of a large multifunctional team, including data scientists, data analysts, machine learning engineers, data engineers, architects and…",Today,2021-01-15,https://www.indeed.com/rc/clk?jk=51fd3dd4a2b84211&fccid=ac6e043a4dae762c&vjs=3
Research Engineer,,Ford Motor Company,"Dearborn, MI",,4.1,"As part of this remarkable, forward-looking team, you’ll help develop vehicle controls for a variety of incredible applications.",30+ days ago,2021-01-15,https://www.indeed.com/rc/clk?jk=701247e8792469d5&fccid=761c44c17d636bfe&vjs=3
Manufacturing Engineer,,Stanley Black & Decker,"Chesterfield, MI",,3.6,"Interface with Tooling Engineering and Purchasing on the new construction of tools, injection molding machines and secondary operation of equipment.",28 days ago,2021-01-15,https://www.indeed.com/rc/clk?jk=7bea0fc713c4416a&fccid=d30328706976dba9&vjs=3
Autosar Software Engineer,$62 - $70 an hour,Teoresi Inc.,"Troy, MI",,,Core business of Teoresi Inc. are powertrain and infotainment technologies such as innovative human machine interface systems.,Today,2021-01-15,https://www.indeed.com/company/TEORESI-INC./jobs/Autosar-Software-Engineer-4940bc132c366531?fccid=512b4c7dfb934d7f&vjs=3
Senior Deep Learning and AI Engineer,,Visteon Corporation,"Van Buren, MI",,4.1,"Architect and design best in class machine learning solutions for ADAS use cases.
This position is located in Visteon’s Head Office, and will be required to…",30+ days ago,2021-01-15,https://www.indeed.com/rc/clk?jk=00a25835b1346300&fccid=687353658ec2a0cb&vjs=3
Research Engineer – Advanced ML Methods,,Ford Motor Company,"Dearborn, MI",,4.1,"Working level understanding of sophisticated machine learning techniques as it pertains to RL.
You will also work with practicing engineers in transferring…",30+ days ago,2021-01-15,https://www.indeed.com/rc/clk?jk=bda746d0c9e4cbce&fccid=761c44c17d636bfe&vjs=3
Data Engineer,,Rocket Loans,"Detroit, MI",,2.5,Collaborate with data analysts and data scientists on the design of data structures to support reporting and machine learning solutions.,27 days ago,2021-01-15,https://www.indeed.com/rc/clk?jk=e9e94735e7c9b43e&fccid=61ef9640f6840cde&vjs=3
Controls Engineer,,Kfilarski Staff,"Sterling Heights, MI",,,Performs preventative maintenance as requested by the customer to ensure minimum down-time and optimum operation of machines and equipment.,1 day ago,2021-01-15,https://www.indeed.com/company/Kfilarski-Staff/jobs/Control-Engineer-33eaffde2752b9d1?fccid=fbfc0cda83fbfa81&vjs=3
Associate,,Exponent,"Farmington Hills, MI",,4.0,"Prior machine learning experience is desirable.
Effective leadership skills and the ability to interact with a wide variety of professionals, including…",30+ days ago,2021-01-15,https://www.indeed.com/rc/clk?jk=22dd81f8536ef22a&fccid=0213df1b2d6a2c22&vjs=3
Detailer,,Android Industries,"Auburn Hills, MI",,3.5,"Model and Detail parts for assembly machines, tooling and equipment.
Ability to revise Details, Assemblies & BOM’s paying attention to details and following…",25 days ago,2021-01-15,https://www.indeed.com/rc/clk?jk=f852ed4fbdc776c7&fccid=c19d8918a8a33a2e&vjs=3
Intern – Data Scientist,,Soothsayer Analytics,"Livonia, MI",,3.5,"Knowledge on implementing machine learning algorithms and models.
0-3 months experience with open source machine learning tools built in Python or R.",30+ days ago,2021-01-15,https://www.indeed.com/rc/clk?jk=a3e7bd673fe275ce&fccid=7eea1f754f48fabf&vjs=3
CFD Design Space and Automation Intern,,Altair Engineering,"Troy, MI",,4.2,"CFD Design Space and Automation Intern to work with the Automotive Aerodynamics team in developing the workflow that includes the design space, automation, and…",28 days ago,2021-01-15,https://www.indeed.com/rc/clk?jk=69369386ec1068d7&fccid=3453268f43beb582&vjs=3
Sr Technical Program Manager,,Amazon.com Services LLC,"Detroit, MI",,3.6,"A background in machine learning models or natural language processing.
. 6+ years relevant work experience in training, coordination, and/or high-technology.",30+ days ago,2021-01-15,https://www.indeed.com/rc/clk?jk=66041d9640428354&fccid=fe2d21eef233e94a&vjs=3
AI/ML Scientist,,General Motors,"Warren, MI",,4.1,"Applying machine learning methodology, with emphasis on applying and integrating machine learning with traditional analytic methods.",30+ days ago,2021-01-15,https://www.indeed.com/rc/clk?jk=940a8679abb1f025&fccid=116680a29a847a70&vjs=3
AI (NLP/NLU) Research Engineer,,Ford Motor Company,"Dearborn, MI",,4.1,"Experience as an AI machine learning engineer.
Strong interest in cognitive computing technologies in the areas of language, learning and reasoning as well as…",14 days ago,2021-01-15,https://www.indeed.com/rc/clk?jk=3520103d85f3ba3d&fccid=761c44c17d636bfe&vjs=3
WordPress Engineer,,GalaxE.Solutions,"Detroit, MI",,2.5,"Design, code and debug complex software applications.
Perform software analysis, risk analysis, reliability analysis.",28 days ago,2021-01-15,https://www.indeed.com/rc/clk?jk=1b40301d2ab7f217&fccid=5b75a1df86adb527&vjs=3
Connectivity Software Engineer,,Ford Motor Company,"Dearborn, MI",,4.1,The Connectivity Software Engineer will be part of the Research and Advanced Engineering team at Ford Motor Company and work on developing next generation…,30+ days ago,2021-01-15,https://www.indeed.com/rc/clk?jk=4c4defdeb1fe4e9a&fccid=761c44c17d636bfe&vjs=3
AI/ML Scientist,,General Motors,"Warren, MI",,4.1,"Applying machine learning methodology, with emphasis on applying and integrating machine learning with traditional analytic methods.",30+ days ago,2021-01-15,https://www.indeed.com/rc/clk?jk=940a8679abb1f025&fccid=116680a29a847a70&vjs=3
AI (NLP/NLU) Research Engineer,,Ford Motor Company,"Dearborn, MI",,4.1,"Experience as an AI machine learning engineer.
Strong interest in cognitive computing technologies in the areas of language, learning and reasoning as well as…",14 days ago,2021-01-15,https://www.indeed.com/rc/clk?jk=3520103d85f3ba3d&fccid=761c44c17d636bfe&vjs=3
WordPress Engineer,,GalaxE.Solutions,"Detroit, MI",,2.5,"Design, code and debug complex software applications.
Perform software analysis, risk analysis, reliability analysis.",28 days ago,2021-01-15,https://www.indeed.com/rc/clk?jk=1b40301d2ab7f217&fccid=5b75a1df86adb527&vjs=3
Connectivity Software Engineer,,Ford Motor Company,"Dearborn, MI",,4.1,The Connectivity Software Engineer will be part of the Research and Advanced Engineering team at Ford Motor Company and work on developing next generation…,30+ days ago,2021-01-15,https://www.indeed.com/rc/clk?jk=4c4defdeb1fe4e9a&fccid=761c44c17d636bfe&vjs=3
Account Manager/Sales Engineer,,OMRON,"Detroit, MI",,3.9,"We serve OEM machine builders and end users with a wide range of products that integrate easily into complete automation solutions, offer simple connectivity,…",30+ days ago,2021-01-15,https://www.indeed.com/rc/clk?jk=5406bdc6debdd55a&fccid=74863a92805aacc3&vjs=3
"Training Specialist, Senior – Electrical (As-Needed)",,Shermco Industries,"Detroit, MI",,3.5,"Our focus is to make sure electrical power systems are functioning properly and safely.
Add to that our Professional Engineering Group, Rotating Machinery…",8 days ago,2021-01-15,https://www.indeed.com/rc/clk?jk=16039178678c87d5&fccid=6ddc6c37569c503d&vjs=3
Summer Intern - System Requirements,,Harman International,"Novi, MI",,4.0,"Some proficiency on Java, Python, Machine Learning concepts (supervised learning and Classifier model) is highly desirable; besides Windows-based PC skills.",30+ days ago,2021-01-15,https://www.indeed.com/rc/clk?jk=d31d2f5c46e43d03&fccid=4faf342d2307e9ed&vjs=3
Manufacturing Simulation Application Engineer Intern,,Altair Engineering,"Troy, MI",,4.2,"Altair transforms design and decision making by applying simulation, machine learning and optimization throughout product life-cycles.",30+ days ago,2021-01-15,https://www.indeed.com/rc/clk?jk=03703054c7972be6&fccid=3453268f43beb582&vjs=3
Data Scientist/ Predictive Analytics Actuary,,General Motors,"Warren, MI",Remote,4.1,"Proficient with generalized linear modeling and solid understanding of multiple other statistical modeling, machine learning, deep learning, or data mining…",7 days ago,2021-01-15,https://www.indeed.com/rc/clk?jk=6a5d4885108930d6&fccid=116680a29a847a70&vjs=3
Strategic Account Manager- Automotive,,OMRON,"Detroit, MI",,3.9,"We serve OEM machine builders and end users with a wide range of products that integrate easily into complete automation solutions, offer simple connectivity,…",18 days ago,2021-01-15,https://www.indeed.com/rc/clk?jk=9dc0c9e23a43caa6&fccid=74863a92805aacc3&vjs=3
Product Engineer,,SKF,"Plymouth, MI",,4.0,Technical University Degree or proven work experience in machine/mechanical system design that can add value to the department both now and in the future.,30+ days ago,2021-01-15,https://www.indeed.com/rc/clk?jk=68270f6878b114df&fccid=984d08ab437858b8&vjs=3
Software Engineer,,GalaxE.Solutions,"Detroit, MI",Remote,2.5,"Therefore, we’re more focused on where you stand on programming fundamentals, including common data types, design patterns, and data structures; object-oriented…",30+ days ago,2021-01-15,https://www.indeed.com/rc/clk?jk=a06340afa445a3c3&fccid=5b75a1df86adb527&vjs=3
Data Engineer,,Ford Motor Company,"Dearborn, MI",,4.1,"Familiar with big data and machine learning tools and platforms.
Work with data scientists and software engineers to understand data activities, data solution…",30+ days ago,2021-01-15,https://www.indeed.com/rc/clk?jk=56f89beb75232e03&fccid=761c44c17d636bfe&vjs=3
Research Engineer – Robust and Explainable AI Methods,,Ford Motor Company,"Dearborn, MI",,4.1,"Publish internally and engage in internal knowledge dissemination through teaching, mentoring and seminars as well as through any Ford learning and development…",30+ days ago,2021-01-15,https://www.indeed.com/rc/clk?jk=8bd88434468592ba&fccid=761c44c17d636bfe&vjs=3
Sr ADAS Engineer,,Renesas Electronics America Inc.,"Farmington Hills, MI",,3.7,"Manage deep dives on various technical topics ranging from ADAS systems to individual components such AI, Machine learning, communication, virtualization etc.",30+ days ago,2021-01-15,https://www.indeed.com/rc/clk?jk=42b49386f9e0ed3d&fccid=2736ebbc71c8340f&vjs=3
Research Software Engineer,,Ford Motor Company,"Dearborn, MI",,4.1,"Artificial intelligence, machine learning and deep learning (AI/ML/DL) are key technologies driving our incredible mobility advancements.",30+ days ago,2021-01-15,https://www.indeed.com/rc/clk?jk=99094c79636ac02d&fccid=761c44c17d636bfe&vjs=3
EDU Software Engineer- Remote,,Splunk,"Detroit, MI",Remote,4.1,"Understanding of machine and application logs.
Tasks include working on technologies that deploy lab servers, mock machine data, integrate multiple API services…",3 days ago,2021-01-15,https://www.indeed.com/rc/clk?jk=6872fe6ab06b4c49&fccid=aef928e89977f7f0&vjs=3
Data Scientist,,umlaut North America,"Detroit, MI",,3.5,"Two years’ experience in machine learning implementation.
Improve product and service by utilized machine learning tools and technique.",1 day ago,2021-01-15,https://www.indeed.com/rc/clk?jk=c84f5c67584a9162&fccid=fb6df03175754b0e&vjs=3
Information Technology College Co-Op,,American Axle & Manufacturing,"Southfield, MI",,3.6,"Job Description Summary The Co-op’s primary focus will be in learning the basics of a Data Scientist position by applying AAM Business processes, data mining…",4 days ago,2021-01-15,https://www.indeed.com/rc/clk?jk=f7fc256c31f26b5d&fccid=0f68f0d34ef9c0fb&vjs=3
Solution Sales Engineer,,Schneider Electric,"Detroit, MI",,3.9,"From the simplest of switches to complex operational systems, our technology, software and services improve the way our customers manage and automate their…",30+ days ago,2021-01-15,https://www.indeed.com/rc/clk?jk=7258bd78f19d2e67&fccid=8dc4399ddb463d4a&vjs=3
Advanced Application Software Engineer,,Ford Motor Company,"Dearborn, MI",,4.1,"In-depth understanding of artificial intelligence and machine learning.
Leverage machine learning techniques to generate requirements, testing and validations.",30+ days ago,2021-01-15,https://www.indeed.com/rc/clk?jk=e6f79a475a96dcb6&fccid=761c44c17d636bfe&vjs=3
Mechanical/Manufacturing Engineer,,COE Press Equipment,"Sterling Heights, MI",,,"Take personal responsibility and action toward self-improvement and learning.
Validate designs of mechanical coil handling and feeding machines using…",11 days ago,2021-01-15,https://www.indeed.com/company/COE-Press/jobs/Mechanical-Manufacturing-Engineer-8010a6997e9c6b05?fccid=aca0c19492378f6a&vjs=3
Field Application Engineer - Auto,,Micron,"Detroit, MI",,3.8,"Experience working as an applications engineer for a semiconductor manufacturer preferred.
The ability to work with engineers across multiple disciplines, as…",30+ days ago,2021-01-15,https://www.indeed.com/rc/clk?jk=6ef6915054513c07&fccid=be240c643a8631c5&vjs=3
Software Development Engineer - Big Data Technologies,,Amazon.com Services LLC,"Detroit, MI",,3.6,"Programming experience with at least one modern language such as Java, C++, or C# including object-oriented design.
Experience with large scale systems.",3 days ago,2021-01-15,https://www.indeed.com/rc/clk?jk=98dcf4bb8d6aa12b&fccid=fe2d21eef233e94a&vjs=3
Senior C++ Software Engineer,,Motional,"Detroit, MI",Temporarily remote,,"With competitive sign-on bonuses for applicable candidates, there’s no better time to start the journey with us.
Temporarily due to COVID-19.",30+ days ago,2021-01-15,https://www.indeed.com/company/TWI-for-Motional/jobs/Senior-C++-Software-Engineer-b1bbfeffdef5a0c8?fccid=c21d905d63e40901&vjs=3
Project Manager,,Esys,"Sterling Heights, MI",,,"Lead/Manage engineers and technical trades on project teams.
Ability to lead/manage engineers and technical trades on project teams.",10 days ago,2021-01-15,https://www.indeed.com/rc/clk?jk=961e5a75b6698004&fccid=0fbc339f49d49ebb&vjs=3
Full-Stack Software Engineer,,GalaxE.Solutions,"Detroit, MI",,2.5,"Therefore, we’re more focused on where you stand on programming fundamentals, including common data types, design patterns, and data structures; object-oriented…",30+ days ago,2021-01-15,https://www.indeed.com/rc/clk?jk=97600292a36d1c83&fccid=5b75a1df86adb527&vjs=3
Engineer - Staff,,DTE Energy,"Detroit, MI",,3.9,"Participates on teams of field employees, technicians, engineers and other personnel.
Intermediate level engineer responsible for independently evaluating,…",30+ days ago,2021-01-15,https://www.indeed.com/rc/clk?jk=7bdbab76b61058a1&fccid=39b4b67c5b736173&vjs=3
Data Scientist II,,Ryder,"Novi, MI",,3.4,"On this team, a Data Scientist will get the chance to be the machine learning expert, collaborating with Data Engineers and Analysts, using all their skills in…",30+ days ago,2021-01-15,https://www.indeed.com/rc/clk?jk=243c838d6cc55461&fccid=22f3171d623451cc&vjs=3
Controls Engineer,,Esys,"Sterling Heights, MI",,,"Experience with machine vision applications (Cognex, Keyance, etc.), machine commissioning, and troubleshooting skills;
GCCH and GCCS Certifications a plus.",30+ days ago,2021-01-15,https://www.indeed.com/rc/clk?jk=76ba976fe3719263&fccid=0fbc339f49d49ebb&vjs=3
Sr ADAS Engineer,,Renesas Electronics America Inc.,"Farmington Hills, MI",,3.7,"Manage deep dives on various technical topics ranging from ADAS systems to individual components such AI, Machine learning, communication, virtualization etc.",30+ days ago,2021-01-15,https://www.indeed.com/rc/clk?jk=42b49386f9e0ed3d&fccid=2736ebbc71c8340f&vjs=3
Data Scientist - Nationwide Opportunities,,"Amazon Web Services, Inc.","Detroit, MI",,3.6,Experience in an ML engineer or data scientist role building and deploying ML models or hands on experience developing deep learning models.,30+ days ago,2021-01-15,https://www.indeed.com/rc/clk?jk=d6f6b859027f1cee&fccid=fe2d21eef233e94a&vjs=3
Systems Engineer,,GalaxE.Solutions,"Detroit, MI",,2.5,"Perform systems implementation, automation and maintenance of infrastructure on premises and in the cloud.
Troubleshoot server- and network-related problems and…",30+ days ago,2021-01-15,https://www.indeed.com/rc/clk?jk=fbb827e5f72acc0b&fccid=5b75a1df86adb527&vjs=3
Quality Fixture Engineer,,Flex-N-Gate Corporation,"Warren, MI",,3.3,"Knowledge of production process, machines, tools, including design and uses.
Extensive safety training, new hire orientation, continuous learning and…",30+ days ago,2021-01-15,https://www.indeed.com/rc/clk?jk=7e84b5ec5392f56d&fccid=2cb2fcbeb2acee70&vjs=3
Research Scientist – Advanced ML – DL Methods and Learning Frameworks,,Ford Motor Company,"Dearborn, MI",,4.1,"Develop through, self-learning and deep research, new mathematical formulations and learning architectures as may become necessary when dealing with atypical…",30+ days ago,2021-01-15,https://www.indeed.com/rc/clk?jk=8390627105c1dfa1&fccid=761c44c17d636bfe&vjs=3
Research Software Engineer,,Ford Motor Company,"Dearborn, MI",,4.1,"Artificial intelligence, machine learning and deep learning (AI/ML/DL) are key technologies driving our incredible mobility advancements.",30+ days ago,2021-01-15,https://www.indeed.com/rc/clk?jk=99094c79636ac02d&fccid=761c44c17d636bfe&vjs=3
EDU Software Engineer- Remote,,Splunk,"Detroit, MI",Remote,4.1,"Understanding of machine and application logs.
Tasks include working on technologies that deploy lab servers, mock machine data, integrate multiple API services…",3 days ago,2021-01-15,https://www.indeed.com/rc/clk?jk=6872fe6ab06b4c49&fccid=aef928e89977f7f0&vjs=3
Data Scientist,,umlaut North America,"Detroit, MI",,3.5,"Two years’ experience in machine learning implementation.
Improve product and service by utilized machine learning tools and technique.",1 day ago,2021-01-15,https://www.indeed.com/rc/clk?jk=c84f5c67584a9162&fccid=fb6df03175754b0e&vjs=3
Information Technology College Co-Op,,American Axle & Manufacturing,"Southfield, MI",,3.6,"Job Description Summary The Co-op’s primary focus will be in learning the basics of a Data Scientist position by applying AAM Business processes, data mining…",4 days ago,2021-01-15,https://www.indeed.com/rc/clk?jk=f7fc256c31f26b5d&fccid=0f68f0d34ef9c0fb&vjs=3
Solution Sales Engineer,,Schneider Electric,"Detroit, MI",,3.9,"From the simplest of switches to complex operational systems, our technology, software and services improve the way our customers manage and automate their…",30+ days ago,2021-01-15,https://www.indeed.com/rc/clk?jk=7258bd78f19d2e67&fccid=8dc4399ddb463d4a&vjs=3
