job_title,salary,company,location,is_remote,job_rating,job_summary,post_date,extract_date,job_url
Data Scientist,,Sourceability,United States,Remote,5.0,"We are seeking a hands-on Senior Data Scientist to skillfully apply mathematics, statistical analysis, machine learning, prediction, and other data science…",30+ days ago,2021-01-15,https://www.indeed.com/pagead/clk?mo=r&ad=-6NYlbfkN0ADvRi4Fhzo6Lhixq24Efpt7RwpjKDyUQihLKB9436vvhUCqFEm-nkW0la8YnoGNEFh8i3JW6ZTXhE4DkVrso5T3Vz8yXJdq2dJLsgTANS_yKbR-JYOMuO2e5aBVxks2k6rMMP9qB20LAKyRlZvk7-84WO46AyQ2moZGjxCJmldcEsitmXLLHDrRm7h-NXj9EShJ1VLEtjJxFMkZ_mH_cFbFLZL7t7mlfuHZxzilDOfrqs56ycbz1Z6CEZAttqLSeurlK3Qiz5OSspUkjSFqDQ02JPIYCwUQKfJRCORDPwdVf7gTH0eknsIDWkmQ2khzt7YOXXZzaCTUMpVnGUPoNHV_GuK8IGO-3Q1f6ZBCoCveZ5gRe-8LwZwGKM4gONTWCTzDd1-d0AgkRWkcue9sijr2plswZ9mYvpAOZVQJNQQteLYqJM4NsOSxJ3tL-yIdUIXup-REBEBBAIrVUQEW1bZ&p=0&fvj=1&vjs=3
Strategic Analytics – Data Scientist,,Deloitte,"Pittsburgh, PA",,4.0,"1-2 years of relevant work experience as a data scientist is preferred.
Our project-based team is looking for a Data Scientist who will be responsible for…",30+ days ago,2021-01-15,https://www.indeed.com/rc/clk?jk=76092dd4a5c3b84a&fccid=9e215d88a6b33622&vjs=3
"Data Scientist, Intern",,Duolingo,"Pittsburgh, PA",,4.7,"Derive insights from data to influence product roadmaps and drive business results.
Experience articulating business questions and using available data to find…",30+ days ago,2021-01-15,https://www.indeed.com/rc/clk?jk=e82986b44c7e00fe&fccid=1d7146bd38091a7a&vjs=3
NLP Data Scientist,,Amazon.com Services LLC,"Pittsburgh, PA",,3.6,"Design and implement software to collect, analyze and prepare large natural language data sets.
Drive data science and NLP exploration and innovation for MT…",27 days ago,2021-01-15,https://www.indeed.com/rc/clk?jk=cb6e48cc110e7b39&fccid=fe2d21eef233e94a&vjs=3
Data Scientist,,Fortive Corporate,"Pittsburgh, PA",,3.3,"Experience with creating complex data sets (SQL), data modeling and reporting.
Deep interest and aptitude in data, metrics, analysis and trends.",30+ days ago,2021-01-15,https://www.indeed.com/rc/clk?jk=f4073964171daca1&fccid=0ab42c4503235145&vjs=3
Data Scientist,,Highmark Health,"Pittsburgh, PA",,3.2,"Research self- directed new analytical skills and approaches, building relationships internally and externally to transfer knowledge and maintain their position…",23 days ago,2021-01-15,https://www.indeed.com/rc/clk?jk=f559a0c3b0040846&fccid=05de1bb29b7bb370&vjs=3
Data Scientist # JN -122020-58281,,SSI,"Pittsburgh, PA",,3.7,"Building application layers, moving data from SAS to Python, then moving into Spark.
Data analysis using data science toolkits such as Python, SPARK, Tableau,…",17 days ago,2021-01-15,https://www.indeed.com/rc/clk?jk=f9e0f6efe0f5b2a2&fccid=3322122de9faaef8&vjs=3
Data Scientist,,Govini,"Pittsburgh, PA",,2.5,"Proficiency in statistical analysis, quantitative analytics, forecasting/predictive analytics, multivariate testing, and optimization algorithms.",18 days ago,2021-01-15,https://www.indeed.com/rc/clk?jk=b5e6e38522e96fa9&fccid=932bcab1f7ee18f8&vjs=3
Senior Data Analyst,$40 - $55 an hour,Systems Inc,"Pittsburgh, PA",Remote,3.0,"Ensures data integrity and compliance by performing data cleansing, data audit and/or data validation.
Provides business process, system support and data…",1 day ago,2021-01-15,https://www.indeed.com/company/SYSTEMS-INC/jobs/Senior-Data-Analyst-0efa4283233b9e37?fccid=30ec95f249fece83&vjs=3
Data Scientist or Senior Data Scientist,,Federated Hermes,"Pittsburgh, PA",Temporarily remote,,"Bachelor’s Degree in data science, machine learning, computer science, applied mathematics, statistics, and/or related advanced analytics field, Master’s Degree…",30+ days ago,2021-01-15,https://www.indeed.com/company/Federated-Hermes/jobs/Data-Scientist-or-Senior-Data-Scientist-f161cbba36b2527a?fccid=de75fea91e79d4d2&vjs=3
Data Analyst,,"Othot, Inc.","Pittsburgh, PA",,,"Integrate data from multiple data sources or functional areas, ensures data accuracy and integrity, and updates data as needed.",7 days ago,2021-01-15,https://www.indeed.com/rc/clk?jk=e67ca16e0f326c82&fccid=503cb05e7675e46f&vjs=3
Data Scientist,"$46,644 - $76,440 a year",The University of Pittsburgh,"Pittsburgh, PA",,4.2,"In addition, the candidate must have experience with Bayesian data analysis methods and statistical programming (preferably in R) g, as well as designing,…",30+ days ago,2021-01-15,https://www.indeed.com/rc/clk?jk=7c591189f8e043d6&fccid=1f92178814b05d89&vjs=3
Early Careers | Financial Modeling & Research | Canonsburg,,Goldman Sachs,"Canonsburg, PA",,4.0,"0-3 years of prior work experience in a relevant field.
Accounting and financial planning teams across the firm embody strong analytical skills, attention to…",6 days ago,2021-01-15,https://www.indeed.com/rc/clk?jk=2f1c7b35e65290d3&fccid=16a97ed26c75bf2d&vjs=3
Sr Data Scientist,,PPG Industries,"Hampton Township, PA",,3.4,"The individual will utilize machine learning, computer vision, advanced statistical analysis, data mining, and data visualization methods to drive product and…",16 days ago,2021-01-15,https://www.indeed.com/rc/clk?jk=24166b228a88ae81&fccid=d331f45cf2b412e1&vjs=3
Data Scientist,,Thermo Fisher Scientific,"Pittsburgh, PA",,3.5,"Familiarity with using data visualization tools.
Assist our business partners by being able to deliver a ML / DL project from beginning to end, including…",30+ days ago,2021-01-15,https://www.indeed.com/rc/clk?jk=a06e2bab09b10e35&fccid=126e3afd205caa95&vjs=3
Data Scientist - AI/ML,,PNC Financial Services Group,"Pittsburgh, PA",,3.6,"Participates in the data gathering, data processing and data mining of large and complex datasets.
Assists in the presentation of business insights to…",30+ days ago,2021-01-15,https://www.indeed.com/rc/clk?jk=95e9e5aa6f139cf8&fccid=b1330bfa6e5aae73&vjs=3
Data Scientist,,Carnegie Mellon University,"Pittsburgh, PA",,4.2,"BS in data science, machine learning, computer science, statistics, or related highly-quantitative discipline with eight (8) years of experience or equivalent…",30+ days ago,2021-01-15,https://www.indeed.com/rc/clk?jk=473ab817ce9ebccb&fccid=7655fb7543c6cbbf&vjs=3
Senior Data Scientist,,ServiceLink Information Technology,"Pittsburgh, PA",,3.0,You have experience in creating and implementing machine learning algorithms and advanced statistics and are proficient in statistical computing languages for…,30+ days ago,2021-01-15,https://www.indeed.com/rc/clk?jk=6d09b987784d3222&fccid=ca3449ec6925b9cd&vjs=3
Data Scientist,,Sourceability,United States,Remote,5.0,"We are seeking a hands-on Senior Data Scientist to skillfully apply mathematics, statistical analysis, machine learning, prediction, and other data science…",30+ days ago,2021-01-15,https://www.indeed.com/pagead/clk?mo=r&ad=-6NYlbfkN0ADvRi4Fhzo6Lhixq24Efpt7RwpjKDyUQihLKB9436vvhUCqFEm-nkW0la8YnoGNEFh8i3JW6ZTXhE4DkVrso5T3Vz8yXJdq2dJLsgTANS_yKbR-JYOMuO2e5aBVxks2k6rMMP9qB20LAKyRlZvk7-84WO46AyQ2moZGjxCJmldcEsitmXLLHDr-62jMw04OF10honjxtmKa03VQp3b0jNFHXphZemLspWxpEZ6GCoAyX9ddpSUzpAUIaHpXt8NQqH6yQb7pgaP0JhBKKTk-DqQH8IhsVg911W4fLjs4XO5iKswe-wuxx1ILLJNAZb0Ub6ylE9gRq_Tz4SpgJ1pwDQSM-DVQyVnyr7cf9KRt3B42vA1gx0ok6tfn7rt1_PTajas9lcecgozPXVPN4wOZrnSABKfbhx2yIG_dPu3M5HwdccBlP9RSQcpncX172MtUKc5TNkVUJ7VF3HujVvK4XPe&p=3&fvj=1&vjs=3
Machine Learning Scientist,,Amazon.com Services LLC,"Pittsburgh, PA",,3.6,"Drive scientific exploration and innovation for MT improvements and evaluation techniques.
Design and implement software to collect, analyze and prepare large…",10 days ago,2021-01-15,https://www.indeed.com/rc/clk?jk=405d94ea6946c2dd&fccid=fe2d21eef233e94a&vjs=3
Data Scientist,,International Services Management,"Pittsburgh, PA",,,"Candidate should have a BS degree with 5+ years of experience, a MS with 2+ years of experience or a PhD in Computer Science, Statistics, Mathematics,…",30+ days ago,2021-01-15,https://www.indeed.com/rc/clk?jk=b743e4de47901e9b&fccid=5570d53d4ce2f0fa&vjs=3
Data Engineer,,Zoom,"Pittsburgh, PA",,3.6,"Develops technical tools and programming that leverage artificial intelligence, machine learning and big-data techniques to cleanse, organize and transform data…",7 days ago,2021-01-15,https://www.indeed.com/rc/clk?jk=c6ccbec63123ecdf&fccid=34a307d555f04368&vjs=3
"Research Intern, Artificial Intelligence",,Facebook,"Pittsburgh, PA",,4.2,"Devise better data-driven models of human behavior, and/or.
Currently has, or is in the process of obtaining, a degree (PhD, Masters, or Bachelors with relevant…",30+ days ago,2021-01-15,https://www.indeed.com/rc/clk?jk=a01a5c1a21c4571c&fccid=1639254ea84748b5&vjs=3
Data Science Manager,,9Rooftops,"Pittsburgh, PA",,,Designing and bringing to life the endto-end Data Science process that can most optimally deliver deep insights and business results for clients at various…,2 days ago,2021-01-15,https://www.indeed.com/rc/clk?jk=c658607a05bc2788&fccid=50a12232d580b12c&vjs=3
Statistical Data Analyst,"$35,100 - $56,784 a year",The University of Pittsburgh,"Pittsburgh, PA",,4.2,"To support research activities, the candidate is expected to become familiar with the clinical background and scientific objectives of the research projects and…",30+ days ago,2021-01-15,https://www.indeed.com/rc/clk?jk=224cf1b597ed1c69&fccid=1f92178814b05d89&vjs=3
Machine Learning Engineer - Motion Simulation,,Aurora,"Pittsburgh, PA",,4.1,Responsibilities Develop cutting edge machine learning algorithms for simulating realistic interactions between autonomous vehicles and multiple actors in a…,2 days ago,2021-01-15,https://www.indeed.com/rc/clk?jk=8dadea93a4ebc32a&fccid=bf003825a010abf2&vjs=3
Statistician,,Naval Nuclear Laboratory,"West Mifflin, PA",,2.8,Provides leadership on statistical issues through collaboration with engineers and scientists across the laboratory.,8 days ago,2021-01-15,https://www.indeed.com/rc/clk?jk=cd7f3ca02525a21d&fccid=b5ff6a9d6acf7028&vjs=3
Machine Learning Research Intern,,Bosch Group,"Pittsburgh, PA",,4.1,We are looking for enthusiastic interns to join our research team for in developing new machine learning/deep learning algorithms for various real-world…,30+ days ago,2021-01-15,https://www.indeed.com/rc/clk?jk=c8da5a7e6c3cc481&fccid=a2faf1301ac6ad4b&vjs=3
Machine Learning Software Intern,,Cadence Design Systems,"Pittsburgh, PA",,4.2,"A full-time student pursuing a MS/PhD in some combination of machine learning, data science, computer science, or engineering.",7 days ago,2021-01-15,https://www.indeed.com/rc/clk?jk=844974ee63189bb6&fccid=391006290e845887&vjs=3
Sr. Machine Learning Scientist,,3M,"Pittsburgh, PA",,4.0,"Developing and/or applying statistical modeling techniques; in particular, deep learning, optimization, and other ML techniques to different applications in…",30+ days ago,2021-01-15,https://www.indeed.com/rc/clk?jk=cb8ae0d6ce8c1d0b&fccid=595d42593839d3a2&vjs=3
Data Analyst Sr,,PNC Financial Services Group,"Pittsburgh, PA",,3.6,"Requirements Analysis – Knowledge of methods and techniques to elicit, analyze and record required business functionality and non-functionality requirements;…",28 days ago,2021-01-15,https://www.indeed.com/rc/clk?jk=eb48948f5622dcd4&fccid=b1330bfa6e5aae73&vjs=3
Vice President of Data Science,,"ServiceLink Services, LLC","Pittsburgh, PA",,3.0,Drive sound data to the Product Management organization by leading the business intelligence and analytics (report/tools/analyses) in support of product…,30+ days ago,2021-01-15,https://www.indeed.com/rc/clk?jk=aef9b917ea225279&fccid=ca3449ec6925b9cd&vjs=3
Research Intern- Multimodal Machine Learning,,Bosch Group,"Pittsburgh, PA",,4.1,"(Preferred) Experience with data analytics toolkits, such as numpy, pandas, and scikit-learn.
Strong background in machine learning, with particular emphasis on…",2 days ago,2021-01-15,https://www.indeed.com/rc/clk?jk=6ac36b4901a20fa6&fccid=a2faf1301ac6ad4b&vjs=3
Principal Data Scientist - Digital Applied Innovation,,Wabtec,"Pittsburgh, PA",Remote,3.0,"A minimum of 8 years of experience as a data scientist with established skills in advanced data analytics, predictive modeling, deep learning neural networks,…",30+ days ago,2021-01-15,https://www.indeed.com/rc/clk?jk=8972ea5f50d9c530&fccid=4f4e9de46f588f62&vjs=3
Machine Learning Researcher,,3M,"Pittsburgh, PA",,4.0,"3+ years of experience in state-of-the-art machine learning and statistical modeling techniques.
Experience with deep learning toolkits and frameworks.",30+ days ago,2021-01-15,https://www.indeed.com/rc/clk?jk=dd036ef138568e3b&fccid=595d42593839d3a2&vjs=3
Analytic Data Engineer - Computer Science Engineer,,Highmark Health,"Pittsburgh, PA",,3.2,"This includes creating pathways for analysts to access operational, derived, and external data sets.
Work with alternative analytic data systems to incorporate…",30+ days ago,2021-01-15,https://www.indeed.com/rc/clk?jk=cd897f4a586168b1&fccid=05de1bb29b7bb370&vjs=3
"Program Manager, Data Science",,Thermo Fisher Scientific,"Pittsburgh, PA",,3.5,"Identifies program and project expansion opportunities to include new data sources, channels customer experiences, and cross-divisional learning.",Today,2021-01-15,https://www.indeed.com/rc/clk?jk=676b0df8ae2fa476&fccid=126e3afd205caa95&vjs=3
Data Scientist - Metrics & Product Validation,,Aurora,"Pittsburgh, PA",,4.1,Be able to argue for why those targets are valid and reason about the effect on traffic safety if those targets are achieved Guide the design of Simulated and…,2 days ago,2021-01-15,https://www.indeed.com/rc/clk?jk=9c06baa70ac3e3dc&fccid=bf003825a010abf2&vjs=3
Pricing Analyst,,FedEx Services,"Pittsburgh, PA",,3.9,"Coordinate development of project plans and timelines with other team members throughout the world.
Utilize customers’ current shipping data and available…",9 days ago,2021-01-15,https://www.indeed.com/rc/clk?jk=682d79a147fe374f&fccid=2ae04b97d8829e58&vjs=3
Principal Research Scientist - Artificial Intelligence,,RE2 Robotics,"Pittsburgh, PA",,,"The PRS will leverage their leadership, experience, and knowledge of artificial intelligence, computer vision, robotics, machine learning, optimization, and…",27 days ago,2021-01-15,https://www.indeed.com/rc/clk?jk=de242c35bae61523&fccid=be072ce91ba39a9d&vjs=3
Data Science Specialist,,Eaton,"Township of Moon, PA",,3.8,"Utilize a broad range of techniques in machine learning, data mining, statistics, and big data interrogation methods.
Travel: Yes, 10 % of the Time.",30+ days ago,2021-01-15,https://www.indeed.com/rc/clk?jk=2b7b6e555b8822a3&fccid=87f38351bd29de24&vjs=3
"Staff Scientist, Optimization and Data Analytics",,Arconic,"Alcoa Center, PA",,2.8,"5+ years of experience in developing and applying optimization and/or data analytics solutions.
7+ years of experience in developing and applying optimization…",30+ days ago,2021-01-15,https://www.indeed.com/rc/clk?jk=b75188562433d6e2&fccid=d6da256b9372422a&vjs=3
"Sr Analyst, Data Science",,Thermo Fisher Scientific,"Pittsburgh, PA",,3.5,"The ideal candidate will have a strong mathematics/statistical background, combined with a marketing and/or commercial analytics experience, and excellent…",30+ days ago,2021-01-15,https://www.indeed.com/rc/clk?jk=b2c61aea08840884&fccid=126e3afd205caa95&vjs=3
Applied Scientist II,,Amazon.com Services LLC,"Pittsburgh, PA",,3.6,"Mentor junior engineers and scientists.
Participate in the design, development, evaluation, deployment and updating of data-driven models and analytical…",30+ days ago,2021-01-15,https://www.indeed.com/rc/clk?jk=355f4d6c412e0c69&fccid=fe2d21eef233e94a&vjs=3
"Principal Machine Learning Research Scientist, Perception",,Motional,"Pittsburgh, PA",,,"Design deep neural networks for the autonomous vehicle stack.
Develop core deep learning codebase for efficient training and testing pipelines.",27 days ago,2021-01-15,https://www.indeed.com/rc/clk?jk=c8cab6d51fea4d91&fccid=86e1d3bf79028267&vjs=3
Data Science Programmer,"$46,644 - $76,440 a year",The University of Pittsburgh,"Pittsburgh, PA",,4.2,"Osmanbeyoglu Laboratory is currently working on projects involving big data including large-scale multi-omics single cell data, genomic data, information…",30+ days ago,2021-01-15,https://www.indeed.com/rc/clk?jk=756e2641a57306c0&fccid=1f92178814b05d89&vjs=3
"AI/ML - Machine Learning Engineer, Accessibility",,Apple,"Pittsburgh, PA",,4.2,"Experience applying machine learning to solve practical problems.
In this role, you will work with speech or other time-series inputs, build appropriate data…",30+ days ago,2021-01-15,https://www.indeed.com/rc/clk?jk=ab091ad17de8332a&fccid=c1099851e9794854&vjs=3
Machine Learning Summer Internship,,Carnegie Mellon University,"Pittsburgh, PA",,4.2,"Candidates will be subject to a background check.
Must be currently enrolled in a degree granting program.
Gain Hands on experience in this field.",4 days ago,2021-01-15,https://www.indeed.com/rc/clk?jk=18a7e81e9999063e&fccid=7655fb7543c6cbbf&vjs=3
"Manager, Data Science",,Westinghouse Electric Company,"Cranberry Township, PA",,3.4,"Technical knowledge of data science, data management, data architecture, artificial intelligence, machine learning and other data engineering / science skills.",30+ days ago,2021-01-15,https://www.indeed.com/rc/clk?jk=278cbd3af685af14&fccid=42e773e039e3c8bf&vjs=3
Data Scientist,,Sourceability,United States,Remote,5.0,"We are seeking a hands-on Senior Data Scientist to skillfully apply mathematics, statistical analysis, machine learning, prediction, and other data science…",30+ days ago,2021-01-15,https://www.indeed.com/pagead/clk?mo=r&ad=-6NYlbfkN0ADvRi4Fhzo6Lhixq24Efpt7RwpjKDyUQihLKB9436vvhUCqFEm-nkW0la8YnoGNEFh8i3JW6ZTXhE4DkVrso5T3Vz8yXJdq2dJLsgTANS_yKbR-JYOMuO2e5aBVxks2k6rMMP9qB20LAKyRlZvk7-84WO46AyQ2moZGjxCJmldcEsitmXLLHDrvvDosfvZy6B5ZFzGzZzh0U_Vl-JpQAC6S5QNd9lX4iD_-koOSSA_IDAT0v7r75SdnWcQon5M3zwCzQ91YAMSpGN-0v7AX-rLFjW7cM5kiVZf1TDj79h61fPzUtZ49JHNaFPxe_uYfeVcQ7v8QhhHrzxJCyGUorLcjvUTcdRk_Az9QoI85Cr-Joiay-uZjj6UiG_QmyN8auzwy_AGRlenJqQhM-Ewv0G6oIzYABDkzDzF6x8jJBTy1BjETkUdTsj6VQvS-TW9J_N7HYV6F3rWO3Qq2zHOLEky&p=4&fvj=1&vjs=3
Machine Learning Engineer,,Govini,"Pittsburgh, PA",,2.5,"Collaborate closely with fellow software engineers, data scientists, data engineers and QA engineers.
We are seeking an exceptional Machine Learning Engineer to…",11 days ago,2021-01-15,https://www.indeed.com/rc/clk?jk=d8708f60cf8f26a7&fccid=932bcab1f7ee18f8&vjs=3
"Postdoctoral Researcher, Artificial Intelligence (PhD)",,Facebook,"Pittsburgh, PA",,4.2,"Individuals in this role are expected to be recognized experts in identified research areas such as artificial intelligence, machine learning, computational…",30+ days ago,2021-01-15,https://www.indeed.com/rc/clk?jk=7539647acb2283cb&fccid=1639254ea84748b5&vjs=3
"AI/ML - Software Engineer, ML Platform & Technology",,Apple,"Pittsburgh, PA",,4.2,"Previous experience with machine learning pipelines, model evaluation, and data visualization is a plus.
Partner with data scientists and ML engineers across…",2 days ago,2021-01-15,https://www.indeed.com/rc/clk?jk=5faf5d3339e813cc&fccid=c1099851e9794854&vjs=3
"Manager, Perception Machine Learning Research",,Motional,"Pittsburgh, PA",,,Lead a team of machine learning engineers that build and design deep neural networks for the autonomous vehicle stack.,30+ days ago,2021-01-15,https://www.indeed.com/rc/clk?jk=b2a313a55b1cdfd6&fccid=86e1d3bf79028267&vjs=3
Statistician,,UPMC,"Pittsburgh, PA",,3.6,"The research program includes clinical, mechanistic, and translational studies across the spectrum of psychopathology aimed to understand the biological…",30+ days ago,2021-01-15,https://www.indeed.com/rc/clk?jk=364647f0c82dbe25&fccid=b75dda97eecc3e82&vjs=3
Machine Learning Engineer,,Fortive Corporate,"Pittsburgh, PA",,3.3,"Have made substantive contributions to open source projects in the areas of data science or machine learning.
Comfort with Ambiguity: A willingness and aptitude…",30+ days ago,2021-01-15,https://www.indeed.com/rc/clk?jk=0ad70be9976b2744&fccid=0ab42c4503235145&vjs=3
Principal Data Scientist (Clinical Data Management),,Premier Research Group Limited,"Pittsburgh, PA",,3.1,Proven expertise in ICH/GCP and/or ISO14155 requirements; knowledge of site and institution specific contract requirements; clinical trials support or…,30+ days ago,2021-01-15,https://www.indeed.com/rc/clk?jk=2e74a0a913d2f5c2&fccid=ecf3f75dc407062d&vjs=3
"Software Engineer, Machine Learning",,Google,"Pittsburgh, PA",,4.3,"Participate in cutting edge research in artificial intelligence and machine learning applications.
1 year relevant work experience in software development.",30+ days ago,2021-01-15,https://www.indeed.com/rc/clk?jk=c455f5d166e12fe6&fccid=a5b4499d9e91a5c6&vjs=3
"Research Scientist, Artificial Intelligence (PhD)",,Facebook,"Pittsburgh, PA",,4.2,"Individuals in this role are expected to be recognized experts in identified research areas such as artificial intelligence, machine learning, computational…",30+ days ago,2021-01-15,https://www.indeed.com/rc/clk?jk=9dbfb5f96ddee59d&fccid=1639254ea84748b5&vjs=3
"Artificial Intelligence, Consultant - Applied Artificial Intelligence",,Deloitte,"Pittsburgh, PA",,4.0,"Perform data studies and data discovery routines for video, voice, weblog, sensor, machine and social media data sources or mash ups of new and existing data…",30+ days ago,2021-01-15,https://www.indeed.com/rc/clk?jk=dd0612abb488236c&fccid=9e215d88a6b33622&vjs=3
Principal Data Scientist (Clinical Data Management),,Premier Research Group Limited,"Pittsburgh, PA",,3.1,Proven expertise in ICH/GCP and/or ISO14155 requirements; knowledge of site and institution specific contract requirements; clinical trials support or…,30+ days ago,2021-01-15,https://www.indeed.com/rc/clk?jk=2e74a0a913d2f5c2&fccid=ecf3f75dc407062d&vjs=3
"Software Engineer, Machine Learning",,Google,"Pittsburgh, PA",,4.3,"Participate in cutting edge research in artificial intelligence and machine learning applications.
1 year relevant work experience in software development.",30+ days ago,2021-01-15,https://www.indeed.com/rc/clk?jk=c455f5d166e12fe6&fccid=a5b4499d9e91a5c6&vjs=3
"Research Scientist, Artificial Intelligence (PhD)",,Facebook,"Pittsburgh, PA",,4.2,"Individuals in this role are expected to be recognized experts in identified research areas such as artificial intelligence, machine learning, computational…",30+ days ago,2021-01-15,https://www.indeed.com/rc/clk?jk=9dbfb5f96ddee59d&fccid=1639254ea84748b5&vjs=3
"Artificial Intelligence, Consultant - Applied Artificial Intelligence",,Deloitte,"Pittsburgh, PA",,4.0,"Perform data studies and data discovery routines for video, voice, weblog, sensor, machine and social media data sources or mash ups of new and existing data…",30+ days ago,2021-01-15,https://www.indeed.com/rc/clk?jk=dd0612abb488236c&fccid=9e215d88a6b33622&vjs=3
Senior Machine Learning Engineer,,LaborView,"Pittsburgh, PA",,,"Leveraging statistics, natural language processing (NLP) and machine learning (ML) techniques to create scalable solutions for business problems, customer…",30+ days ago,2021-01-15,https://www.indeed.com/rc/clk?jk=a451d32223b503f4&fccid=9c4194037dd700c4&vjs=3
"Senior Data Engineer, Machine Learning Infrastructure & Analytics",,Argo AI,"Pittsburgh, PA",,3.4,"The team is responsible for pipeline health, data quality, lineage, and data lifecycle management.
Work with modern cloud, big data, and analytics technologies.",30+ days ago,2021-01-15,https://www.indeed.com/rc/clk?jk=8344a5bc0eab530c&fccid=fb74c70e196043bc&vjs=3
Machine Learning Engineer,,Carnegie Mellon University,"Pittsburgh, PA",,4.2,"Our team has recently explored inverse reinforcement learning, adversarial machine learning, and custom hardware for scalable, high-performance machine learning…",30+ days ago,2021-01-15,https://www.indeed.com/rc/clk?jk=5affe3b009c90c98&fccid=7655fb7543c6cbbf&vjs=3
Senior Research Scientist-Machine Learning,,Carnegie Mellon University,"Pittsburgh, PA",,4.2,"Knowledge and Learning: You possess broad technical interests along with a deep knowledge of a particular field such as human-computer interaction, data…",30+ days ago,2021-01-15,https://www.indeed.com/rc/clk?jk=7445cf114ffcf4c1&fccid=7655fb7543c6cbbf&vjs=3
"Senior Machine Learning Engineer (Health, Wellness, Digital Therapeutics)",,Philips,"Pittsburgh, PA",,4.0,"Leveraging statistics, natural language processing (NLP) and machine learning (ML) techniques to create scalable solutions for business problems, customer…",30+ days ago,2021-01-15,https://www.indeed.com/rc/clk?jk=f959d30b39a16ce3&fccid=e4af9ca5b6d3a604&vjs=3
Lead Financial Analyst - Artificial Intelligence Strategic Growth Offering (AI SGO) Finance & Investment,,Deloitte,"Pittsburgh, PA",Temporarily remote,4.0,"Strong project management and organization skills, ability to manage/ execute multiple strategic initiatives.
Business Case & Overall Results Management.",1 day ago,2021-01-15,https://www.indeed.com/rc/clk?jk=dd8115d11150ce5e&fccid=9e215d88a6b33622&vjs=3
"2021 Student Technology, Agile & Readiness Training (S.T.A.R.T) Program – Data Scientist Track",,BNY Mellon,"Pittsburgh, PA",,3.5,"Participate on a team to apply scientific method to find solutions to real business problems.
Perform data analysis, feature engineering and advanced methods to…",30+ days ago,2021-01-15,https://www.indeed.com/rc/clk?jk=76b76ab3e998d255&fccid=b4048be2884af072&vjs=3
"AI/ML- Engineering Manager, Siri Health",,Apple,"Pittsburgh, PA",,4.2,"Experience with AI technologies including natural language processing and machine learning.
On the Siri Health team, you will be responsible for driving and…",30+ days ago,2021-01-15,https://www.indeed.com/rc/clk?jk=ed3583278412e803&fccid=c1099851e9794854&vjs=3
