job_title,salary,company,location,is_remote,job_rating,job_summary,post_date,extract_date,job_url
Machine Learning Research Scientist,,Capital One - US,"San Francisco, CA",,3.9,"These may include computer vision, representation learning, explainability, fairness, machine learning on graphs, Bayesian deep learning, AutoML, and any other…",30+ days ago,2021-01-10,https://www.indeed.com/rc/clk?jk=15322c5864b4b6e1&fccid=b85c5070c3d3d8c8&vjs=3
(Lead Data Scientist) \ Lead Product Analyst,,Fivestars,"San Francisco, CA",,4.1,"As a Lead Product Analyst, you will serve as an analytics and machine learning expert and use data and experiments to develop insights that will directly…",30+ days ago,2021-01-10,https://www.indeed.com/rc/clk?jk=db06d9719e2be849&fccid=41474394e8c4b721&vjs=3
Data Engineer,,CommonStock,"San Francisco, CA",,,"Strong grasp of available data pipeline and machine learning technologies (Spark, Tensorflow, AirFlow, SageMaker etc. - experience with AWS ecosystem a plus).",30+ days ago,2021-01-10,https://www.indeed.com/rc/clk?jk=fce1cb758625c8be&fccid=5ea358dccb8dedf3&vjs=3
Senior Data Scientist,,Berkshire Hathaway Homestate Companies,"San Francisco, CA",,3.3,"Must be able to design, develop and test analytics using Deep Learning, Machine Learning, Data Mining, R, Python, Statistical Models, and other advanced…",26 days ago,2021-01-10,https://www.indeed.com/rc/clk?jk=4bbf4727a6a8c4b3&fccid=1e33e6f03dcc5e6e&vjs=3
Machine Learning Engineer (NLP),$72 an hour,Harnham,"San Francisco, CA",,4.6,"Deep understanding of data structure, performance optimization, and algorithms.
Experience working with big data platforms such as Spark, Hadoop, Kafka, Hive,…",30+ days ago,2021-01-10,https://www.indeed.com/pagead/clk?mo=r&ad=-6NYlbfkN0ARICpNo1DhGqfodICOss3ZS6QdhS5AHh5hrs_CHOPYqyMBbpKreu8_0VPK2YpEpLZNJh0VHcoh2uBpOX4W24XIq0BbIMzobydMuLe6CS5s74HHZNx7b0CiKiEz0iq5JSeHOGf_zSExMEpfO0HT5hGTs3LrG70F1NJvhceVZI-dRR3jRjQOYtPPFJL5cirpsOGqnSqy-nDTn5703S5bx3qpkpLD4jvjo3Cbt8L-sP1SdYfmWCICkosEU47CAYy_w4-0fFGwJlHfE40frYDMYRqbuK3nnCaxxSG0ClZceUhS8TjeNRObXDWmFBIEztYf22MAOfK6spnDYg5zlJyhv9_QmitiY0r4tkW84aip4lJLcClCOyqdxpJxm3_EFrQAG1Tb7YnOGRoMHvkuYEndF7AJuJWsznquShIesSqDw-DksYGnNLnNEnNEqWXaWNLgaJUrk2rdGPHYKuUBMeS19QVFIvI0NMEnrnUsT5VjJkCaMAab6RcEPBqTaVxaCOpIMLoPNrdUf_A7_vq5wShaSGsbrt88U-cQYPQg_mUqnxaD5YBgKilDYrR3NXvAmXW-7xsU4uJvt2zdB6OjI-kWh75ew3E2l8uF-elFFQO3o_v5AEkJaIt8s2G1tmMuyffcCi3MLfrRdT_k_qPUavA4QygevqbpM6ITuJzCYsM0Q6tDRnlXTKWR_rMQjlaHy1s4EYllOYQAAvKbPg==&p=9&fvj=0&vjs=3
"Sr. Data Analyst, Adtech",,Uber,"San Francisco, CA",,3.7,"Manage customer requests, which includes verifying data quality, analyzing data, isolating and diagnosing the problem and resolving the issue.",23 days ago,2021-01-10,https://www.indeed.com/rc/clk?jk=f96fe3bbf5aa0984&fccid=f766f8bfbc3effb7&vjs=3
"Data Scientist, Analyst - Marketing",,SoFi,"San Francisco, CA",,3.1,"3+ years of recent experience in advanced marketing/media analytics or data science/analyst role.
In this role, you will apply state of the art statistical…",30+ days ago,2021-01-10,https://www.indeed.com/rc/clk?jk=e4f57b3bee522b64&fccid=7c3a1f1f98dde031&vjs=3
Machine Learning Engineer - Contract to Hire,$70 an hour,Harnham,"San Francisco, CA",Temporarily remote,4.6,"Machine Learning Engineer - 6 month contract to permanent placement.
5+ years of industry experience.
Remote flexibility (Due to COVID 19).",18 days ago,2021-01-10,https://www.indeed.com/pagead/clk?mo=r&ad=-6NYlbfkN0ARICpNo1DhGqfodICOss3ZS6QdhS5AHh5hrs_CHOPYqyMBbpKreu8_0VPK2YpEpLa-xyPlQLuiAaeWcb5wu1xsc6Dg0Wd2CuSfqKJ_EeVboHdkejKWINAKD2P8GP7YiqV-zSquwpu5XyEYCTNs82VeQ17c9FDw0rwAkt-kxs8IoHdtf5FagQE2f6HK_3UFdcXs4XRiLrzyidJZcv0mM2kJammDtR2JjMNP9ADSVLx-eQlTw6FUdBVryfp0r7K7wSW1jgDgEJfg4vLae9U8fogV7u95coJoUA-Rvg-7YU90L9bYpnb0JOBtd0lBTd-LDEStvmcm8inF5TnvmhvMzUYrl_zNPRgeta88QbheaokojzTlSJQhinG2YaJfTeDd754qK7RZywEmKr4VGY1NQIgPqAVhccuoBrjJuY-QpgqNTVV6ks2hJxI1ZobEJHZtgVPX0V95UDj-I-93hBl2BP5h2MVFd1XyvCgkvMvRlvbbFXCWxXCAYIOkbedKeeTCtP7MRVUckc1rgJVdqzIIWAIPEweFmRLAl515VymaNnkypwS-_Q355TSKjmHisetW16KlIEWtf7yHvgr3IkvM8C6irOK8fgc2vJfUqlgHLKvmORY9_AaZjFha5a_wfc_ivfQ0pM5dbVW0-edrabcjpwO2heF6oTzBNbjGYb3bJhFOQsNs3tx_W9UjlM2n393hVlLVoXTkOmP_Xg==&p=12&fvj=0&vjs=3
Data Scientist,,Exponent,"Menlo Park, CA",,4.0,"Providing expertise in machine learning, data analytics, and software development for a wide range of data including text, images, medical records, and sensor…",20 days ago,2021-01-10,https://www.indeed.com/rc/clk?jk=7e5fddc0e432d5b7&fccid=0213df1b2d6a2c22&vjs=3
Machine Learning Engineer/AI Engineer,,iknowvate technologies,"San Francisco, CA",,,Acts as subject matter expert for difficult or complex application problems requiring interpretation of AI tools and principles.,21 days ago,2021-01-10,https://www.indeed.com/rc/clk?jk=35a18c8bd79e6e78&fccid=9ace5aa4e4fa6ce2&vjs=3
Senior Data Scientist,,Hired Recruiters,"San Francisco, CA",Remote,,"Broad knowledge of current machine learning techniques for NLP and time-series data.
Mentor ML Engineers on data science, especially in the deep learning space.",30+ days ago,2021-01-10,https://www.indeed.com/rc/clk?jk=4e30d217fef4c019&fccid=547ddf8bc07ce2c9&vjs=3
"Machine Learning Engineer, Ads Ranking",,Pinterest,"San Francisco, CA",,4.2,"Design features and build large-scale machine learning models to improve ad targeting, relevance, and engagement.",30+ days ago,2021-01-10,https://www.indeed.com/rc/clk?jk=8fbf037f2e47e56c&fccid=43014b1412e0a7b6&vjs=3
Lead Data Scientist,,ON24,"San Francisco, CA",,4.0,"As a Lead Data Scientist, you will work as our analytics and machine learning expert and use data and experiments to develop insights that will directly…",30+ days ago,2021-01-10,https://www.indeed.com/rc/clk?jk=feddaafa508f58dd&fccid=7cf620b1ef0018f8&vjs=3
"Lead Technical Product Manager, Data Science and Machine Learning",,Chime,"San Francisco, CA",Remote,,Understanding of how machine learning solutions can be applied to business/product use cases and the feasibility of such ML solutions to meet business goals.,1 day ago,2021-01-10,https://www.indeed.com/rc/clk?jk=59bcc0b7c49c0e48&fccid=0bb3d80f2a8cb633&vjs=3
"Senior Data Analyst, Marketing Analytics",,Cruise,"San Francisco, CA",,2.8,Building data visualization templates/ presentations that share relevant insights and outcomes with the marketing and commercial leadership of Cruise.,30+ days ago,2021-01-10,https://www.indeed.com/rc/clk?jk=d1533ba6bd92e54a&fccid=3322e3b44a5a0777&vjs=3
"Senior Consulting Data Analyst (Part-time) SAS, SQL, R",,Kaiser Permanente,"Oakland, CA",,4.1,"Bachelor's degree in economics, finance, health care administration, public health administration, statistics, mathematics, operations.",9 days ago,2021-01-10,https://www.indeed.com/rc/clk?jk=48d99d8698c092b0&fccid=48ecd526e3aa3225&vjs=3
"Director, Data Science",,"VIZIO, Inc.","San Francisco, CA",,,"Build and manage a team of the very top talent in data science and data analytics with the ability to not only keep up with, but also pioneer, in this space.",30+ days ago,2021-01-10,https://www.indeed.com/rc/clk?jk=218dc399e80a82b3&fccid=2ac0dbed95f0e3bf&vjs=3
"Computational Chemistry, Machine Learning Scientist (REMOTE)","$190,000 a year",Harnham US,"San Francisco, CA",Remote,4.6,"As a member of the machine learning team, you will utilize your experience in applying CNNs, GNNs, and the newest techniques in deep learning and Python to…",30+ days ago,2021-01-10,https://www.indeed.com/pagead/clk?mo=r&ad=-6NYlbfkN0ARICpNo1DhGqfodICOss3ZS6QdhS5AHh5hrs_CHOPYq--8fkI3D83FkjGvsVbMbLT7-I7qXZvz1ne2OjM4HKUf0IFxBAiJmhjGxxOD2tX_yw8nK6EJQoZas4OugQbWMwjycHbhQdhqHrTVE4kyHtU5Qn1cEYTsscKZsobHInKCg3EjSqVgiajNb2IrKZcYVz5OPX8tm1o06SswpGseDUq-L4vkpoeJOqHYTw3omsrWlBWsVoPaT-SxU1MLQqoPQU5-DGIy39pHnX-JYvaohP7CRxJK0718Cqd7EOeDPmzgacH8qD2S2NfwgazLyTj6TBDlO0a79vgXJ3xg6_Li45MIT5KshV_JSBAhbM2w45mIQMX-a-wOhhRrnEulRIn7-ZRnLpm_6QQ5DWV3k43HNL40YR815cBFDMHav_ysfTlCTRsLcxfKeRfDf5LJ0PDAR8iA7F2MjZ8Duw63bjTcl4qYqXFu3GY17MH7zhwZMmfOVvpmWaC56LUV6pS_LepSf0gAO6yA6hk85p_DhKkMFxGRUEJUXbBHOU62prPFdRz8GV691L0Xr-sdL3sWUv5jz8hWetR5YLsItI6PoFlN6s16-IyIhkcrVUcN2bDlnSxInUg41cWwZjEC6GB0w2zKfYzYEzuoFD6sU1LLkQkoc-rqsm1Z93RE64BVRBnCq5skxTvy0C6J19gxwptX8_G9n1zXU4OBjgq3bf_FOAt16CM1PTf4_cBtbn0=&p=7&fvj=0&vjs=3
Senior Data Analyst,,Autodesk,"San Francisco, CA",,4.1,"Data Analysts will play a critical role in discovering and communicating data-driven insights to inspire product improvements.
3+ years in an Analyst role.",30+ days ago,2021-01-10,https://www.indeed.com/rc/clk?jk=7ac47d991c2d86f9&fccid=7136762d065a5ad7&vjs=3
Senior Data Scientist - Marketplace Optimization,,Faire,"San Francisco, CA",,,"You will be working closely with other data scientists, engineers, and product managers to drive projects that derive value from our unique, rich, and rapidly…",30+ days ago,2021-01-10,https://www.indeed.com/rc/clk?jk=d0561e2708a20889&fccid=f3a36f726f745c17&vjs=3
VP of Engineering & Data Science,,CircleUp,"San Francisco, CA",,,"Lead and mentor a team of engineers, data scientists, and machine learning engineers focused on developing, scaling, and commercializing CircleUp’s data…",30+ days ago,2021-01-10,https://www.indeed.com/rc/clk?jk=30bcd7bb39f2697a&fccid=6e9166ecf7604472&vjs=3
AI/ML - Data Engineer,,GSK,"San Francisco, CA",,4.2,"Experience with big-data technologies.
Operating at pace and agile decision-making – using evidence and applying judgement to balance pace, rigour and risk.",30+ days ago,2021-01-10,https://www.indeed.com/rc/clk?jk=4debec684a4dd263&fccid=4e42ec53f4b93e02&vjs=3
Data Science Manager - Developer and Enterprise Solutions,,Twitter,"San Francisco, CA",,4.1,"You have 2+ years experience as individual contributor, applying your experience with statistics, machine learning, and data analysis to product design,…",30+ days ago,2021-01-10,https://www.indeed.com/rc/clk?jk=6c223975ff76fcd4&fccid=7a3824693ee1074b&vjs=3
Data Science - Avatar,,Roblox,"San Mateo, CA",,4.3,"We cover a wide area of the data spectrum including analytical data engineering, product analytics, experimentation, causal inference, statistical modeling and…",30+ days ago,2021-01-10,https://www.indeed.com/rc/clk?jk=1dccf06af8fa415a&fccid=04ef150429d33336&vjs=3
"Senior Data Analyst, Sales Operations",,Github,"San Francisco, CA",Remote,4.3,Create a cadence and ritual for monitoring the health of the global revenue business to identify any opportunities or risks.,30+ days ago,2021-01-10,https://www.indeed.com/rc/clk?jk=089db5adce65f3ba&fccid=c594c442f5397e7b&vjs=3
Machine Learning Engineer Intern,,Sony Interactive Entertainment PlayStation,"San Francisco, CA",,3.7,"As a Machine Learning Engineer Intern, you will help the existing ML engineering teams to deliver ML predicted interactions across PlayStation experiences and…",30+ days ago,2021-01-10,https://www.indeed.com/rc/clk?jk=ad6da8bbe40f3d46&fccid=750bb2e27e97e3c1&vjs=3
Senior Data Scientist - Redwood City,,MOLOCO,"Redwood City, CA",Temporarily remote,,"Experience in SQL or other data analytics language preferred.
We're in a hyper growth stage both in technology and business and looking for an Operational Data…",30+ days ago,2021-01-10,https://www.indeed.com/rc/clk?jk=a246aef0dc3e6b79&fccid=27317bcae2b26fe5&vjs=3
"Internship - Statistical Programming Intern (Summer Session, Burlingame, CA)",,Acumen LLC,"Burlingame, CA",Remote,3.6,"Collect, manage, and analyze large amounts of data.
Use statistical programming languages, such as SAS, STATA, and R, to perform econometric and statistical…",30+ days ago,2021-01-10,https://www.indeed.com/rc/clk?jk=3e2d9fa71fd2a6db&fccid=d7c744248a9e6859&vjs=3
Data Scientist – Manage and Analyze,,DocuSign,"Walnut Creek, CA",,3.8,"The Analyze and Manage team builds and operates industry-leading analytics products that utilize AI, machine learning and cutting-edge NLP to provide deep…",30+ days ago,2021-01-10,https://www.indeed.com/rc/clk?jk=0a4bdff08ba3065c&fccid=9dd30dd046d9ac7a&vjs=3
"Data Science Winter Intern, Eagle Intelligence",,First Republic Bank,"San Francisco, CA",,3.9,"Be on the front lines of processing raw data into actionable insights.
Strong statistical acumen; solid understanding of relevant statistical tools and…",30+ days ago,2021-01-10,https://www.indeed.com/rc/clk?jk=5d0421f45d8343bd&fccid=e228a3c78d0f7f13&vjs=3
Data Scientist,,C3.ai,"Redwood City, CA",,,"In addition, you will help find the appropriate machine learning / data mining algorithms to answer these questions.
Excellent verbal and written communication.",30+ days ago,2021-01-10,https://www.indeed.com/rc/clk?jk=8bc9b0fa9217923b&fccid=50a61f19a5b28415&vjs=3
Statistician,,Heluna Health,"Richmond, CA",,3.7,"Serves as a statistician providing public health statistics, statistical analysis, and related scientific and technical expertise.
Constantly = (5+ hrs/day).",30+ days ago,2021-01-10,https://www.indeed.com/rc/clk?jk=648fd3810280bce2&fccid=b27e6fc6d7424c31&vjs=3
"Software Engineer, Data Team (International)",,Yummly,"San Carlos, CA",,,"Experience with ETL jobs & data pipelines.
Interest in or experience with ML, deep learning, NLP, search, computer vision, or recommendation systems.",1 day ago,2021-01-10,https://www.indeed.com/rc/clk?jk=2fa5b7333764cf57&fccid=5c70ba888d8ca883&vjs=3
"Senior Data Analyst, Data Sharing",,Disney Streaming Services,"San Francisco, CA",,3.4,"Work with Data Technology and Data Engineering teams to ensure high quality, compliant data is made available to DMED internal and external data partner systems…",30+ days ago,2021-01-10,https://www.indeed.com/rc/clk?jk=a4a3a679e40d7131&fccid=4b5d257051285786&vjs=3
"Senior Data Analyst, Product",,Kiva.org,"San Francisco, CA",,4.9,"5+ years experience in data analytics, business analytics, data science, economics, statistics or related field.
Experience mentoring others strongly preferred.",30+ days ago,2021-01-10,https://www.indeed.com/rc/clk?jk=c52e2c982be51379&fccid=b98ea3f9f201f263&vjs=3
Staff Data Scientist - Activision Blizzard Media,,Blizzard Entertainment,"Foster City, CA",,4.0,"10 years of experience as machine learning engineer / data scientist.
Experience in finding patterns, trends and actionable insights from huge data sets.",26 days ago,2021-01-10,https://www.indeed.com/rc/clk?jk=247dc383e8c8da47&fccid=645d83ee4cbe1d25&vjs=3
Global Senior Data Scientist,,Levi Strauss & Co.,"San Francisco, CA",,3.9,"4+ years of experience with data visualization tools (D3.js, R Shiny, Looker, Tableau or similar).
Whether it is for medical care, taking time off, improving…",30+ days ago,2021-01-10,https://www.indeed.com/rc/clk?jk=0aa1d726af16ba95&fccid=dc023faa36b88bf2&vjs=3
Applied Scientist,,Amazon.com Services LLC,"Berkeley, CA",,3.6,"As an applied scientist on our team, your role is to leverage your strong background in Computer Science and Machine Learning to help build the next generation…",4 days ago,2021-01-10,https://www.indeed.com/rc/clk?jk=fd3546b7ddb27443&fccid=fe2d21eef233e94a&vjs=3
"Head of Sales & Business Development - AI, Data Science, Commission, Equity",,Xen.ai,"San Francisco Bay Area, CA",Remote,,"Xen.AI is looking for Head of Sales & Business Development - AI & Machine Learning solutions, who can bring in AI, Machine Learning, Deep Learning and Data…",7 days ago,2021-01-10,https://www.indeed.com/company/Xen.ai/jobs/Head-Sales-Business-Development-304fa1dd1b1f3725?fccid=fbe5a7e5accb1eb2&vjs=3
Senior Data Scientist,,Empower Retirement,"Redwood City, CA",,3.1,"Hire, manage, and mentor a team of data scientists and feature engineers.
Experience utilizing conventional machine learning and deep learning libraries, in…",23 days ago,2021-01-10,https://www.indeed.com/rc/clk?jk=94c543d10f349415&fccid=796b5a2c2fc5984d&vjs=3
Senior Data Scientist,,Empower Retirement,"Redwood City, CA",,3.1,"Hire, manage, and mentor a team of data scientists and feature engineers.
Experience utilizing conventional machine learning and deep learning libraries, in…",23 days ago,2021-01-10,https://www.indeed.com/rc/clk?jk=94c543d10f349415&fccid=796b5a2c2fc5984d&vjs=3
Lead Senior Data Scientist,,The Trade Desk,"San Francisco, CA",,4.0,"Our data scientists have deep knowledge and exercise a high degree of leadership in their daily work.
You are a broadly skilled data scientist with experience…",30+ days ago,2021-01-10,https://www.indeed.com/rc/clk?jk=4b8607ce62bf1704&fccid=4899a85209d20142&vjs=3
Data Science - International Growth,,Roblox,"San Mateo, CA",,4.3,"You'll partner with data scientists, product managers, engineers and leaders across the company to better understand our players and builders, performing ad hoc…",30+ days ago,2021-01-10,https://www.indeed.com/rc/clk?jk=d467deee2132e5a9&fccid=04ef150429d33336&vjs=3
Senior Data Scientist (Remote/Virtual),,Boomi,"San Francisco Bay Area, CA",Remote,4.0,"Strong skills in software prototyping and engineering with expertise in applicable programming and analytics languages (Python, or R) and various open source…",30+ days ago,2021-01-10,https://www.indeed.com/rc/clk?jk=1935b802ce28fcf7&fccid=dd09fe3b43125016&vjs=3
Data and Policy Analyst - Statistical Programmer,,Acumen LLC,"Burlingame, CA",,3.6,"At Acumen, LLC / The SPHERE Institute, Data and Policy Analysts provide analytical support for research and consulting projects for government and private…",30+ days ago,2021-01-10,https://www.indeed.com/rc/clk?jk=e6557a1e5d1de625&fccid=d7c744248a9e6859&vjs=3
Sr Data Scientist/AI Engineer,,DeepVu,"Berkeley, CA",,,"Currently, we are looking for senior data scientsts with experience in enterprise scale deep learning, forecasting and decisioning model.",30+ days ago,2021-01-10,https://www.indeed.com/rc/clk?jk=3c1ee6aa125da6ec&fccid=44c6ee3bb480d861&vjs=3
Machine Learning Engineer / Research Engineer (AI Engagements),,Uber,"San Francisco, CA",,3.7,"The group consists of machine learning engineers, mobile engineers, backend engineers and research scientists and engineers.",3 days ago,2021-01-10,https://www.indeed.com/rc/clk?jk=5d83883282268030&fccid=f766f8bfbc3effb7&vjs=3
Data Scientist/Statistical Programmer Contractor,,Denali Therapeutics,"South San Francisco, CA",,,"As a member of the Biometrics team at Denali Therapeutics, the candidate will work closely with clinical study team members and fellow data scientists.",27 days ago,2021-01-10,https://www.indeed.com/rc/clk?jk=759782295730d761&fccid=bb90e60a4b0d9d8d&vjs=3
Senior Data Scientist,,CircleCI,"San Francisco, CA",Remote,,"Evaluate available data and define requirements for needed data.
Able to uncover insights in messy data sources.
Present to stakeholders and executives.",23 days ago,2021-01-10,https://www.indeed.com/rc/clk?jk=76e5fd35c76b1628&fccid=9331c0290799b32e&vjs=3
Sr. Data Scientist,,Gap Inc.,"San Francisco, CA",,3.8,Experience developing personalization capabilities through data science using multi-channel retail consumer data such as POS and clickstream data preferred.,30+ days ago,2021-01-10,https://www.indeed.com/rc/clk?jk=c4156f67ce875657&fccid=76644a33987f2488&vjs=3
Senior Data Scientist - Behavioral Health,,Grand Rounds,"San Francisco, CA",,3.4,"Work closely with analysts, data scientists, product managers, clinicians, and engineers.
In addition to developing the company’s core technologies, data…",30+ days ago,2021-01-10,https://www.indeed.com/rc/clk?jk=864175c40bf5054c&fccid=674737b89dda47a6&vjs=3
UX Data Scientist,,Oracle,"Redwood City, CA",,3.8,"Along with executing research with scientific rigor, you will be able to synthesize data and apply/create frameworks to explain your insights to stakeholders.",30+ days ago,2021-01-10,https://www.indeed.com/rc/clk?jk=dd342e35167419c5&fccid=cd22d01053af7669&vjs=3
"Sr. Data Scientist, Customer Acquisition and Lifecycle",,Sunrun,"San Francisco, CA",,3.4,"An advanced degree in a quantitative subject area is nice to have.
Practical experience mining high dimensional transaction data, synthesizing and visualizing…",30+ days ago,2021-01-10,https://www.indeed.com/rc/clk?jk=fa04f6c4c77bcf49&fccid=e3618b0356bf9a8f&vjs=3
"Sr Data Analyst, Sales Operations (Remote)",,Glassdoor,"San Francisco, CA",Remote,4.1,"Use SQL for data extraction and transformation and analyze data.
5+ years experience with data visualization tools (Tableau), SQL, Programming language (R,…",20 days ago,2021-01-10,https://www.indeed.com/rc/clk?jk=85d9512167bea2cd&fccid=5a969b35c0256a8a&vjs=3
"Director, Data Science & Analytics - Content Supply",,Roblox,"San Mateo, CA",,4.3,"We cover a wide area of the data spectrum including analytical data engineering, product analytics, experimentation, causal inference, statistical modeling and…",30+ days ago,2021-01-10,https://www.indeed.com/rc/clk?jk=459d1ef50c635326&fccid=04ef150429d33336&vjs=3
Machine Learning Engineer / Research Engineer (AI Engagements),,Uber,"San Francisco, CA",,3.7,"The group consists of machine learning engineers, mobile engineers, backend engineers and research scientists and engineers.",3 days ago,2021-01-10,https://www.indeed.com/rc/clk?jk=5d83883282268030&fccid=f766f8bfbc3effb7&vjs=3
Data Scientist/Statistical Programmer Contractor,,Denali Therapeutics,"South San Francisco, CA",,,"As a member of the Biometrics team at Denali Therapeutics, the candidate will work closely with clinical study team members and fellow data scientists.",27 days ago,2021-01-10,https://www.indeed.com/rc/clk?jk=759782295730d761&fccid=bb90e60a4b0d9d8d&vjs=3
Senior Data Scientist,,CircleCI,"San Francisco, CA",Remote,,"Evaluate available data and define requirements for needed data.
Able to uncover insights in messy data sources.
Present to stakeholders and executives.",23 days ago,2021-01-10,https://www.indeed.com/rc/clk?jk=76e5fd35c76b1628&fccid=9331c0290799b32e&vjs=3
Sr. Data Scientist,,Gap Inc.,"San Francisco, CA",,3.8,Experience developing personalization capabilities through data science using multi-channel retail consumer data such as POS and clickstream data preferred.,30+ days ago,2021-01-10,https://www.indeed.com/rc/clk?jk=c4156f67ce875657&fccid=76644a33987f2488&vjs=3
Senior Data Scientist - Behavioral Health,,Grand Rounds,"San Francisco, CA",,3.4,"Work closely with analysts, data scientists, product managers, clinicians, and engineers.
In addition to developing the company’s core technologies, data…",30+ days ago,2021-01-10,https://www.indeed.com/rc/clk?jk=864175c40bf5054c&fccid=674737b89dda47a6&vjs=3
UX Data Scientist,,Oracle,"Redwood City, CA",,3.8,"Along with executing research with scientific rigor, you will be able to synthesize data and apply/create frameworks to explain your insights to stakeholders.",30+ days ago,2021-01-10,https://www.indeed.com/rc/clk?jk=dd342e35167419c5&fccid=cd22d01053af7669&vjs=3
"Sr. Data Scientist, Customer Acquisition and Lifecycle",,Sunrun,"San Francisco, CA",,3.4,"An advanced degree in a quantitative subject area is nice to have.
Practical experience mining high dimensional transaction data, synthesizing and visualizing…",30+ days ago,2021-01-10,https://www.indeed.com/rc/clk?jk=fa04f6c4c77bcf49&fccid=e3618b0356bf9a8f&vjs=3
"Sr Data Analyst, Sales Operations (Remote)",,Glassdoor,"San Francisco, CA",Remote,4.1,"Use SQL for data extraction and transformation and analyze data.
5+ years experience with data visualization tools (Tableau), SQL, Programming language (R,…",20 days ago,2021-01-10,https://www.indeed.com/rc/clk?jk=85d9512167bea2cd&fccid=5a969b35c0256a8a&vjs=3
"Computational Chemistry, Machine Learning Scientist (REMOTE)","$190,000 a year",Harnham US,"San Francisco, CA",Remote,4.6,"As a member of the machine learning team, you will utilize your experience in applying CNNs, GNNs, and the newest techniques in deep learning and Python to…",30+ days ago,2021-01-10,https://www.indeed.com/pagead/clk?mo=r&ad=-6NYlbfkN0ARICpNo1DhGqfodICOss3ZS6QdhS5AHh5hrs_CHOPYq--8fkI3D83FkjGvsVbMbLT7-I7qXZvz1ne2OjM4HKUf0IFxBAiJmhjGxxOD2tX_yw8nK6EJQoZas4OugQbWMwjycHbhQdhqHrTVE4kyHtU5Qn1cEYTsscKZsobHInKCg5bKO_ALyEKk0O4nfB0bTfJa6mPWKfWuR_KrvASXR2HNIvCiaJYq8vQ_GoXLGwA-UZibgRfc54r9DD93GJotWC6qISmD6755YZWhBpbH5m-Z2cG5zG1hQon1AYIFjBlunxuBNmZeFpn8WzG_L52fRHe6Lf39h-740h5VVZUoGvxbCPA02gTZXTB7ktZu5yguLg6vpKwv_ghVH6TXsCGKgE1qSiAy9ahBfRN9auBZ9L-2WSLpQi8xCQrxEdgQEKcW8xlmkrqIP4ohGznQ7raadbwTGhplSQaA9bWK14oQfmyXrlCApnVU_m9pJi1cf0ET4D3bA2r0i9Vuyt_9vZHNXyF9liY-YU-76VBCN0gGpHqKScsUq7nvWeCG9Bc_wP_8qLZS6SmlmDsmSXKMs0hdwpSjAgBQa0Cg2Fg2bfhvKGsy7Tb6qRoYh8D_fZklxVa7N_OOmXF1JqkXJwudYG9HD0yw5lxLBgGBY4PwvqqS-gyrp9xGfX4YxsKC2bce6OrwtdVb0RkHqJhLV0cpN0oZiju6cdY4AF36_S5gEmRRtiqCBsuGfQ91OGo=&p=8&fvj=0&vjs=3
"Director, Data Science & Analytics - Content Supply",,Roblox,"San Mateo, CA",,4.3,"We cover a wide area of the data spectrum including analytical data engineering, product analytics, experimentation, causal inference, statistical modeling and…",30+ days ago,2021-01-10,https://www.indeed.com/rc/clk?jk=459d1ef50c635326&fccid=04ef150429d33336&vjs=3
Marketing Data Scientist,,SoFi,"San Francisco, CA",,3.1,"As a Marketing Data Scientist @ SoFi, you will be subject matter expert on the user journeys and flows as part of the onboarding experience in becoming a SoFi…",30+ days ago,2021-01-10,https://www.indeed.com/rc/clk?jk=ccea9d319b84dc1d&fccid=7c3a1f1f98dde031&vjs=3
"Senior Manager, Data Science & Management",,Sephora,"San Francisco, CA",,3.9,"Proficiency in statistical analysis, quantitative analytics, forecasting/predictive analytics, deep learning and optimization algorithms.",1 day ago,2021-01-10,https://www.indeed.com/rc/clk?jk=491143cd6c819c68&fccid=afda98bfc8224b19&vjs=3
Machine Learning Engineer,,PicnicHealth,"San Francisco, CA",Temporarily remote,,"Large data analysis and visualization experience.
Develop machine learning models to improve PicnicHealth's product and processing efficiency.",30+ days ago,2021-01-10,https://www.indeed.com/rc/clk?jk=b7339d031b17a288&fccid=47afa44fdeb52f22&vjs=3
