job_title,salary,company,location,is_remote,job_rating,job_summary,post_date,extract_date,job_url
Senior Javascript/Typescript Engineer - Data Science Platform,,Bloomberg,"San Francisco, CA",,3.9,"Build IDE features to run remote, distributed machine learning jobs, save and interact with machine learning models, and more.",30+ days ago,2021-01-10,https://www.indeed.com/rc/clk?jk=dc988b8d0eb8cc98&fccid=f770da67b3b51c62&vjs=3
Machine Learning Engineer,,Kite,"San Francisco, CA",,,"If you have a strong background in software engineering and either have experience with machine learning or a willingness to learn, come join the team that's…",30+ days ago,2021-01-10,https://www.indeed.com/rc/clk?jk=9a5c62b15a9032fd&fccid=67232e209deb234c&vjs=3
Senior Clinical Data Analyst,,Freenome Holdings,"South San Francisco, CA",,,By combining deep expertise in molecular biology with advanced computational biology and machine learning techniques to recognize disease-associated patterns…,23 days ago,2021-01-10,https://www.indeed.com/rc/clk?jk=a095dcd101a7ef5c&fccid=26462688a7317015&vjs=3
Director of Data Science,,Everlaw,"Oakland, CA",,,"Lead a team of data scientists and analysts to define and measure key metrics for our products and systems, apply statistical methods, causal inference and…",30+ days ago,2021-01-10,https://www.indeed.com/rc/clk?jk=df925c36adfd025b&fccid=52cb610671fa4da9&vjs=3
Research Data Analyst,,University of California San Francisco,"San Francisco, CA",,4.2,"Under direct supervision, the Research Data Analyst acquires skills and knowledge of professional concepts in research data analysis, with a focus on machine…",30+ days ago,2021-01-10,https://www.indeed.com/rc/clk?jk=eaf710d1ce3d0ddd&fccid=2a341562d64c7cdb&vjs=3
Senior Machine Learning Engineer,,Etsy,"San Francisco, CA",,4.3,"Collaborate with cross-functional teams including different product teams, infrastructure teams and platform teams to identify short-term and long-term plans…",5 days ago,2021-01-10,https://www.indeed.com/rc/clk?jk=e3e5a95cd1acb564&fccid=9ecb91618c39a24f&vjs=3
Intern - Statistical Programming,,Gilead Sciences,"Foster City, CA",,3.6,Gilead Sciences is continuing to hire for all open roles. Our interview process may be conducted virtually and some roles will be asked to temporarily work…,30+ days ago,2021-01-10,https://www.indeed.com/rc/clk?jk=d6a6c7c7cd35c494&fccid=e4b075354d7c2865&vjs=3
"Senior Data Scientist, Invest",,SoFi,"San Francisco, CA",,3.1,"Build data structures and ETL pipelines to transfer data into data warehouse.
Own end-to-end product analytics workflow including formulating success metrics,…",30+ days ago,2021-01-10,https://www.indeed.com/rc/clk?jk=2d2b4e08ab4cef60&fccid=7c3a1f1f98dde031&vjs=3
"Product Manager (PM), Machine Learning (ML)",,Fathom,"San Francisco, CA",,4.1,"You are focused on growing a deep core competency in machine learning and/or healthcare.
Experience developing and managing highly data-driven processes, such…",30+ days ago,2021-01-10,https://www.indeed.com/rc/clk?jk=3656b07a0f656ae7&fccid=292ac9c0130b47e0&vjs=3
Machine Learning Scientist,,Freenome Holdings,"South San Francisco, CA",,,By combining deep expertise in molecular biology with advanced computational biology and machine learning techniques to recognize disease-associated patterns…,30+ days ago,2021-01-10,https://www.indeed.com/rc/clk?jk=8880bdee12e81fd6&fccid=26462688a7317015&vjs=3
Machine Learning Ops Engineer,,Levi Strauss & Co.,"San Francisco, CA",,3.9,Work with data scientists and analysts to create and deploy new features in the Training ML pipeline and the scoring pipeline.,30+ days ago,2021-01-10,https://www.indeed.com/rc/clk?jk=9f766a7cba3b8bc9&fccid=dc023faa36b88bf2&vjs=3
Sr Data Engineer - Products & Technology - Privacy & Ethics,,PRICE WATERHOUSE COOPERS,"San Francisco, CA",,4.0,"The candidate will use distributed computing technologies to process and analyze data at scale, identify and use appropriate big data tools to solve specific…",1 day ago,2021-01-10,https://www.indeed.com/rc/clk?jk=7320f4e687f68b0b&fccid=5e964c4afc56b180&vjs=3
Senior Clinical Data Analyst,,Freenome Holdings,"South San Francisco, CA",,,By combining deep expertise in molecular biology with advanced computational biology and machine learning techniques to recognize disease-associated patterns…,23 days ago,2021-01-10,https://www.indeed.com/rc/clk?jk=a095dcd101a7ef5c&fccid=26462688a7317015&vjs=3
Director of Data Science,,Everlaw,"Oakland, CA",,,"Lead a team of data scientists and analysts to define and measure key metrics for our products and systems, apply statistical methods, causal inference and…",30+ days ago,2021-01-10,https://www.indeed.com/rc/clk?jk=df925c36adfd025b&fccid=52cb610671fa4da9&vjs=3
Research Data Analyst,,University of California San Francisco,"San Francisco, CA",,4.2,"Under direct supervision, the Research Data Analyst acquires skills and knowledge of professional concepts in research data analysis, with a focus on machine…",30+ days ago,2021-01-10,https://www.indeed.com/rc/clk?jk=eaf710d1ce3d0ddd&fccid=2a341562d64c7cdb&vjs=3
Senior Machine Learning Engineer,,Etsy,"San Francisco, CA",,4.3,"Collaborate with cross-functional teams including different product teams, infrastructure teams and platform teams to identify short-term and long-term plans…",5 days ago,2021-01-10,https://www.indeed.com/rc/clk?jk=e3e5a95cd1acb564&fccid=9ecb91618c39a24f&vjs=3
Intern - Statistical Programming,,Gilead Sciences,"Foster City, CA",,3.6,Gilead Sciences is continuing to hire for all open roles. Our interview process may be conducted virtually and some roles will be asked to temporarily work…,30+ days ago,2021-01-10,https://www.indeed.com/rc/clk?jk=d6a6c7c7cd35c494&fccid=e4b075354d7c2865&vjs=3
"Senior Data Scientist, Invest",,SoFi,"San Francisco, CA",,3.1,"Build data structures and ETL pipelines to transfer data into data warehouse.
Own end-to-end product analytics workflow including formulating success metrics,…",30+ days ago,2021-01-10,https://www.indeed.com/rc/clk?jk=2d2b4e08ab4cef60&fccid=7c3a1f1f98dde031&vjs=3
"Product Manager (PM), Machine Learning (ML)",,Fathom,"San Francisco, CA",,4.1,"You are focused on growing a deep core competency in machine learning and/or healthcare.
Experience developing and managing highly data-driven processes, such…",30+ days ago,2021-01-10,https://www.indeed.com/rc/clk?jk=3656b07a0f656ae7&fccid=292ac9c0130b47e0&vjs=3
Machine Learning Scientist,,Freenome Holdings,"South San Francisco, CA",,,By combining deep expertise in molecular biology with advanced computational biology and machine learning techniques to recognize disease-associated patterns…,30+ days ago,2021-01-10,https://www.indeed.com/rc/clk?jk=8880bdee12e81fd6&fccid=26462688a7317015&vjs=3
"Computational Chemistry, Machine Learning Scientist (REMOTE)","$190,000 a year",Harnham US,"San Francisco, CA",Remote,4.6,"As a member of the machine learning team, you will utilize your experience in applying CNNs, GNNs, and the newest techniques in deep learning and Python to…",30+ days ago,2021-01-10,https://www.indeed.com/pagead/clk?mo=r&ad=-6NYlbfkN0ARICpNo1DhGqfodICOss3ZS6QdhS5AHh5hrs_CHOPYq--8fkI3D83FkjGvsVbMbLT7-I7qXZvz1ne2OjM4HKUf0IFxBAiJmhjGxxOD2tX_yw8nK6EJQoZas4OugQbWMwjycHbhQdhqHrTVE4kyHtU5Qn1cEYTsscKsB0CSWxngYo3k89BdRL_xUH3jsNaZUrug1TPoJB898jFibLPwgcGp0M5TbCbEgLudkZV40UiIUKN1PMV8T8qUSrh7nEcM1SYKlGlYhIRmzmMDUHQTNuCVDs25iu0L8HUXo2f4W2kCTI3cZup0jRBMSFGVZTZ2wg1up0xmo58Fyk62EQ6QPOvmhCuTdpkke8v1LCBKTiLMauDrcehGtNR72oXvrwncrsj0-3nrhFzTnzd8DOhreC0B9yMrvhAIaeirpXuDk2tSBfflPjnvaTtSM54VTNaM1bhFHeIn5NWI4_gu7q4umbrZWW5xTpPASmlg6np_WjThECZmu5VukXJvqBnBJN8JPPb4abWxCOfgbgIXXMY__BuFuzkMcBrDkALUD5wI4Fb1aFRVOs_rq27yHx1JLKRqnGTdXCXKTAlhkafcZ07eu6P8PGMVmjKomyBG0MV9UU5UOK_2hZ8W5zducfxFaMdCyD7XppE0iBXDzY0oZ6GDTaDTsOAm6Sjw8MlVlYfguyx_Qfkd1OC4AWAL3ofwtJLOn9Mp32VYUdNsdozBnBn104GYTlGbqWPBvoY=&p=8&fvj=0&vjs=3
Machine Learning Ops Engineer,,Levi Strauss & Co.,"San Francisco, CA",,3.9,Work with data scientists and analysts to create and deploy new features in the Training ML pipeline and the scoring pipeline.,30+ days ago,2021-01-10,https://www.indeed.com/rc/clk?jk=9f766a7cba3b8bc9&fccid=dc023faa36b88bf2&vjs=3
Sr Data Engineer - Products & Technology - Privacy & Ethics,,PRICE WATERHOUSE COOPERS,"San Francisco, CA",,4.0,"The candidate will use distributed computing technologies to process and analyze data at scale, identify and use appropriate big data tools to solve specific…",1 day ago,2021-01-10,https://www.indeed.com/rc/clk?jk=7320f4e687f68b0b&fccid=5e964c4afc56b180&vjs=3
Data Science/ Machine Learning Engineering Architect,,Salesforce,"San Francisco, CA",,4.3,"Salesforce Einstein is seeking a Data Science/ Machine Learning Engineering Architect to help us deliver high-quality, high-impact machine learning solutions to…",30+ days ago,2021-01-10,https://www.indeed.com/rc/clk?jk=0722266df9b4d8a8&fccid=4027cfd917e1ee29&vjs=3
Machine Learning Engineer,,Logic20/20,"San Francisco Bay Area, CA",,3.5,"As a ML Engineer, you’ll work closely with the client and data scientists to understand their business needs, design, and develop a scalable machine learning…",30+ days ago,2021-01-10,https://www.indeed.com/rc/clk?jk=3efead79709f48c5&fccid=e2f8d6934fd95c43&vjs=3
Senior Data Scientist - Road Safety,,Uber,"San Francisco, CA",,3.7,We leverage large-scaled telematics data and cutting-edge machine learning technologies to understand unsafe driving situations and derive insights that can…,30+ days ago,2021-01-10,https://www.indeed.com/rc/clk?jk=338168423fe1201a&fccid=f766f8bfbc3effb7&vjs=3
"Software Engineer, Back-End (Machine Learning)",,Grammarly,"San Francisco, CA",Temporarily remote,4.8,"Working on this team requires a close partnership with analytical linguists, computational linguists, machine learning engineers, and research scientists.",30+ days ago,2021-01-10,https://www.indeed.com/rc/clk?jk=ac6e7a0ded9198f8&fccid=0555014e7bce64c3&vjs=3
"Software Engineer, Back-End (Machine Learning)",,Grammarly,"San Francisco, CA",Temporarily remote,4.8,"Working on this team requires a close partnership with analytical linguists, computational linguists, machine learning engineers, and research scientists.",30+ days ago,2021-01-10,https://www.indeed.com/rc/clk?jk=ac6e7a0ded9198f8&fccid=0555014e7bce64c3&vjs=3
120 FINANCE - Senior Data Analyst Healthcare,"$77,710 - $116,570 a year",Alameda Alliance,"Alameda, CA",,2.5,"Work with operational departments and Information Technology to ensure data consistency and accuracy.
Three years’ experience analyzing complex data and…",25 days ago,2021-01-10,https://www.indeed.com/rc/clk?jk=c16102d6191b07f9&fccid=540d1028cf8a5b40&vjs=3
Senior Data Engineer,,SAP,"San Ramon, CA",,4.3,"The Data Platform group within SAP SuccessFactors is looking for a data engineer/ machine learning engineer to design, develop, and deliver automated multi…",9 days ago,2021-01-10,https://www.indeed.com/rc/clk?jk=0d5f826cca66fa96&fccid=156c7820d1988640&vjs=3
"Senior Business Intelligence (BI) Data Scientist, Small Business Lending",,OPPORTUNITY FUND NORTHERN CALIFORNIA,"San Francisco Bay Area, CA",Temporarily remote,4.2,"Perform other analytics, machine learning or data mining duties using basic to more advanced approaches.
Prepare data files following specific requirements and…",30+ days ago,2021-01-10,https://www.indeed.com/pagead/clk?mo=r&ad=-6NYlbfkN0Cdf58cfxUqLrJFHLvFtn5ygFTD8dWJwBQsJQGQyrNwzLNdBZNr5M6K9GrktMTMzEtIzSXQcvKHJsr7C0xnBlSXZyZBdoovVuHkTfpPixHXwmoJgS9PliM1mUPgmf71Na4rKdNnDAkn3o4icEOsQ4W2Tn3bwJfFcPW3NUZw-eTWOCwNzqMtnSEqHiY14-v-BO9sHfBGvnXmawV1UNS-9ppFcZQKwM06DRYLpbURZD6ZW7IGeceAX4Kd3E4zOuBu1ByU3o5PEcmFP6yJxnhz7sltd-I8YiXn1zjnaMZZz13d6hdeiSLPJf4uPRP9Q6l_CZDiapZNggru8eSRVddYzaPC4DIHdxGxvg-sUowExqzHRBPiKxDkbCo1IIsElDxOar1YtSBfHZ5On2zng6AIa4Klpq3hl4a3K1HlP0C3y6odlK8hEld6UUYPuk4281Uw2q-pZ3BFUtNu4a20O_RlTYB9iquyZskV_s-4c5pSbODCXu1NyGxdlSmUimug7GuECZ6DZNKBbtnEHxntO30Dg-FowKIWZAjjdSMLVHPsyF90Qgh2mG4xWO-11wkhGrZHi4kTHcFsHS0ED1R5LjF_tJncSzsHq5XWYaEVoeNioEQYSw==&p=3&fvj=0&vjs=3
Engineering Manager - Machine Learning,,Afresh,"San Francisco, CA",,,"As a ML Engineering Manager, you will manage incredibly talented ML engineers in its pursuit to eradicate hundred of millions of tons of food waste every single…",30+ days ago,2021-01-10,https://www.indeed.com/rc/clk?jk=1edeeb27733a6ca5&fccid=cd4725921f2c98aa&vjs=3
"Principal Machine Learning Engineer, Personalization",,Castlight Health,"San Francisco, CA",,3.2,"Collect, process and analyze data to produce ideas, working alongside data scientists and other engineers in the team.",1 day ago,2021-01-10,https://www.indeed.com/rc/clk?jk=279f7e7fecb7e1b1&fccid=aafdb4fe9e36b658&vjs=3
Machine Learning Software Engineer,,CrowdRise,"Redwood City, CA",Temporarily remote,,"Design and implement state of the art machine learning algorithms in distributed machine learning frameworks.
2+ years of experience building end-to-end machine…",26 days ago,2021-01-10,https://www.indeed.com/rc/clk?jk=5678e3016e2a612a&fccid=8667d7fc933b825d&vjs=3
ML Engineer – Digital Analytics,,Gap Inc.,"San Francisco, CA",,3.8,"Navigate various data sources and efficiently locate data in a complex data ecosystem.
The team works cross-functionally to ensure reports, analytics, and…",30+ days ago,2021-01-10,https://www.indeed.com/rc/clk?jk=05da380a787ae0c4&fccid=76644a33987f2488&vjs=3
Senior AI Engineer / AI Scientist,,Mythic-AI,"San Francisco Bay Area, CA",,,"Experience working with machine learning, applied optimization, and/or statistical learning.
Understanding of creating new datasets and eliminating biases.",30+ days ago,2021-01-10,https://www.indeed.com/rc/clk?jk=88affc974ae58ea9&fccid=f4ff41ef5bdc5d70&vjs=3
Software Engineer - Machine Learning,,The Yes,"San Francisco Bay Area, CA",,,"You will be responsible for applying AI, machine learning and data mining techniques to build the next generation shopping experience.",30+ days ago,2021-01-10,https://www.indeed.com/rc/clk?jk=1ed6a7e28e1ce93b&fccid=c96883dbcf8f54aa&vjs=3
Senior Technical Data Analyst,,GoFundMe,"Redwood City, CA",Temporarily remote,,"Monitor KPIs and present emerging trends and actionable insights to leadership team.
Learn and assist data engineers with data transformations and ETL projects.",30+ days ago,2021-01-10,https://www.indeed.com/rc/clk?jk=2408f3ba345b5eed&fccid=688601c4addc2d06&vjs=3
Machine Learning Engineer (NLP),$72 an hour,Harnham,"San Francisco, CA",,4.6,"Deep understanding of data structure, performance optimization, and algorithms.
Experience working with big data platforms such as Spark, Hadoop, Kafka, Hive,…",30+ days ago,2021-01-10,https://www.indeed.com/pagead/clk?mo=r&ad=-6NYlbfkN0ARICpNo1DhGqfodICOss3ZS6QdhS5AHh5hrs_CHOPYqyMBbpKreu8_0VPK2YpEpLZNJh0VHcoh2uBpOX4W24XIq0BbIMzobydMuLe6CS5s74HHZNx7b0CiKiEz0iq5JSeHOGf_zSExMEpfO0HT5hGTs3LrG70F1NJvhceVZI-dRR3jRjQOYtPPiRLhNymQ_p01PfdZP-WGfKc2VWFrS2y1t3gD1-cuBWTenZn6UqO0r52YZFGCeg4_Vzwfi7q-r7e5SwCf1jBLj7Y72zvtAFqf2TVzL3MufVbvXCign-uDIEDplYZx1JRkwuqmYKwW_DmGM3mLx5DjfN9NEluiIypPcqRvyPXyWgB3DJ1csnuCs847rC16ecBUPZOOJgBfRm0fh0NF_XgI5_nNBUPtaO5MVqU5oHGimm-YzyePsJZ168ec7i7BHNrS5CCscOc4E_1vQyHX-M6J-yXCnPru-9FnS5IftITZS-ymsBGKAyNSrAxiy_Ty1m-QG2_5uakRSxUhAkZkOC380tmpWs_meW2Bq5IZGr4ajnM-kEaXDDTvJm0NEeaWpXPtvFH_9osGqOmOG6kLQLd__7xjIZz4Wiev2ciBHuHyrmB5ReQQXYTRBZTYCM6_EL9SUt8pqWuLz2WjcBjkBwUDeeAlSwGLUa95nGuNrMlItlr9aizuSAlvidpMbTl2czUemWxMDGVc7-5QA4jaqu6Mhg==&p=11&fvj=0&vjs=3
"Machine Learning Scientist - Bay Area, CA",,Tempus,"Redwood City, CA",,3.6,"MS/PhD degree in a quantitative discipline (e.g. statistical genetics, cancer genetics, machine learning, bioinformatics, statistics, computational biology,…",30+ days ago,2021-01-10,https://www.indeed.com/rc/clk?jk=4ceb11f1c18d269e&fccid=8525bdcf5722dd27&vjs=3
Machine Learning Engineer - Contract to Hire,$70 an hour,Harnham,"San Francisco, CA",Temporarily remote,4.6,"Machine Learning Engineer - 6 month contract to permanent placement.
5+ years of industry experience.
Remote flexibility (Due to COVID 19).",18 days ago,2021-01-10,https://www.indeed.com/pagead/clk?mo=r&ad=-6NYlbfkN0ARICpNo1DhGqfodICOss3ZS6QdhS5AHh5hrs_CHOPYqyMBbpKreu8_0VPK2YpEpLa-xyPlQLuiAaeWcb5wu1xsc6Dg0Wd2CuSfqKJ_EeVboHdkejKWINAKD2P8GP7YiqV-zSquwpu5XyEYCTNs82VeQ17c9FDw0rwAkt-kxs8IoJ98eN4M2zwgYKVQHnND20Te0zimPHk1yaf91aYL0lwfy2Nvp_597N7A789HvoPQu4Ozb42SXnmGVod5qjHQtui7EP9nJmoo8SRkMrz6iR7ogvJzYRea4x0Vz8YiWpzg0n6gJdIi_AhlQoV2_3VQMI77bQxrHq5DBIJc-oUIL2aG15RHtJ6JS5Vrr8uOfjIzijqbIiVlcDjZyDs2-sSDTvT9ae2nf7rJM3EcH6x0O2JKo6Qy_XUIZdSA1EAP570lG1lm3Qbr_-qGRUhdBj7rqmvZvU-a7YKJMLuVClDwrP2XqsjcC85pb1b2C6pa29buPamfq4bKfBSU5V8jTXF1pkHdILnjncZVVyEbxWn1iC-jkRVsuFUAJSrzfIpY-6fY1IuWKsItuQ1h9h3qxwrfMK72q09L4Y2JsNiVPG59CAUc9qPLGqHnwNTPvC1k2NdjDeLHW4hfyghHn5ZIxam9ShQFYsu3CrQSycAJH-Z1HQaH3Uz_x-lCXTu_eCenaUzjw8aaq77S1dNi6_ivDxDR7X6cFbAI69WF0A==&p=13&fvj=0&vjs=3
"Sr. Director, Data Science",,DeepVu,"Berkeley, CA",,,Experience building and deploying high performance deep-learning models using either Tensorflow or PyTorch on significant complexity industrial/commercial data…,30+ days ago,2021-01-10,https://www.indeed.com/rc/clk?jk=5edc4de9187f0685&fccid=44c6ee3bb480d861&vjs=3
Postdoctoral Scholar - Data Science Program - School of Information,"$60,000 - $65,000 a year",University of California Berkeley,"Berkeley, CA",,4.2,"Very large scale data mining and analysis.
Research design and data analysis.
Our web-based master's program (MIDS) is the first and only degree available…",30+ days ago,2021-01-10,https://www.indeed.com/rc/clk?jk=7aa83d8a3a7eed28&fccid=db52f1353185d77b&vjs=3
(Senior) Genetic Data Scientist,,Alldus,"Redwood City, CA",,,"Provide quality control and analysis of a wide spectrum of omics datasets, including DNA-based (e.g. whole genome sequencing, whole exome sequencing, targeted…",30+ days ago,2021-01-10,https://www.indeed.com/rc/clk?jk=7da51638bedabd41&fccid=b4df24bc350094d0&vjs=3
AI/NLP Engineer,,Cognii,"San Francisco, CA",,,"Strong background in statistical modeling, NLP and machine learning.
Semantic modeling of textual data.
Design and implement NLP algorithms for educational…",30+ days ago,2021-01-10,https://www.indeed.com/rc/clk?jk=eec51f4c97a94987&fccid=c3c01c17c15fead3&vjs=3
Staff Machine Learning Engineer,,Tinder,"San Francisco, CA",,4.8,The staff machine learning engineer role will be responsible for the development of machine learning models and systems for recommendation applications.,30+ days ago,2021-01-10,https://www.indeed.com/rc/clk?jk=6f6d0f5c9039b8a7&fccid=12c109dc261fc3cb&vjs=3
"Sr. Director, Data Science",,Oportun Inc,"San Carlos, CA",,3.8,"8+ years data science experience preferably with machine learning models and model platform.
In this role you will be working with large and diverse alternative…",30+ days ago,2021-01-10,https://www.indeed.com/pagead/clk?mo=r&ad=-6NYlbfkN0C_oHR7jvpN5HR3CqZ22aILZ6qFd8EwL-InkRw-v0cCtKCQG5JyEvqri0xY07optJsghTR9RgGffYYWJgIsDTRxjzc9E-1lJ4MuJv3Pe88vW5OlXJLifhL_eodxdJDV_Yu71hsgHpqRjChB892koyKMdHHO0yvfLhrh_Qgtet7rj_SEHwGkXTaHPpTtiwvLi7Rs3WQbUKYergrz0YKGy6AwwdTC5zVt9ydcQXJlggRx0WnifK1Ak7n-pEXxhLkI988l68ZN_wLlFF1_7et31n2-Ca2qG_KfGcex62UMmWY02FmrTVbOfAlnP4Nv3mi0FkZJ-KQzhs42-h_F9Uo7eHp5gRJIDQQuQu5re20Zs2eyPbewYKhBNk2QpNgbmcC8QGuoKA4c0Sezefh_PmII5ULCFHs9eAx0cOIfUJRApaCOFq04dNgBv-XHQuTkae1_FvIG4gQlcbFoOlbS_t-7xJuByb7m-4E6qiI-xV3zjjMoJpORhyjsYCsbSgLbnhpY3h5hgyuu5eOkQeFdyd5zazo-yU2lJM8Krs6GaZwQS_UNxvc3JatVelEd1uJwU61NCv4E6C90apVc5u8BcbRkJVF4rePCWb5AvLrlluss7d4OlwyiSbFCU40KGX--tjtGr3Lln7j7b0BJPrCyNqHdVHmcryeI4rdczVLjnTXklpFWMhVd64-jVatRJIdZqGtzSaJyTvV0fSSWeO8mHoOjXG2cfeujlxczW0LPLBCXWxV2_o4O9DF7TJjMgMdc9IsXvaP4vjt6CmHLME6C-ryaSmJIyJxrpNFzrw0sZcFCMjYal6PFCZmVBQitnDzmKsxH-5LEtMCLXNGJTZYhBLfqpBMOpZrj5NG4zrHzxiG3fznpOXowuKlRaYB6&p=4&fvj=0&vjs=3
Global Marketing Theater Operations - Data Scientist Graduate or PhD Intern (Summer 2021),,Splunk,"San Francisco, CA",,4.1,"Solid understanding and experience with advanced statistics and modern machine learning predictive techniques such as GLMs, decision trees, forests, boosted…",30+ days ago,2021-01-10,https://www.indeed.com/rc/clk?jk=95a512a1d732a18a&fccid=aef928e89977f7f0&vjs=3
"Data Scientist, Clinical Product Support",,Thermo Fisher Scientific,"South San Francisco, CA",,3.5,You will be contributing and building teams of scientists to developing processes and mechanisms that facilitate continual improvement of our products and…,30+ days ago,2021-01-10,https://www.indeed.com/rc/clk?jk=a1a14db970d40559&fccid=126e3afd205caa95&vjs=3
Data Science Curriculum Manager,,Hack the Hood,"Oakland, CA",,4.5,"Staying informed of STEM education and relevant technological advances, conferences, articles, and sharing with team and relevant stakeholders (i.e. Board…",30+ days ago,2021-01-10,https://www.indeed.com/rc/clk?jk=7d98a96b8eeed9d4&fccid=270fe861661578b2&vjs=3
Machine Learning Engineer - Core Engineering,,Goldman Sachs,"Menlo Park, CA",,4.0,"Experience working closely with data scientists and appreciation for their unique workflow.
You will collaborate with data scientists and business leaders to…",30+ days ago,2021-01-10,https://www.indeed.com/rc/clk?jk=fe81b190491314a2&fccid=16a97ed26c75bf2d&vjs=3
GIS Specialist/Statistical Data Analyst,,Oneida ESC Group,"Walnut Creek, CA",,,"Ability to understand and manage metadata and spatial data requirements.
Ability to edit, manipulate, and analyze project data using GIS and similar products.",30+ days ago,2021-01-10,https://www.indeed.com/rc/clk?jk=6ac4ad303eef0d01&fccid=2d03cf7f41dd45d7&vjs=3
Data Science Manager,,Big Fish Games,"Oakland, CA",,3.5,"Hire, manage, and mentor a small team of amazing scientists and analysts.
The ideal candidate is a leader with a proven track record of developing analytics…",30+ days ago,2021-01-10,https://www.indeed.com/rc/clk?jk=8e94ddbdc3a82d1e&fccid=38fd7bd102c4d12e&vjs=3
Director of Data Platform-Digital Surgery,,Johnson & Johnson Family of Companies,"Redwood City, CA",,4.2,"A minimum of 10 years of relevant business and data technology experience.
This role will craft our data strategy to enable an efficient implementation of…",30+ days ago,2021-01-10,https://www.indeed.com/rc/clk?jk=04f7cde2891e35c3&fccid=0bed8e17bc113980&vjs=3
Machine Learning Engineer (NLP),$72 an hour,Harnham,"San Francisco, CA",,4.6,"Deep understanding of data structure, performance optimization, and algorithms.
Experience working with big data platforms such as Spark, Hadoop, Kafka, Hive,…",30+ days ago,2021-01-10,https://www.indeed.com/pagead/clk?mo=r&ad=-6NYlbfkN0ARICpNo1DhGqfodICOss3ZS6QdhS5AHh5hrs_CHOPYqyMBbpKreu8_0VPK2YpEpLZNJh0VHcoh2uBpOX4W24XIq0BbIMzobydMuLe6CS5s74HHZNx7b0CiKiEz0iq5JSeHOGf_zSExMEpfO0HT5hGTs3LrG70F1NJvhceVZI-dRR3jRjQOYtPPs_vMvW2DqL_fn5Hv3c3VSflDkQwSLZjcu3eScfPc-ZrJJLUtnW_vcgkCGW-_z5fG3z4JPm-uyKa9hrKmnch3NARypmdizMBcoWjefgiSprQXP08iwRLN81EJnVeO6bBzYY_FiOo1oWVQjhcL9rJNP7jUFUCW5c3bskKNKXeDRUgmxLqgbW5UHKPkMmVK8IMY81L-7qzQ-O7FpG8gjom_47mx1aEGu0QnIdANPPwD0F6Pe5Z3VXu2LD4V62I1JG0VES9cFOa2Jukf5V2C-93fbtuX-EfznzoSf2halhmoaDhJSxDIt08-a8zHFvlZF2_CCoQp44s4G74V0mCyGQEGVLVSQwM10okc81c0B7T7afZnLkAvHr1o4dU1jiz9-oa3GFvXp6_wHOjkXw0hsaGmGp-J_ADp2qfuRik4BvysI8U2QN7PYxS4r0SMpMxbyf_3hG95MTx3t3fTWR-ote6gWkhSfNaXDJl3duDalVSsQh2szpjM_XHrO3zaZZT9hfWPMZ_iMfpIXFc6n2F5GJuGHw==&p=12&fvj=0&vjs=3
Software Engineer - Machine Learning Infrastructure,,Twitch,"San Francisco, CA",,4.3,"You will be responsible for leveling up the capabilities and influence of our scientists by empowering them to build reliable, scalable machine learning systems…",30+ days ago,2021-01-10,https://www.indeed.com/rc/clk?jk=a1a29dba02bfe22f&fccid=e21f6affbb4bb0b2&vjs=3
Machine Learning Engineer - Contract to Hire,$70 an hour,Harnham,"San Francisco, CA",Temporarily remote,4.6,"Machine Learning Engineer - 6 month contract to permanent placement.
5+ years of industry experience.
Remote flexibility (Due to COVID 19).",18 days ago,2021-01-10,https://www.indeed.com/pagead/clk?mo=r&ad=-6NYlbfkN0ARICpNo1DhGqfodICOss3ZS6QdhS5AHh5hrs_CHOPYqyMBbpKreu8_0VPK2YpEpLa-xyPlQLuiAaeWcb5wu1xsc6Dg0Wd2CuSfqKJ_EeVboHdkejKWINAKD2P8GP7YiqV-zSquwpu5XyEYCTNs82VeQ17c9FDw0rwAkt-kxs8IoJ98eN4M2zwgFHEGj1ceX2fT7BVCDCSiq7HyRnZPpTiKFIAmofhdoG17fFzb9HDcQRyPtCOU0B09HxLMHtyqscscR3xvapFu8ttpbbve_rgfYoPfPrHg3vpAUjcUTHlKmvh4_f2t1DgOROazY2qwov_1TQXWSZQm8AZ6EaYoDMxAtcoUix8udRMr9MOy1_wj7ODygokLWNfDL6A-rs0aWez2QRJPtKc6y5HzhAO_WNDrKczC_eiXYQRpTwwDUoGt3tECjmTbtKEZTK7YTdgD8Vw1-Bpyz4BG5p1poAEuKz8WPEosQnrOlT7J4BLps4CvtxhZcAMX3azbZgWKU75ONS0nHI5Gjf10v34pIyGjcdgS-GhhCopcF1ko1Ha6odc_5M4X_WcHZVZ4VNa8d2SEQ8FjCNBk1-Hd1L8iRWfWImfNlu1ODHz1f8heb5Op8he969nCcLRQBDOEsrdnttlLcQcC0-e8I0dHQsW7CYQjXEZrZ4ItBb_bI8_4nMTHL41baXaWX4Zfrf6rLlBDUhbLkQX0soS_zdDDnw==&p=14&fvj=0&vjs=3
Senior Machine Learning (ML) Engineer - Eats Discovery,,Uber,"San Francisco, CA",,3.7,"The team owns 3 tier-1 (business critical) services, 30 machine learning models in production, and over 300 data pipelines which ETL and monitor the data used…",30+ days ago,2021-01-10,https://www.indeed.com/rc/clk?jk=5f19f8cffab38164&fccid=f766f8bfbc3effb7&vjs=3
Senior Data Scientist,,Verizon,"Walnut Creek, CA",,3.9,"Partner with team and non-team data scientists to teach complex concepts, assess project feasibility, select input features and validate project output.",13 days ago,2021-01-10,https://www.indeed.com/rc/clk?jk=1c5f040df42eafb3&fccid=f7029f63fe5c906e&vjs=3
"Software Engineer, Robotics and Machine Learning",,Autodesk,"San Francisco, CA",,4.1,"The Lab looks for new ways to apply 3D design tools, machine learning, and emerging technologies to advance the field of robotics.",30+ days ago,2021-01-10,https://www.indeed.com/rc/clk?jk=bd3a5f9e9d62e7b1&fccid=7136762d065a5ad7&vjs=3
