job_title,salary,company,location,is_remote,job_rating,job_summary,post_date,extract_date,job_url
Senior Data Scientist - Optimization,,AutoGrid Systems,"Redwood City, CA",,,Candidate should have a deep understanding of various optimization algorithms as well as practical experience of working with open-source and commercial solvers…,30+ days ago,2021-01-10,https://www.indeed.com/rc/clk?jk=5141d5aae99a423f&fccid=041c434804e31082&vjs=3
Sr. Backend Software Engineer - Machine Learning Team,,Splunk,"San Francisco, CA",,4.1,"For this role knowledge of data science or ML concepts is not vital, but you must have an understanding of the data science workflow and be passionate about…",5 days ago,2021-01-10,https://www.indeed.com/rc/clk?jk=b829d8a40d1dea21&fccid=aef928e89977f7f0&vjs=3
"Manager, Machine Learning",,"Upstart Network, Inc.","San Mateo, CA",,,"The team consists of full-stack generalists as well as specialists in data science, statistical modeling, analytics or machine learning in each of our locations…",30+ days ago,2021-01-10,https://www.indeed.com/rc/clk?jk=feda561165dc9c11&fccid=f98377d49d210910&vjs=3
Senior Machine Learning Research Engineer,,Scaleapi,"San Francisco, CA",,,"The goal of a research engineer at scale is to bring techniques in the fields of computer vision, deep learning and deep reinforcement learning, or natural…",30+ days ago,2021-01-10,https://www.indeed.com/rc/clk?jk=a4b3f4c4ab198524&fccid=55ebd28e88790c63&vjs=3
"Machine Learning Software Engineer, Cardio",,Tempus,"Redwood City, CA",,3.6,"Tempus Insights is our business to develop, validate and launch new predictive tests, in oncology and new disease areas, by leveraging our clinical + molecular …",30+ days ago,2021-01-10,https://www.indeed.com/rc/clk?jk=f3a73a358b0e3c6d&fccid=8525bdcf5722dd27&vjs=3
"Computational Chemistry, Machine Learning Scientist (REMOTE)","$190,000 a year",Harnham US,"San Francisco, CA",Remote,4.6,"As a member of the machine learning team, you will utilize your experience in applying CNNs, GNNs, and the newest techniques in deep learning and Python to…",30+ days ago,2021-01-10,https://www.indeed.com/pagead/clk?mo=r&ad=-6NYlbfkN0ARICpNo1DhGqfodICOss3ZS6QdhS5AHh5hrs_CHOPYq--8fkI3D83FkjGvsVbMbLT7-I7qXZvz1ne2OjM4HKUf0IFxBAiJmhjGxxOD2tX_yw8nK6EJQoZas4OugQbWMwjycHbhQdhqHrTVE4kyHtU5Qn1cEYTsscLZ4Aycw6bBHapkIUKz_MqAUh3LrwzEJJJC4-jhT2xPw5HRcG57aXyvSq1KESCMn6xH1X6F1X_MAn4Zm7ZskNU8Pri1aRYi60zxN1za7nVqmWaS3SIufSFCrTWySvJ7HX1nmVVsbzdIXW49yNJmZ0bKWDx-zDf3CyylHR2NEcVxJBF35R5yFMc0uXoVuwAEe1mR5ru41cEJ3hUrGcjnSLPOcSKJngIGLwR900X7DTgPetJS0OgzNcSaZBnN7tqoqFRd__2Q1hH-UBSYD0dl4drSuO46uhCHSBfoOsrNNY8OZR8OygqvwZV_QuKuN-026GMQ4Pda8GCXPMriGv6BffkNfmOS0eT5MsBte8nTzRaBMZRXwz-bCmGAF4KS3G-CXl8ZJrIVdAW0fZpaZg9bQmd-nVLvMhjDGPSM0o_Yk6KCDwqD4s0_3Cy3Wg0UYn29lBWqgRVFV1Q004_OnQMvMdolASelxI4EpUML8Kvsei3kR7GgNAkx2GbwqCbBp7EzSHTz11la7HfQiGpbb_Z3-GVpk9ISc9FXN8egat_I2nMSbh8P17NzFcTNgxQfkMSOTxI=&p=9&fvj=0&vjs=3
"IP Counsel, Software and Artificial Intelligence",,Thermo Fisher Scientific,"San Francisco, CA",,3.5,"Background or experience with analytical instrumentation and data analysis/interpretation/visualization software is a plus.
Navigate freedom-to-operate issues.",30+ days ago,2021-01-10,https://www.indeed.com/rc/clk?jk=de86231727280c66&fccid=126e3afd205caa95&vjs=3
Senior Machine Learning Engineer,,Change Healthcare,"Emeryville, CA",,3.0,"You will enjoy working with a highly talented and diverse team of data scientists and engineers specializing in deep learning, active learning, and classical…",20 days ago,2021-01-10,https://www.indeed.com/rc/clk?jk=662dba064dec48b8&fccid=b1bd9b34a39d5dcd&vjs=3
Sr. Staff Machine Learning Engineer,,Twitter,"San Francisco, CA",,4.1,"You’re a relevance engineer, applied data scientist, or machine-learning engineer who wants to work on exciting algorithmic and deep infrastructure issues to…",26 days ago,2021-01-10,https://www.indeed.com/rc/clk?jk=ed50581dee25bffb&fccid=7a3824693ee1074b&vjs=3
"Senior Consulting Data Analyst - R, SAS,Linux, LaTex",,Kaiser Permanente,"Oakland, CA",,4.1,"Bachelor's degree in economics, finance, health care administration, public health administration, statistics, mathematics, operations.",30+ days ago,2021-01-10,https://www.indeed.com/rc/clk?jk=bba1399c484b1afc&fccid=48ecd526e3aa3225&vjs=3
"Principal Engineer, Machine Learning",,Sephora,"San Francisco, CA",,3.9,"Be responsible for machine learning and deep learning model development different areas of the business.
5+ years of experience applying neural networks and…",10 days ago,2021-01-10,https://www.indeed.com/rc/clk?jk=995e3e56c530b764&fccid=afda98bfc8224b19&vjs=3
"Principal Engineer, Machine Learning",,Sephora,"San Francisco, CA",,3.9,"Be responsible for machine learning and deep learning model development different areas of the business.
5+ years of experience applying neural networks and…",10 days ago,2021-01-10,https://www.indeed.com/rc/clk?jk=995e3e56c530b764&fccid=afda98bfc8224b19&vjs=3
Machine Learning Engineer,,"JPMorgan Chase Bank, N.A.","San Mateo, CA",,3.9,"Work with cross-functional teams of engineering, data science, and product to design and productionize key machine learning capabilities in firm-level AI…",Today,2021-01-10,https://www.indeed.com/rc/clk?jk=7ca81234b1372653&fccid=aaf3b433897ea465&vjs=3
Staff Machine Learning Engineer,,Williams Sonoma,"San Francisco, CA",,3.5,"At Williams-Sonoma, we are harnessing the power of data science, machine learning and predictive analytics to better understand the dynamic trends, patterns and…",25 days ago,2021-01-10,https://www.indeed.com/rc/clk?jk=5e9cfbdf248efe6e&fccid=cdd85c4d445cce0f&vjs=3
"Global Gaming Data Science Lead, Google Customer Solutions",,Google,"Redwood City, CA",,4.3,Partner with data science/machine learning teams across Google to build an array of customer-centric marketing data models.,30+ days ago,2021-01-10,https://www.indeed.com/rc/clk?jk=d31c5b1e5619b1fe&fccid=a5b4499d9e91a5c6&vjs=3
Intern - Statistical Programming eSub Team,,Gilead Sciences,"Foster City, CA",,3.6,"Ability to understand clinical trial design and scientific literature.
Proven problem solving and data processing skills and show an interest in the…",30+ days ago,2021-01-10,https://www.indeed.com/rc/clk?jk=8f4ce039bfe7f80e&fccid=e4b075354d7c2865&vjs=3
"Senior Technical Product Manager, Data Platform",,Stem Inc,"Millbrae, CA",,2.8,"Management of incoming data from Stem site telemetry and external data sources.
Experience with cloud development, IoT, and big data frameworks.",3 days ago,2021-01-10,https://www.indeed.com/rc/clk?jk=e14f88d81cc0951a&fccid=aac7b96dbaacd8a9&vjs=3
Senior Applied Scientist,,Amazon.com Services LLC,"San Francisco, CA",,3.6,We are looking for a passionate and talented Senior Scientist who will collaborate with other scientists and engineers to leverage machine learning methods and…,30+ days ago,2021-01-10,https://www.indeed.com/rc/clk?jk=e312b9e2e2632d75&fccid=fe2d21eef233e94a&vjs=3
Data Science Senior Manager,,Accenture,"San Francisco, CA",,4.0,"You must be able to effectively use and lead multiple teams and projects, using statistical, data mining, machine learning, and/or deep learning techniques in…",30+ days ago,2021-01-10,https://www.indeed.com/rc/clk?jk=4fb6473dd8f0a549&fccid=a4e4e2eaf26690c9&vjs=3
Senior Staff Machine Learning Engineer - Homefeed,,Hired Recruiters,"San Francisco, CA",,,"Passionate about applied machine learning and deep learning.
8+ years experience applying machine learning methods in settings like recommender systems, search,…",30+ days ago,2021-01-10,https://www.indeed.com/rc/clk?jk=9ccb626f81aa9ff7&fccid=547ddf8bc07ce2c9&vjs=3
Senior Data Engineer (Life Science Products),,Komodo Health,"San Francisco, CA",,3.0,"Designed, developed, and implemented data infrastructure, data pipelines and data processing code for product features.",30+ days ago,2021-01-10,https://www.indeed.com/rc/clk?jk=4ab28dad13fe33bd&fccid=086cb533b5438773&vjs=3
AI Engineer,,Volkswagen Group of America,"Belmont, CA",,3.7,"This role will be tasked with applying machine learning/deep learning to the automotive industry.
Maintains, as well as furthers, enhances existing machine…",30+ days ago,2021-01-10,https://www.indeed.com/rc/clk?jk=726ac2fcc3a2b824&fccid=f59b3329de972ea8&vjs=3
Machine Learning Engineer (NLP),$72 an hour,Harnham,"San Francisco, CA",,4.6,"Deep understanding of data structure, performance optimization, and algorithms.
Experience working with big data platforms such as Spark, Hadoop, Kafka, Hive,…",30+ days ago,2021-01-10,https://www.indeed.com/pagead/clk?mo=r&ad=-6NYlbfkN0ARICpNo1DhGqfodICOss3ZS6QdhS5AHh5hrs_CHOPYqyMBbpKreu8_0VPK2YpEpLZNJh0VHcoh2uBpOX4W24XIq0BbIMzobydMuLe6CS5s74HHZNx7b0CiKiEz0iq5JSeHOGf_zSExMEpfO0HT5hGTs3LrG70F1NJvhceVZI-dRR3jRjQOYtPPzA7BDhJGLwjyInlrKO9u6f83XVhmfow5D7mv1dq6NwbsEtmMamb1FRtEtbgX_aZpl6SD5HeQrTv8_-EUP_F35P4MwgTreqOuFOBd30VL9cuZXcdVu8BvMGFs1sch8eHbvvCV4q48L8ORBRTh9UPJQew4kOCT0Fr5hFLfx2EmPfU1ikTCfny3EHKNlOMWReSUUrTm2fTFfog8p29TKZxTZ-bEnNovzcVAOISJ4oMHo6oO-TwJuMVFqXjdHKg0eA5DIS6fY-VF4CnODBdCCZ2wQLUOlETnnHu4bfbwS7YZJYRmlpiWhTXhxB0zRSDiWQGQX_UGFp71jaV0xCE-LgWxH_JEl8VCpEo8fztQMV2QoUE8ZJbpNBe8LxzfInAEc6u3eHrPnd0GDFy1FPY7UPf9g3D_agEe5BJHE0yOU6Row1g-3eaTQAb0lG0eRTlHZ5sP6MX3yUlffInYnYGlgGhtYulOD2rRjKJ6M4rSUJ4AQNUv9iU3AD9ZeceiHggyo543tx_a7BsijdqpO8JSnh9TkQ==&p=11&fvj=0&vjs=3
Senior Machine Learning Engineer,,Amplitude,"San Francisco, CA",,,"Extensive data modeling and data architecture skills.
In this role, as a machine learning expert on how to bring ML algorithms to production, you will be…",30+ days ago,2021-01-10,https://www.indeed.com/rc/clk?jk=86d50b61bc3cbab8&fccid=62c3e5a6bf72744b&vjs=3
Head of Machine Learning,,Afresh,"San Francisco, CA",,,"Lead, manage, and develop the ML team and Afresh's production-scale ML system that uses deep-learning and other cutting-edge ML techniques to power store…",30+ days ago,2021-01-10,https://www.indeed.com/rc/clk?jk=e1fc1cc992e2b366&fccid=cd4725921f2c98aa&vjs=3
Machine Learning Engineer - Contract to Hire,$70 an hour,Harnham,"San Francisco, CA",Temporarily remote,4.6,"Machine Learning Engineer - 6 month contract to permanent placement.
5+ years of industry experience.
Remote flexibility (Due to COVID 19).",18 days ago,2021-01-10,https://www.indeed.com/pagead/clk?mo=r&ad=-6NYlbfkN0ARICpNo1DhGqfodICOss3ZS6QdhS5AHh5hrs_CHOPYqyMBbpKreu8_0VPK2YpEpLa-xyPlQLuiAaeWcb5wu1xsc6Dg0Wd2CuSfqKJ_EeVboHdkejKWINAKD2P8GP7YiqV-zSquwpu5XyEYCTNs82VeQ17c9FDw0rwAkt-kxs8IoNsyJQe2yOvBhoQT7bfOutqZxJHoJHYdXa4ZPz4KRZNUwKt4lW5k8BfQlEzcZa26zFkr_zpI1b7MNxzK_vv8K9G2KEJanekxlrpLqVppozs0wE1OBryYn9bSRNPLs35QZNKy0Ai8fYRZ_2lEPkoThfBML5hTGYhT1c_ZH786oelcG2uyBuTkFC6umlog34Tqri9PXiLsK8A-9288d0xuZ30379h4gzvClLIwjrn16M5RT3s4H0gSMs7OBqSV96HtZwUMPaTEtZ3twa6EQQncaxshCCZwYsFvPFAt9sDh_EQVvY-350fdcojcfP6tx0-aRdjzRKpxYh5By0zsUy0pFINhA7QcrKkQQPX_fVVhnW2A9Hi62rdmduOPh9KHuux2_1M3ycn-_nuO2N16xmyEMdU3xa3zRcz3Jd1lbxM43xnVJhkqgFFGbpF1m_4HxdUnvS2_Vtl5nmDmYnMgGZwEyCcNSkrG8jeX6VDeaxT__5qfGAd1G38zSANpp3ISkXxYFMO3T7-vM5FCXQPoZ6XWXnp-MqKQ4jlP1Q==&p=14&fvj=0&vjs=3
Lead Machine Learning Engineer,,JetFuel,"San Francisco, CA",Temporarily remote,,"Comprehensive health, vision & dental plans.
Design, architect and implement our machine learning environment from end-to-end.",30+ days ago,2021-01-10,https://www.indeed.com/rc/clk?jk=e5df74459bc6d757&fccid=6b0c60526626d50a&vjs=3
Senior NLP Scientist,,Tempus,"Redwood City, CA",,3.6,"End-to-end large scale machine learning model integration.
3+ years of industry/academic experience in prototyping and building machine learning models for…",30+ days ago,2021-01-10,https://www.indeed.com/rc/clk?jk=6178076c60d3834c&fccid=8525bdcf5722dd27&vjs=3
"Senior Product Manager, Personalization (ML/NLP)",,Grammarly,"San Francisco, CA",Temporarily remote,4.8,Has developed and successfully owned key product metrics/indicators that map directly or indirectly to company performance; can analyze and pull meaningful…,30+ days ago,2021-01-10,https://www.indeed.com/rc/clk?jk=b1fe440d0bb9d8b5&fccid=0555014e7bce64c3&vjs=3
Senior Data Science Engineer,,super{set} startup studio,"San Francisco, CA",,,"Understanding of key machine learning and data mining approaches.
So, you can query large amounts of data using your favorite big-data toolkits, analyze it…",30+ days ago,2021-01-10,https://www.indeed.com/rc/clk?jk=6b1fd7a6befd8c4f&fccid=66633fcf2f5ac86d&vjs=3
"Data Scientist, Decisions",,Lyft,"San Francisco, CA",,3.5,"5+ years of industry experience in a data science or analytics role.
Experience in programming, especially with data science and visualization libraries in…",19 days ago,2021-01-10,https://www.indeed.com/rc/clk?jk=00b7e41b676edb51&fccid=7dcf8477ac404a55&vjs=3
"Director, Statistical Programming",,PACT Pharma,"San Francisco, CA",,4.0,"Extensive knowledge and experience on clinical lab data or biomarker data are highly desired.
Generate visualization report for data quality check or medical…",30+ days ago,2021-01-10,https://www.indeed.com/rc/clk?jk=add9008b8d197faf&fccid=d2e858d6c9a3a352&vjs=3
"Staff Machine Learning Engineer, Relevance and Personalization",,Airbnb,"San Francisco, CA",,4.2,6+ years of industry experience in large scale machine learning systems or a PhD + 4+ years industry experience in applied machine learning in similar problems …,30+ days ago,2021-01-10,https://www.indeed.com/rc/clk?jk=4388b7d06f39ca58&fccid=95a08f6a451ba57f&vjs=3
Senior Data Scientist-Digital Robotics & Surgery,,Johnson & Johnson Family of Companies,"Redwood City, CA",,4.2,"Guide a small team of junior data scientist.
We are seeking hands-on candidates who will be deep in code, and are technically strong in data-modeling, noise…",30+ days ago,2021-01-10,https://www.indeed.com/rc/clk?jk=4a97406dbb27f1b0&fccid=0bed8e17bc113980&vjs=3
"Senior Staff Machine Learning Engineer, Homefeed Ranking",,Pinterest,"San Francisco, CA",,4.2,"Passionate about applied machine learning and deep learning.
8+ years experience applying machine learning methods in settings like recommender systems, search,…",30+ days ago,2021-01-10,https://www.indeed.com/rc/clk?jk=af08a991fcea1af6&fccid=43014b1412e0a7b6&vjs=3
"Computational Chemistry, Machine Learning Scientist (REMOTE)","$190,000 a year",Harnham US,"San Francisco, CA",Remote,4.6,"As a member of the machine learning team, you will utilize your experience in applying CNNs, GNNs, and the newest techniques in deep learning and Python to…",30+ days ago,2021-01-10,https://www.indeed.com/pagead/clk?mo=r&ad=-6NYlbfkN0ARICpNo1DhGqfodICOss3ZS6QdhS5AHh5hrs_CHOPYq--8fkI3D83FkjGvsVbMbLT7-I7qXZvz1ne2OjM4HKUf0IFxBAiJmhjGxxOD2tX_yw8nK6EJQoZas4OugQbWMwjycHbhQdhqHrTVE4kyHtU5Qn1cEYTsscLZ4Aycw6bBHX02tSycgOAeApm9_aX9UhjzOiqcjaDW-62-OUJiP0xMI8SMWiMbNpr1P2DQ4gB7BI3vcYaoQg2DWuK6Rjxmt8c46KlIwrnzJSBLA2BZ6HkBNRi78Gb9lU_63zRri8ouWsfFARyEKtU5P_J5lOHiTHbfcKbQABRNX6MtYoamO6Qfk7OCrrn0KSiUN3NBpi1X4c6OqSmnJ_EjQC8XbknHWSuZ4QP5DXycnGUc92uJhXiIRzwxmWGGPElbCJg841F3h8XCruaWZaURlWjc7Aop8NPcryj6lu8yvOseSPuQXdvrzWClRae2iPUHpyq9-9W17NFrobKOGcBq7u9JIOahV6KvdtBNBh6Ep-1tQKuAtQUuLY3FwSh3SF7fquaAUNA9W32hhYdAXFq1PUxo9zjTmwatxgxf7_t8Z_T16isXzuRnL-MuX-JTQT3P4kFSALPwCSxtPe3cifyzkPRH-mM2dL7qVC8Ga9fqdS7vu10NCIWzmmywHa9elHd30h83I3eAqMbRuSBLmzQiuOP9Yg-S6euzh5D9fqk5OzBkLuiYKB5hJEAxVMuHomI=&p=9&fvj=0&vjs=3
Machine Learning Specialist-Digital and Robotic Surgery,,Johnson & Johnson Family of Companies,"Redwood City, CA",,4.2,"Our new future will involve machine learning, robotic surgery, instrumentation, advanced visualization, and data analytics.",30+ days ago,2021-01-10,https://www.indeed.com/rc/clk?jk=e4c3acc490867555&fccid=0bed8e17bc113980&vjs=3
"Senior Technical Recruiter, Artificial Intelligence",,Cruise,"San Francisco, CA",,2.8,Work closely with engineering leads to understand their hiring needs and teach them how to maximize hiring output for their team.,30+ days ago,2021-01-10,https://www.indeed.com/rc/clk?jk=4b727cd9812f1daf&fccid=3322e3b44a5a0777&vjs=3
"Sr. Manager, Quality Support, Data Science and Biometrics",,Gilead Sciences,"Foster City, CA",,3.6,"Coordinates quality project communications and ensures that all project customers are fully informed and knowledgeable of project activities, timelines and…",30+ days ago,2021-01-10,https://www.indeed.com/rc/clk?jk=4cacf77b9aa3d709&fccid=e4b075354d7c2865&vjs=3
Principal Statistician,,Seagen,"San Francisco, CA",,,"Performs or oversees the analysis of clinical trial data, provides statistical interpretation of results, and collaborates on the reporting of clinical trial…",18 days ago,2021-01-10,https://www.indeed.com/rc/clk?jk=38fad0123273825f&fccid=52558a648544a28b&vjs=3
"Senior Manager II, Data Science, eComm",,Walmart,"San Bruno, CA",,3.5,"Manage and execute entire projects from start to finish including cross-functional project management, data gathering and manipulation, analysis and modeling,…",30+ days ago,2021-01-10,https://www.indeed.com/rc/clk?jk=a4c90b76214d1429&fccid=822bc5d9a49270ea&vjs=3
Head of Machine Learning,,Punchh,"San Mateo, CA",,,"Outstanding software engineering background, with hands-on experience with deep learning frameworks.
Advanced degree (Ph.D. preferred) in computer science,…",30+ days ago,2021-01-10,https://www.indeed.com/rc/clk?jk=0f4ec9968a12d849&fccid=e1b2607798446d2b&vjs=3
Principal Data Scientist/AI Engineer,,DeepVu,"Berkeley, CA",,,Experience building and deploying high performance deep-learning models using either Tensorflow or PyTorch on significant complexity industrial/commercial data…,30+ days ago,2021-01-10,https://www.indeed.com/rc/clk?jk=d61c10f648e224c8&fccid=44c6ee3bb480d861&vjs=3
Deep Learning Engineer,,Simbe Robotics,"South San Francisco, CA",,,"Demonstrated mastery of state of the art machine learning and deep learning algorithms, techniques and best practices.
Tensorboard knowledge is a plus.",30+ days ago,2021-01-10,https://www.indeed.com/rc/clk?jk=16b15e5c709b7c17&fccid=6dd0c8f1c244b965&vjs=3
"Scientific Manager, Data Science and Statistical Computing",,GENENTECH,"San Francisco, CA",,4.1,"Clear, professional, and effective communication at all levels of the organization including with engineers, scientists and stakeholders across multiple…",30+ days ago,2021-01-10,https://www.indeed.com/pagead/clk?mo=r&ad=-6NYlbfkN0Dmss7w5ZFmN5-ZVaFDklzxUenG_35YDjcWAPofWSNTcsHZ5edS59zNFfeQ7qDpTOL39mZfeL3vVkUiWLaFUA92kYEO8bUgaTkFQ-D97Xgc30bGI4NRdcvZjfy2HVWNilUrNR8okv9uP69JNvnTo-aBMUrBKmBT0vekhb5PLJzh1kqB-G6-diEPmDdK9pol-6xdipWtGEZGAL8j39yIWHeKpmJkO8lQnKPn4mX8VZHTIChBjKMXQbZ31Oko5KNfPJgLSkEhcN8iFviX1AHiiEqKn8c9lNrYT_APuIckLeU9YBmhZCvc8yVHj8CCIjtVgfBNNPlvzKOVFlaJnMzDIDmTgm56R8s9nnH7u06EwhMaVr1OoVOjNeX__0O5wg0u3Ij3uncnUybgUd461OlHIBJm0v1YKt8oKLiLeH3G4awAY5xUmimD4psxwXXOwO3y890=&p=3&fvj=0&vjs=3
"Sr Manager, QA Data Science",,Gilead Sciences,"Foster City, CA",,3.6,"Our scientific focus has resulted in marketed products that are benefiting hundreds of thousands of people, a pipeline of late-stage drug candidates, and…",30+ days ago,2021-01-10,https://www.indeed.com/rc/clk?jk=e72a75bb4bc49d84&fccid=e4b075354d7c2865&vjs=3
Senior Data Scientist - Underwriting,,Faire,"San Francisco, CA",,,You are passionate about solving problems in the FinTech space with innovative machine learning techniques and using alternate data sources for risk management.,30+ days ago,2021-01-10,https://www.indeed.com/rc/clk?jk=fee786adf74dc148&fccid=f3a36f726f745c17&vjs=3
"Director of Software Engineering, Algorithm/ML & Data Science",,Thermo Fisher Scientific,"South San Francisco, CA",,3.5,"You will drive technology selection, design and development of algorithms, machine learning / deep learning models and frameworks; you will work with other…",30+ days ago,2021-01-10,https://www.indeed.com/rc/clk?jk=42f36d134f4dcea8&fccid=126e3afd205caa95&vjs=3
"Product Manager, AI/Machine Learning",,C3.ai,"Redwood City, CA",,,"Successful candidates will have hands-on experience with machine learning frameworks and techniques, including, e.g.,TensorFlow, PyTorch, machine vision, NLP,…",30+ days ago,2021-01-10,https://www.indeed.com/rc/clk?jk=d5c65b7d266cfa42&fccid=50a61f19a5b28415&vjs=3
Spacecraft Machine Learning Engineer,,Spire,"San Francisco, CA",,,"Demonstrated working experience applying machine learning techniques and advanced data science techniques to problems.
5+ years of work experience.",30+ days ago,2021-01-10,https://www.indeed.com/rc/clk?jk=d26c4ddec22ce89d&fccid=d095eb8d761d57e9&vjs=3
Sr. Machine Learning Engineer at Marketplace Matching,,Uber,"San Francisco, CA",,3.7,"Engineering work, internships, relevant course-work, or project experience in any of the following areas: machine learning, search, ranking, recommendation…",30+ days ago,2021-01-10,https://www.indeed.com/rc/clk?jk=cee09266b215e4a2&fccid=f766f8bfbc3effb7&vjs=3
"Associate Manager, Clinical Data Sciences",,Premier Research Group Limited,"San Francisco, CA",,3.1,"Review draft protocols and CRFs for potential data collection and representation, database structure or data entry problems, and provide feedback to the project…",30+ days ago,2021-01-10,https://www.indeed.com/rc/clk?jk=3da6961ff23f52e2&fccid=ecf3f75dc407062d&vjs=3
"Director / Senior Director, Statistics/Data Science; Head of Biometrics – Hangzhou, China",,Apollomics,"Foster City, CA",,,"Work closely with medical, clinical sciences, clinical development operations, regulatory, research, project management, drug safety, and business development…",30+ days ago,2021-01-10,https://www.indeed.com/rc/clk?jk=a3b5f1d8b76b46cd&fccid=8fc1b15c34445a25&vjs=3
Machine Learning Engineer (NLP),$72 an hour,Harnham,"San Francisco, CA",,4.6,"Deep understanding of data structure, performance optimization, and algorithms.
Experience working with big data platforms such as Spark, Hadoop, Kafka, Hive,…",30+ days ago,2021-01-10,https://www.indeed.com/pagead/clk?mo=r&ad=-6NYlbfkN0ARICpNo1DhGqfodICOss3ZS6QdhS5AHh5hrs_CHOPYqyMBbpKreu8_0VPK2YpEpLZNJh0VHcoh2uBpOX4W24XIq0BbIMzobydMuLe6CS5s74HHZNx7b0CiKiEz0iq5JSeHOGf_zSExMEpfO0HT5hGTs3LrG70F1NJvhceVZI-dRR3jRjQOYtPPFe_B-hU7MU-3EvN69hncI4Sr61a9BWW94bd7vms9GRysUG6S4fL-vBmhiKD7pLpvaNqQ_QQRHv9t6W7DeeTApSD14Ksf0_wJRBzSYp5OuieNUVa8QrJLlXKdaLFauL1msKXcrOzjUXmHXXB-25w6uwMNiZYE9hHr9ST3-ifssSnXcz33kxKb4b1e1d7JgkPQWk-DCT-CtxWxGwoZFtJGc7ZTHilTvyuAynQCN153J4Knp0g1gXVAGs3qn6G16uiNNoJZXXuC6UowLWUhM3G-Kxe-BqtzHWOT1d6Fqe7Tt7eLe4SX54AoM_tb03AgMuSJLXjzu4oXY5itL16yFhEKZOPElVP7cmful6A4zrnmWk4bnvOBgKVaMEqOA34CTr_DyGQR0qG3Y75mM6z6rRxJxhh7FgmXlzNr-yFGn-o51nh5sFqZx1EvoxJj-ikeKUTBe47ESjDWY-VWq30U6sCpAo_6f-JebPr7jkF_S42Xhv3iZcQxiViQHw2qL2gqqqr6xe3RREAzwxaP_SUeBJ5boA==&p=12&fvj=0&vjs=3
"Staff Engineer, Software, Algorithm & Machine Learning",,Thermo Fisher Scientific,"South San Francisco, CA",,3.5,You will work on technology selection and solving problems that bring fundamental changes and improvements to scientific research and clinical diagnostic…,30+ days ago,2021-01-10,https://www.indeed.com/rc/clk?jk=2cdcf41667ee3a58&fccid=126e3afd205caa95&vjs=3
Machine Learning Engineer - Contract to Hire,$70 an hour,Harnham,"San Francisco, CA",Temporarily remote,4.6,"Machine Learning Engineer - 6 month contract to permanent placement.
5+ years of industry experience.
Remote flexibility (Due to COVID 19).",18 days ago,2021-01-10,https://www.indeed.com/pagead/clk?mo=r&ad=-6NYlbfkN0ARICpNo1DhGqfodICOss3ZS6QdhS5AHh5hrs_CHOPYqyMBbpKreu8_0VPK2YpEpLa-xyPlQLuiAaeWcb5wu1xsc6Dg0Wd2CuSfqKJ_EeVboHdkejKWINAKD2P8GP7YiqV-zSquwpu5XyEYCTNs82VeQ17c9FDw0rwAkt-kxs8IoNsyJQe2yOvB81unAhN5zv9fhUFBqgA_kp1RCmq-PNgeL70q0R8ithxmFhTl5YkGmyG37vgXt6-pH0n11cLlPL2c0AyecZiP1_4MFrzy_-a1C92911YA-gmnOEBR9KSAaEzqKFv-K94B3m9xeCVGthw3IHAyX-GBO99iGLUMql_oI5znG7ewgZmrxVijVo7eKRDBfiaKQW5ntOg_Oy3FXQT4IQIhsj4PXC4r2QZvW9dg_Na_ZUWWXDKo78aShkCYml-BT_WhjwCVqW5rYrDeZoQU1XQ-ukfREFdBHOIWN6g1caocJSB2U1DiyfQTmNNyEOd2iW21Mocc6Wg2E29-09mPJJ8FiDkuYt4rYeziMRp1a6l-mwfFn5tvkzfImm4-NGNx-Gr1unRer2H_Y0YpjkG54PSZO-6GDIVbvSqq1WX1vsIP_oXOkW_wPJTdKcDK_eF928GVPW-oM9yZSo-j5k4YpYN_lrLI2O6-ROB3hM1tx3iD7Vu2GuBLMOsKJtt_2InfqUGyBaa9vt_77hmMoFbOofNBSfWApA==&p=14&fvj=0&vjs=3
Staff Data Scientist - Search and Recommendation,"$215,000 a year",Harnham,"San Francisco, CA",,4.6,"Perform high-level analysis of social media data, using innovative machine learning and Deep Learning techniques.
San Francisco Bay Area + Remote.",30+ days ago,2021-01-10,https://www.indeed.com/pagead/clk?mo=r&ad=-6NYlbfkN0ARICpNo1DhGqfodICOss3ZS6QdhS5AHh5hrs_CHOPYqyMBbpKreu8_0VPK2YpEpLZ9f0Y43CQO6s8RBm7P4oTq26BKNG0Mhn7R4AJeXPTsNqPx-D_WnGIsJVcSVNl4jLAXMCZX6QhQxOzwyumFGJAMpiVbz4BwDfKiTsyl4sRqGBDfD2qZS_9mhEjkkWzA2spES2tFMR5fXuWEVUeMBsIzs_5A7lKrlkwqoEl276NPCmdUuS3qNGnd6ddJk28R29Mbry5h3NCD4FJgSV_puSWxTmcYvBy-LdMGitDZY_OornG1hIgP7C6Tnn75XjwSesSry4od5dnuNoHGG349k9DoxK_hG8J257-hfUlrnf8pupHF7YatXhjQN-VTccIs344SCEIR-yPfjj5ohRLKIcYOkeOaeivjcVuCO2AcjJTdgD082q2EuyXd0mj_CeRoXtu90j4OaqSTFUCUfuW4BEp0iBByP5GJluXm1z47B1ASHbnL5XRpiZ2ny7zcmVG_pti1mTeKktmAwt8DY8UoSHAXzMTbWn9ogsZQhf0XDgwjtQsAJQKs20mUT908XIeKWkHra1nOwtVt7L7BqxzKFQWF83Yw28sbpJwtZATofGFkcz8TVBXZaYryBAlcvr30lO5JeL8smVwxbiMpkH9FPxns_z85FYtlWCBzdqMaubpwj340tPfhdmfloQtfzuMzEPg=&p=0&fvj=0&vjs=3
